full_content,sentiment_label
"Que bootcamp de programación recomiendan? Soy civil industrial de la USM de 28 años y me tinca irme hacia el lado de la programación para trabajar en startups.
Que recomiendan y cuanto cuestan?",neutral
"Duda entre ingenierías Antes que nada me gustaría mencionar que este es mi primer post, así que pido disculpas si infrinjo alguna regla con mi publicación.

Buenas tardes. Tengo una duda que me ha perseguido por un buen tiempo, y a pesar de haber buscado en varios posts aquí, en foros de universitarios y afines no logro conseguir una respuesta que me ayude de una forma más directa. La pregunta es: ¿Es buena idea estudiar ingeniería de ejecución en informática? Explico mi situación en el siguiente párrafo.

Emigré a Chile en noviembre de 2018 (soy venezolano, estoy a tres semanas de terminar 4to medio). A lo largo de mi enseñanza media me he informado lo más que he podido sobre las carreras de informática en el país dado que desde pequeño siempre me han gustado las computadoras. Conozco algunos fundamentos técnicos, cómo arreglar la mayoría de problemas que pueden ocurrir en un equipo (al menos en el uso doméstico) y quiero proyectarme como profesional (hablo inglés de forma fluida, me encanta el idioma). De hecho en 2014 aprox. (si mal no recuerdo) hice un pequeño campamento de verano relativo a programación (habría tenido unos 12-13 años aproximadamente. El proyecto era presentar un prototipo de app para móviles en aquel entonces, ocupando un lenguaje de programación similar a Scratch).

Después de esa experiencia he estado dando aquí y allá con algunos fundamentos de programación y me he estado tratando de mantener al día respecto a las tendencias que surgen en el campo. Llegué a Chile y tal y no sé cómo se posiciona la ingeniería en informática en el país (al menos de forma actualizada).

Estoy pensando en estudiar en la USACH (ando en preu y los puntajes de los ensayos me dan la posibilidad), y como segunda opción tengo la UNAB por si el dinero no alcanza en mi familia. ¿Es viable mi estrategia? ¿Cómo se posiciona un estudiante o recién graduado de esta carrera en Chile? Teniendo en cuenta que iría aprendiendo o cursando algún extra por mi cuenta dado que la carrera se enfoca más en ser autodidacta, ¿estoy yendo por la carrera adecuada? Vivo en Santiago, por si afecta en algún factor.

En el caso extremo aplicaría a un instituto profesional, pero no creo que llegue a ese punto. Espero sus respuestas, gracias por leer mi post. Un saludo.

EDIT: añadí mi ubicación.",neutral
"¿Donde estudiar para ser piloto comercial en Chile? Se más o menos las opciones principales, que serían la escuela Golden Eagle, la academia de ciencias aeronáuticas de la Usm y la escuela aeromet, pero de estas tres cual es mejor?

Alguien con experiencia en el tema que sepa o que pueda compartir más info en el tema, cualquier cosa se agradece.",neutral
¡Que no soy Hogwarts! ,negative
"Estaré estudiando en Chile durante el 2019, me gustaría hacerles unas preguntas acerca de mi viaje Buenas tardes!

Hace unos 2 meses pregunté en un thread semanal sobre realizar un post acerca de este tema y me dijeron que estaba todo correcto, que no me iban a apalear. Buena onda en general

Les paso a comentar, entonces. Soy un argentino que odia su país con todo su amor y quiere ir a Santiago a continuar sus estudios a un país como la gente. Quizás muchos de acá me digan que no coinciden con eso de que Chile no sea un ""país como la gente"" pero cuando visité durante este verano me encantó. Y la verdad, a diferencia de tener que convivir con argentinos prefiero estar solo para toda la vida.

En ese thread había ya hecho una pregunta que era fácil: Santiago de Chile o Valparaíso? Un 100% fue a favor de la primera opción, así que no lo pensé dos veces.

Voy a dar más contexto a esto porque realmente me gustaría toda la ayuda posible. Voy a estudiar en la Técnica Santa María (sede Vitacura) desde febrero a julio del 2019 (si hay alguien que vaya a dicha universidad les juro que soy amigable). Estudiaré 'Industrias' e 'Ingeniería Comercial'.

En base a esto, aquí van todas mis dudas/preguntas/etc.:

1) ¿Puedo trabajar en pasantía con mi visa de estudiante? En caso que no, ¿necesitaría una visa aparte Y, además, la aceptación de la USM? 

2) ¿Cuál es el promedio de materias que suelen hacerse en Chile? En Argentina varía mucho según la Universidad, pero el mínimo suele ser 2 y el máximo 5.

3) Para los que conozcan de la USM ¿cuántas horas semanales son por materia? Ejemplo: Macroeconomía 1 es una matería de 3 créditos, ¿eso significa que son 3 horas semanales o no tiene relación alguna?

4) ¿Mayor cantidad de créditos significa que más duran las clases o que son más difíciles? Realmente no entiendo mucho de este tema.

5) Viva Chile

6) ¿Cuál es una buena zona para hospedarse? Cuando visité Santiago durante el verano me quedé en Recoleta y digamos que no fue demasiado agradable. No digo que haya sido una fea experiencia, pero a la noche... las cosas se ponían un poco turbias.

7) ¿Son recomendables las residencias universitarias? Estuve averiguando sobre precios en algunas (solo me pude contactar con Livinn de momento) y los precios me parecieron realmente exagerados. Llegan a pedir unos 800 dólares mensuales, algo que está fuera de mi rango (aún si pudiese conseguir ese trabajo que les comenté no me alcanzaría para ayudar a mis viejos con el pago). En caso de que residencia &gt; arriendo de departamento, ¿alguien conoce alguna con un precio lógico?

8) ¿Cómo es el clima de febrero a julio? 

9) ¿Dónde conviene hacer las compras a un estudiante? 

10) ¿Suele la gente (sobre todo en medios de transporte) ser amigable con extranjeros? Me dijo un pajarito que los conductores de bus no son de lo mejorcito para eso.

Aunque solo puedan responder una pregunta ya me ayudan un montón :)

Muchísimas gracias!",positive
"Pregunta a estudiantes de ingeniería civil industrial (mucho texto) :( *resumen : Soy un ctm que copió pa pasar las mates, y ahora me cuestan muchos los ramos pq tengo que aplicarlas, y quiero enmendar el cagaso.*

Hola, soy estudiante de Ingeniería civil industrial de 3er año de la USM, y la verdad es que ando complicado, explico:

Yo en el colegio era el ctm que no estudiaba y le iba la raja, y en todo, la wea es que por eso no se estudiar, nunca estudié, nunca lo necesité, yo entendía todo en la clase. El tema, es que en la universidad es imposible aprender solo de la clase, pq es mucha más materia. la wea es que el primer año todo bien (excepto por un paro de 3 meses xd) pero pase mis ramos bien, las mates me costaron mas que la chucha, pero pase todo al final. El tema es que ya en 3er semestre, con pandemia, full online, clases como el pico, osea aprendía menos en la clase, estudiaba menos pq estaba en mi casa y toda la wea, entonces me costó caleta, y pase mate 3 copiando ( si soy un ctm, me lo recuerdo todos los días) . La wea es que, obvio, como no sabia nada de mate 3, en mate 4 pase copiando también, y después física 2 (electricidad y magnetismo) como que al final el hecho de tener clases online alimento mi flojera y busqué el camino más fácil y puta, ahora estoy en 3er año, con unos vacíos enormes por esas mates y esa física (todo lo demás lo he pasado honestamente), sin saber estudiar todavía, una conciencia como el pico, y me siento terrible atrapado y angustiado. Y quiero solucionar mi situación de alguna manera, me carga estar pasando a costa del resto. Tengo varias opciones: cambiar de U, de Carrera, tomar clases particulares, etc. y quería saber si algún alma benevolente podría responderme y guiarme a pesar de ser una escoria.

1. Si alguien es de la USM o de otra universidad sabe si, después del 3 año, necesito mucho las mates? se que obvio tengo que usar lo básico, integrales, derivadas, matrices probablemente, pero es mucho? o la verdad es que se vuelve más teórica la carrera? o necesitaría llenar ese vacío de conocimientos para seguir avanzando? adjunto mi malla, rayado con rojo lo que ya pasé o se que pasaré este semestre ( termo y electrotecnia me tienen complicado)
2. Tengo entendido que en la USM las mates tan cuáticas, y me di cuenta que no me gustan tanto como pensaba en el colegio, entonces mi duda es si es que en otra universidad (y en cual) la carrera de ingeniero civil industrial es menos enfocada en las mates, osea que los ramos que siguen, obvio tienen mates, pero quizás se van mas en la volá teórica, que se me hace más fácil a mi. ( ojo, no estoy buscando algo más fácil, pero en una de esas otra U tiene un enfoque que me acomoda más)(ojalá no sea muy cara, el arancel de la usm actualmente es 4.7 millones anuales, ojalá que no se aleje mucho de eso:( )
3. Si alguien por casualidad conoce sobre la posición de la universidad en términos de calidad según el mercado laboral. osea cuando le llegan los currículos a un wn en una empresa, los de USM son importantes, o son cualquier wea? o eso no existe? Es típico que dicen que algunas empresas onda agarran los CV de ciertas universidades la chile y la cato ponte tu, y el resto no los pescan, es un mito? sjksj
4. ¿Cuánto costarían unas clases particulares para poder ponerme al día con las mates? 
5. Cualquier otro consejo sobre metodologías de estudio, la carrera, la/s universidad/es u otra cosa es super bienvenido

No quiero que se malentienda, me gusta mucho mi carrera, o siento que me gusta, tampoco he tenido muchas experiencias cercanas debido a clases online. y para mi es importante que me vaya bien y entender las cosas. Cometí el error de caer en la tentación de copiar, y ahora estoy pagando por eso, y de verdad quiero enmendarlo, pero la situación me abruma mucho:(

pd: las mates en la USM son conjuntas, osea Mate 1 es calculo 1 y algebra 1 en un ramo, por lo que es caleta de materia

Sorry todo el texto, tengo 0 capacidad de explicarme en pocas palabras xd",negative
"¿Mejor universidad para Ingeniería Civil Industrial? A una semana de la entrega de puntajes PDT, estoy en duda para hacer la elección de mi casa de estudios. Tengo como primera opción la UC, luego la UChile y finalmente UAI o USM.

¿Qué opiniones me podrían dar de las últimas 3?, ¿Cuál me conviene? Quiero poner mucho énfasis en internacionalización, innovación, liderazgo e investigación. 

Espero sus comentarios, cualquiera es bien recibido :)",neutral
"Campo laboral técnico ambiental Hola, tengo pensado estudiar técnico en control del medio ambiente en la usm el año que viene, pude hablar con la jefa de carrera y me dijo que todos salían con pega de sus mismas prácticas. Pero quería preguntarles si alguien de acá sabe que tan bueno es el campo laboral por lo menos en la Región de Valparaíso",neutral
"universidad para estudiar ingeniería civil industrial en chile? el próximo año me toca estudiar y no se cual universidad elegir para estudiar ingeniería civil industrial tengo entendido que si un ingeniero saca la carrera en una universidad penca no son muy contratados o solicitados  a comparación de una universidad top o tradicional  esto es verdad o solo es un tabú que tienen con las universidades ?

ya que siempre escucho o leo de gente diciendo que por penca que es una universidad no los contratan y otros que dicen que son de la chile  y aun asi no hay mucha diferencia hablando ya sea de infraestructura y profesores  entre otros

si estudio ingeniería como por ejemplo en la u mayor en ves de una tradicional como la chile o la usm habrá mucha diferencia profesionalmente mas adelante ?

&amp;#x200B;

&amp;#x200B;",negative
"Ing. Civil química Usach Hola alguien que estudie ingeniería Civil Química en la usach y me de su opinión, soy de la usm y por salud mental me quiero cambiar. HELP p",neutral
"Título chileno sirve en el extranjero? Hola, actualmente estoy estudiando ingeniería civil industrial en la usm y quería saber si pescan ese título en el extranjero. Alguien de acá ha tenido alguna experiencia trabajando en otro país con sus títulos chilenos?",neutral
"Alguien , ing. informática UTFSM viña del mar? Hola ! , Alguien sabe si en la de Usm, campus viña del mar, ¿ingeniería en informática es una buena opción ? O si vale la pena estudiar una ingeniería a secas y no civil .

Cualquier cosa que sepan sirve (^-^ ) , gracias :3.",neutral
"Dudas sobre un area ""nueva"" y continuidad, cuenta tu experiencia Hola gente hermosa y no tan hermosa de este sub, tengo 26 y queria sus opiniones de gente más experimentada y no tan experimentada.  


Estoy terminando un tecnico ([este](https://portales.inacap.cl/carreras/Area-Automatizacion-y-Robotica/Tec-en-Automatizacion-y-Robotica/index)). Resulta que nunca he sido el estudiante más brillante y me cuestan bastante los numeros, por gracia (y desgracia) tras haber trabajado en pegas ~~de mierda~~  no cualificadas (8 años al ingresar, y si, de los 16 trabajo) y ver el trato hacia todos en general de quienes si tenian estudios por minimo que fueran decidí quemar mis ahorros en estudiar.

¿Que pasó? resulta que mi meta como la muchos imagino, es trabajar lo menos posible pero ganar algo que me permita desarrollarme a medida que escalan mis prioridades en la vida. ¿Que tan rentable se ve?  
Entré y me he quemado la mente  unicamente por la plata, por cosas del destino me terminó gustando y pensaba lo siguiente:  


* Como tecnico me puede ir muy bien, aunque soy bien ignorante del sueldo promedio a corto plazo. Entonces como mi meta es ganar plata pensaba en hacer una continuidad [acá](https://usm.cl/admision/carreras-vespertinas/ing-ejec-control-instrumentacion/), mientras se trabaja no se ve tan salado teniedo 3 clases a la semana y cosas que ""ya sé"". Pero leyendo por ahí, varios dicen que es mucho mejor irse a electricista para conseguir la licencia SEC A que se otorga solo a ingenieros electricos y afin. Esto no es afin, o eso entiendo por mucho que se vea arto cableado, calculos, fisica, etc. PERO ¿monetariamente cual rentaria más? (recuerdando que la idea es trabajar lo minimo por plata para ser feliz, no asquerosamente platudo)
* Otra opción de vida que tenia era ahorrar y ver si ganaba alguna working hollyday para ver si me quedo trabajando en algún lado y mandarle a mis hermanos chicos para que estudien. ¿Alguien a estudiado algo similar y se fue? ¿Que tan cotizado es fuera? ¿Porque el chileno inventa tanto nombre de carrera? Me a costado un mundo encontrar el bachelor degree equivalente y sigo dudoso.  
Mi ingles es decente, jugue  **albion online** ~~es un mmorpg no lineal en el que escribes tu propia historia~~ antes de ser un juego de compra-venta de divisas para paises tercermundistas y tuve la suerte de conocer gente muy linda que me enseñó en base a practica tanto oral como escrita el idioma. La meta seria Nueva Zelanda o el pais donde todo quiere matarte (meme).",neutral
"Han habido hartos videos chilenos en el frontpage El otro dia hubo uno de unos cabros de la usm pegandose en la cabeza con unas cacerolas, hubo uno en bellavista de un conpadre tomando una chela mágica y hoydia recien habia uno de los stickers negros.

Cabros tenemos que difundir mas weas tipicas chilenas! Nos tomamos Reddit",neutral
Transición Energética en Chile - Universidad Técnica Federico Santa Maríaa [44 Minutos] ,neutral
ohh boi you better come to conce ,neutral
¿Donde pasarás el año nuevo? ,neutral
"Mejores universidades para Ingeniería Informática Wena cabros,me llegaron los resultados de la pesheú y estoy investigando cual es mi mejor opción para informática,tengo 4 universidades en mente,la Católica,la Chile,Usach y la Federico Santa María. A la usm y la usach entro cagado de risa,en la Chile estoy como 6 puntos más arriba del ptje de corte y el la cato no entro de momento(ojalá baje el ptje), afortunadamente lo económico no tengo mucho problema(aunque igual estoy viendo si puedo postular a becas y beneficios) así que lo que más me preocupa es cual de estas son las que tienen mejor desempeño en está carrera. De momento mi orden de postulación es 1-UC/2-Chile/3-Santa María o Usach, así que si pueden orientarme en esto les agradecería.",neutral
"No me postule al FUAS 2021 Fui aweonao y quedare en bancarrota si me meto a la USM ? 

No entiendo nada help. Este año salí de 4to Medio y quiero entrar a la U y los aranceles anuales son de 2 hasta 4 millones.

El FUAS me habría ayudado bastante con varias temas economicos?",negative
"Duda sobre la comunidad universitaria en Viña/Valparaíso Soy un estudiante de 4to medio de Valdivia que el próximo año quiere irse a estudiar a la Universidad Federico Santa María y tenía una duda en relación a como son los estudiantes allá, porque me han dicho que la mayoría de los que se van a estudiar allá son zorrones debido a las universidades que hay en ese sector. Es esto verdad? Alguien que haya estudiado en la USM o en otra universidad de viña que pueda contarme su experiencia?",neutral
"Emprendedores/as que hayan partido en una incubadora de negocios, les quiero preguntar sobre su experiencia Tengo una idea para una startup de base tecnológica y quiero buscar orientación sobre cómo llevarla a la realidad mediante una incubadora, o mejor dicho pre incubadora. Qué tan desarrollado debería estar para poder presentarla? Aparte estudio en la USM y por defecto consultaría con el 3IE.

También me gustaría leer sus experiencias, lo bueno y malo, qué incubadora escogieron y que lecciones rescatan. Los leo, gracias por su tiempo.",neutral
"Computer Science degree taught in English in Chilean Universities  Hello, I was wondering if you have any idea if there are any universities that offer the Computer Science program in English? STRICTLY in English.   


Thank you.",neutral
Busco comunidades que jeuguen Rol o Juegos de Mesa Hola! Ando buscando comunidades o gente que se junte a jugar juegos de mesa o juegos de rol; como D&amp;D... O juegos de mesa como Catán.,neutral
"Duda convalidaciones de universidad externa a PUC Buenas Tardes, quiero cambiarme de la USM a la PUC y tengo la duda entre la diferencia en cuanto a las convalidaciones en cuanto a la admision,  ¿ Tanto por admision regular via PTU o admision especial convalidan ramos o es solamente por admision especial donde te convalidan los ramos?  Gracias de antemano a quien haya hecho algo similar",neutral
"Notebook para universidad y juegos casuales Holap, este año entro a ingenieria civil en informatica en la usm y bueno, llevo trabajando en una fruticola desde el 10 de dic y tengo ahorrado mas o menos 500k para un notebook,  tengo pensado [este](https://www.solotodo.com/products/50966-asus-vivobook-s15-s510un-i7-8550u-8gb-1tb-16gb-optane), pero resulta que yo como no se mucho del tema lo que hago es buscar reviews y estadisticas y en una pagina salia que no era una compra recomendada, y la cosa es que como trabajé caleta quiero hacer una buena compra y no arrepentirme jeje.

Como dice el titulo el notebook lo usaria para la universidad y para sus juegos casuales (isaac, lol, y quizas fortnite ya que un amigo me pide que lo juegue) , para mi lo ideal serian que dure harto la bateria, pese poquito, que tenga 8gb de ram y otra duda que tengo, ¿Es mejor comprar uno de 4 o de 8 gb de ram? en el sentido de que si sale mejor comprar el de 4 y comprar 4gb. ¿Es mejor?¿Sale mas barato?

No se si este post esta en el lugar correcto porque la verdad llevo ocupando reddit como unas 2 semanas :P

Gracias.",neutral
"Alguien que esté estudiando o conozca sobre la carrera de Ingeniería Comercial en la UdeC (Sede Conce)? Cómo es la carrera ahí? Cuál es su enfoque? Cómo es el ambiente? Sería buena opción estudiar esa carrera ahí si también me alcanza para la UDD, USM, UDP, UANDES y UAI? Saludos",neutral
¿Humano egresad@ de tec. Química utfsm? Os leo.🦦,neutral
"Investigación del CEP revela que colegios particulares ""inflan"" notas, manteniendo sesgos económicos ",negative
"Trabajo en el observatorio ALMA, AmA Ayer se hizo el anuncio de la primera imagen del agujero negro que se encuentra en el centro de nuestra galaxia hecho a través del proyecto EHT y el observatorio ALMA ubicado cerca de San Pedro de Atacama fue una parte relevante de este proceso.

Actualmente trabajo como ingeniero electrónico en el observatorio y si tienen consultas que hacer sobre la operación y mantenimiento de este instrumento, bienvenidos sean.",positive
"En que carreras se destaca la universidad Andres Bello? Hola buenas, para dar un poco de contexto tengo 19 años, sali con buen puntaje PAES (aunque planeo darla denuevo) y me tome el año para trabajar mientras veo bien que estudio.

Con todo eso dicho, estaba viendo que opciones de universidades tengo y una de las mas accesibles (por no decir una de las pocas) a las que podria entrar *seguramente* es la Andres Bello, Ahora, no he investigado mucho de esa U en particular pero por lo que vi tiene una carrera en el area de la tecnologia de la informacion que me interesa (ing. informatica). Lo unico malo es que no he escuchado a mucha gente hablar de esta U, ya que siempre se habla o la de Chile o la Catolica.

Alguno me podria ayudar para saber si vale la pena estudiar ahi?",neutral
"UAI - Ingeniería Civil en Minería Alguien estudiando está carrera en la UAI o con algún conocido que me pueda compartir sus impresiones? Se que se ingresa en plan comun de Ingeniería Civil y en el 3er año se escoje por donde continuar. De momento me  la Ingeniería Civil en Minería. 

Se que no es la Cato, ni la Chile o la UTFSM pero el enfoque de la carrera tecnico-gerencial como lo presentan me parece interesante. ",neutral
"Ingeniería civil informática Quiero estudiar ingeniería civil informática, pero nose en que universidad, he visto la usach, la ucn y la de conce

Nose si tienen otra universidad que recomienden para esta carrera o algún consejo o algo sobre estas tres universidades ",negative
"Magíster en energía ¿sí o no? Hola redittores, soy 34M, trabajo en mtto de equipos de termoeléctricas. Quiero especilizarme en reconversión de este tipo de plantas, y fortalecerme en el rubro.

Soy ici, y quiero especializarme, no sé si tomar el magíster de ing de la energía de la UC (el MIE) o el Magister en economía energètica de la UTFSM.

Qué programa recomiendan tomar? Aconsejan otro?

Gracias!",neutral
"¿Que tan normalizado está el copiar en las universidades chilenas? Vi recién un post preguntando acaso la gente del sub ha copiado alguna vez en la U y mirando las respuestas me parece que se está abriendo el melón de lo normalizado que está copiar en las universidades chilenas. 

Yo estudié hace ya unas dos décadas atrás en una universidad de región y debo decir que la copia estaba bastante normalizada. No sólo que muchos de  estudiantes trataban de copiar, sino que en algunos casos era obvio que los profesores se hacían los lesos, incluso  en algunas ocasiones hasta salían de la sala dejando a toda la clase sola por diez minutos o más, en los que pasaba de todo. 

Entonces la pregunta que me nace es, ¿Que tan normalizado está la copia en las universidades en Chile? Porque en ese entonces yo pensaba que era algo de mi facultad solamente, pero leyendo el otro post me quedó la sensación de que es algo mucho más generalizado y de lo que se habla muy poco.",negative
"Diferencia entre ingenieria (a secas) e ingerieria civil? Eso, no tengo claro cual es la diferencia en términos de estudio y laborales",neutral
"¿Sueldo de Ingeniero Civil Industrial sin experiencia? (Tips para encontrar trabajo se agradecen igual) Hola, feliz martes.  


El año pasado me titulé de Ingeniero Civil Industrial de la UTFSM, Casa Central. Después de darme un descanso estos meses, estoy comenzando a postular a trabajos, pero respecto a la pregunta de ""pretensiones de renta"" me queda la duda de cuánto es un monto razonable a pedir (líquido).  


Según MiFuturo, el suelo bruto de ICI de primer año para el 2023 fue de de 1.719.151 CLP mensuales ([MiFuturo](https://www.mifuturo.cl/buscador-de-estadisticas-por-carrera/)). Considerando impuesto a la renta, AFP, Fonasa y descuentos menores, entiendo esto debiera derivar en torno a un sueldo líquido de 1.4M.  


He escuchado sueldos líquidos en torno a 1.3M y 1.5M, pero quería consultarles igualmente.

Quería saber si alguien me podría ayudar con esto; si ustedes saben o conocen de alguien que haya encontrado trabajo el año pasado o este, en qué y su sueldo líquido aproximado.

Igualmente, agradecería cualquier tip que tengan para encontrar buen empleo.

Muchas gracias.",neutral
"Mejor universidad de chile? Cual es mejor, la universidad Católica o la U de Chile y porque?",neutral
