full_content,sentiment_label
"Me arriesgo a meterme a una U para estudiar ingeniería en informática o me meto al duoc y filo? Sé que ya hay muchos post de esto pero como mañana se entregan los resultados de las postulaciones y luego empieza el proceso de matrículas estiy desesperada y todavía no sé por qué chucha decidirme, y la verdad me ayudaría muchosi alguien de ustedes pudiera aconsejarme :(

Me interesa ess carrera y postulé a la unab, la usach, la udd y la utfsm. Hasta lo que ví quedo en todas, pero el tema es que no sé si dar el siguiente paso y matricularme en alguna pq me da demasiado miedo que me hagan mierda a puras matemáticas y no poder aguantar. He estado revisando las mallas curriculares y hasta ahora la que se ve más """"""piola"""""" es la de la utfsm, pero otra cosa es con guitarra ya una vez dentro de la u misma.

Estos últimos meses me he dado cuenta de que las matemáticas me gustan y que si le meto color las puedo entender (Contexto: en el colegio no les di mucha bola y me iba más o menos pero ahora que me tuve que poner a estudiar para la paes le puse color y hasta me fue bien en la M1 pq me di el tiempo de estudiar y entender materia a la que antes me la pasaba por el ñackson). Pero aún así sé que en la universidad ya es distinto. Pienso que, si me meto a alguna de esas universidades, voy a tratar de repasar lo que más pueda la materia de la malla o lo que me sirva para nivelarme, pq he visto que está lleno de clases de eso en youtube y hasta hay clases de las universidades subidas ahí mismo (No las había revisado antes por temas de tiempo y pq tampoco alcancé a estudiar todo pa la m1 y m2, so igual me siento media desnivelada).

También he leído mucho por aquí que en informática el lugar de donde saliste importa poco, sobre todo pa irse a trabajar  otros países (Que es una de mis metas), e incluso lo he visto a través de miembros de mi familia que estudiaron en institutos pencas y ahora tienen buen sueldo y viven de lo más bien (Porfa no me digan que les pregunte a ellos pq con esas personas actualmente tengo 0 contacto y/o simpatía). Por eso también creo que tal vez sea innecesario meterme a una U a quemarme las neuronas si puedo meterme a un instituto y, aunque tal vez me cueste un poco más al principio, lograr lo mismo que lograría habiendo salido de una U.

Mi opción de instituto es el duoc, del que he visto buenas opiniones y me llama la atención el hecho de que después podría sacar diplomados en la católica (no sé si sirvan tanto pero igual me llama la atención) o tal vez hacer lo mismo en otras universidades. También me atrae el hecho de que en dos años podría sacar el título de analista porgramadora y empezar a trabajar mientras estudio para sacar la ingeniería, y así podría ir ganando experiencia laboral y también ir juntando money.

Siento que debería arriesgarme con una U y poder probarme que soy capaz, pero también dudo de ser capaz de poder sacar los estudios en una universidad.

Qué opinan ustedes? Algún consejo que puedan darme? Qué saben de las universidades que nombré y/o del duoc? Cualquier ayuda me serviría y se las agradecería muchísimo:), las/los leo.",negative
"Magister en énergia Hola a todos! (yo de nuevo xd)

Tal cimo reza el tîtulo: Estoy recolectando experiencias sobre magisteres en el àmbito electricidad/énergie. Acudo a sus experiencias y sapiencia: ¿Vale la pena?

He visto la UC , UTFSM y UAI. Creo que ese es el orden de interés. 

Mi duda grande también es si es mejor el magister en ciencias de la ing o seguir alguno de estos programas , cuyo caràcter es profesionalizante.

De verdad, toda ayuda me sirve.

Gracias a todos!

",neutral
"ABRO Ama DE DUDAS DE BECAS CAMBIO DE CARRERA y DE U; ELIMINACIONES DE CARRERA, CONVALIDACIONES, estudios de ING CIVIL... Eso, redditores,  estuve primero en un IP con el nombre del libro de Ercilla (conta) de ahí trabajé, pasé a la UTFSM en el 2019,  mal año , a civil industrial y me cambié a la USACH sobreviviendo de una fea (carta de eliminación injustificada).... bueno he visto, he ayudado, fui ayudante de la u, estuve apoyando en inclusión, la VRA y a las asistentes sociales. Pregunten lo que quieran y con gusto ayudo. La idea es que no se dupliquen las dudas.

Ams, además pueden preguntarme por becas y gratuidad, FSCU y CAE.

Los leo.

  
edit: es AmA y me di cuenta del mal tipeo después.",neutral
"Qué logos de universidades/ip o cft les gusta más?  Me gusta el de la universidad de chile, el de la universidad de playa ancha, la católica de Valparaíso y la católica de chile",neutral
"PUC o UCH para Ingeniería Verán, voy en 4to Medio preparándome para la PDT (ex PSU), siempre le he puesto weno a los estudios, áreas como la Matemática y la Física me encantan, en los ensayos del preu me está yendo bastante bien como para entrar a cualquiera de las 2, quiero estudiar Ingeniería Civil para probablemente después irme a Informática o Matemática, la cosa es que de toda mi vida había querido ir a la PUC ya que había ido reiteradas ocasiones allá (talleres, competencias, etc.) y San Joaquín es sencillamente hermoso, pero últimamente como he hablado con harta gente me han dicho que la UCH igual era super buena, y que de hecho su enfoque es mucho mas matemático que el de la PUC, y que en esta a la gente se le enseña a fabricar dinero y que aparte si no traes puesta una chaqueta North Face te miran en menos y cosas así, por favor si hay gente que ha ido a estas universidades que me cuente su experiencia plis :c, creo que preferiría a ser un ingeniero/informático capo a ser una maquina de dinero (que es como me han descrito la PUC) gracias de antemano

EDIT: En temas de distancia San Joaquin me queda a 1 hora y Boxef a 15-20 minutos",positive
"Mejores universidades para estudiar informatica?  Lo del titulo básicamente. Quiero estudiar ing. civil informática/computación, pero no se cuales son las mejores de chile para estudiar eso. Hasta ahora la PUCV y la UDP son como mis principales candidatas, pero también he visto la usach, uchile, puc, utfsm y la udec. 

  Cuáles crean que sean las mejores? Tipo, por lo que han escuchado o demás. Por ahora, dependiendo de si me dan becas o no, yo creo que estoy tirándome más por la UDP porque Santiago es Chile y puedo conseguirme una beca parcial, pero igual quiero ver qué opina mi sub querido.",neutral
"usach o la pucv para estudiar ingeco? En unos pocos días más se sabrán los resultados de la PAES y veo poco posible que el puntaje me dé para estudiar en la chile o la puc, y dicen que la UAI es bien cara. Las 2 que mencioné en el título son las otras que tenía como alternativa, pero también tienen sus mañas, la cuestión es que buscaba estudiar en una u que tuviera la mención en economía, cosa que la pucv no tiene y la usach si, pero esta última por lo que leí tiene la fama de irse a paro a cada rato, lo cual me complica porque soy de región:(. 
¿O debería darme el año mejor? 
Agradecería mucho también si me pudieran nombrar otras u que tengan la mención.",negative
"Alguien sabe como terminan los egresados de una carrera científica en Chile? Tenía planeado licenciarme en física, porque en el colegio me iba siempre bien sietes piola y me gusta,  di la PTU me fue bien y en general pondero entre 740, pero con la llegada de la pandemia/clases online me decidí tomarme el año para ayudar el negocio familiar. El punto es que dudo de estudiar la carrera, pq el sesgo general es que te dediques a estudiar una ingeniería si eres bueno para la matemática, pero nunca me tinco mucho la idea en comparación de ser científico afín. Aún así, ver que la investigación es bastante competitivo y el financiamiento es escaso, aún hablando en el contexto al salir al extranjero, desmotiva. A la vez, tampoco se si al terminar hayan muchas oportunidades dentro de Chile. Entonces quería saber si vale la pena estudiar carreras en el área de la ciencia o que alguien que este estudiando y que quiera compartir su experiencia.

P.D : En cuestión a la hora elegir u, cuál creen que es mejor en general, ambiente y en facultades?  (PUC, UDEC, UCH, UTFSM)",neutral
"Consulta Técnico Informática Hola. Tengo una duda sobre la carrera que quiero estudiar, si me pueden ayudar se los agradecería.
Me gusta el área de la informática. Mi idea es estudiar una técnica primero, durante ella aprender por mi cuenta todo lo que pueda y especializarme con cursos en un área especifica. Cuál será mi mejor opción?

- Técnico en Informática en la UTFSM
- Analista Programador DUOC
- Analista Programados INACAP

He recibido buenos y malos comentarios de las 3.
Si hay alguien que esté estudiando o se haya titulado de alguna de estas carreras, para saber también su empleabilidad.
Muchas gracias!

PD: También he considerado estudiar Ingeniería en Informática",neutral
"Ingeniería en informática en Duoc UC Disculpen lo latera por andar preguntando sobre las mismas cosas a cada rato sbsbsb perp de verdad estoy en una encrucijada.

Me gustaría estudiar ingeniería en informática pero por temas de plata y puntaje el único lado donde podría hacerlo  sería en un IP o alguna institución de esas. Estaba pensando en hacerlo en el Duoc porque mucha gente me lo ha recomendado y además de otras cosas es el que veo que más me tinca. Lo penca es que sé que no es una universidad y por mucho que sea el Duoc capaz que igual cuando quiera empezar a trabajar me miren en menos por solo haber salido de un instituto, aunque también conzco casos muy cercanos (De familiares) que estudiaron solo en institutos carreras súper parecidas a la que quiero estudiar yo y por haber salido de institutos nunca los ningunearon y de hecho ahora les va súper bien (Incluso mejor que a algunos compañeros de trabajo suyos que sí salieron de universidades).

Es por eso que les quiero preguntar si saben sobre esto, si es que el campo laboral se me limita mucho solo por haber salido de instituto o si en realidad no pasa nada, cuánto me podría demorar en hacerme una carrera más o menos respetable pese a haber salido de un IP, si es que hay algo que podría hacer mientras estudio para que me pesquen un poco más a la hora que ya egrese y empiece a buscar pega, etc. Todo lo que sepan relacionado a esto me sirve mucho, y se los agradecería si pudieran compartirlo conmigo :), los voy a estar leyendo.

(Sé que dije que tengo familia que se dedica a esto y que podría preguntarles a ellos, pero decir que me llevo mal con ellos es decir poco y la verdad es que tenemos 0 contacto, por eso prefiero preguntar por aquí)",negative
"Estudiante Ingeniería, Busco Práctica Este es quizás el medio más informal que hay, pero no pierdo nada con intentarlo. Estudio Ing Civil Electrónica en la UTFSM y busco práctica profesional ojalá que esté relacionada con control e instrumentación de procesos. Ya postulé a CODELCO y algunas otras empresas, cualquier dato o tip se agradece. 
Saludos",neutral
¿Que recomiendan ustedes para el día del patrimonio? Yo iré a ver esto. ,neutral
Editoral de El Mercurio un día antes de la matanza en la Escuela Santa Maria de Iquique ,neutral
In 1907 in the city of Iquique potentially thousands of striking workers and their families were killed during the Santa Maria School Massacre ,neutral
"Películas dobladas en sector poniente Cómo es posible que prácticamente todas las funciones del sector poniente de Santiago sean dobladas y en el sector oriente sea todas subtituladas?! Los del Cinépolis creerán que somos tontitos? Existirá algún registro indicando que realmente no podemos leer subtítulos? 

Que rabia que siempre sea así!",negative
Mejores colegios PAES proceso de admisión 2025 ,neutral
ahhh que bonito el sur de chile (foto tomada en santa maria de pua) ,positive
"(pal-paraiso) metro de santiago a 2039 En 2021, Santiago perdió gran parte de su poder político al perder su estatus de capital, aunque su repentino aumento de población compensó parcialmente esta pérdida.

Para 2039, la ciudad de Santiago del Nuevo Extremo será la ciudad más grande del Reino de Chile con más de 13 millones de habitantes. También tendrá el sistema de metro más grande del país, con 995 km de vías y 849 estaciones, lo que lo convertirá en el segundo sistema de metro más grande del Reino y del mundo, solo superado por el de Buenos Aires.

Es el componente central del sistema de transporte de la ciudad, junto con el tren de cercanías y el sistema de autobuses de tránsito rápido Transantiago.

Y es motivo de orgullo para los habitantes de Santiago.

El metro conecta con todos los medios de transporte de la ciudad.

Entre ellos se incluyen los trenes de cercanías, los trenes de larga distancia, los trenes de alta velocidad, los tranvías, los monorraíles, los funiculares, los teleféricos y el Aeropuerto Internacional de Santiago.",neutral
El mundo fantástico de los shaper locos! ,positive
"¿Qué diplomado elegir para avanzar en ingeniería civil industrial? Buenas gente,

Como dice el titulo simplemente nose que wea elegir, tengo 24 años (H) y saque Ingeniería Civil Industrial en la UA (Universidad de Antofagasta).

Como contexto trabaje como Analista de datos durante 1 año (me desenvolví bien pero termine renunciando por temas de lucas/responsabilidades) y actualmente llevo 4 meses como Analista de Confiablidad para una empresa que presta servicios a minería (gano el doble que mi pega anterior, ya titulado), la pega es buena y ya tengo indefinido por ciertos proyectos que presente y dieron muy buenos resultados.

La duda realmente es que aqui donde estoy la mayoría tiene el diplomado de ""Gestión de Activos"" de la federico santa maria y tal vez todo apunta a que tomare ese, pero realmente con mis conocimientos y mis gustos me atraería mas tomar uno de inteligencia artificial o algo por el estilo, mas que uno que se enfoque en mantenimiento o equipos, algo mas ""avanzado"" por asi decirlo, ya que el conocimiento técnico lo puedo adquirir con practica/terreno que esta misma empresa me ofrece (tambien tengo mi tecnico medio electromecanico que me ayuda harto con esto igual)

De igual forma siento que el diplomado que tome ya seria suficiente para mi con lo relacionado a estudios, así que igual es importante para mi, ya que seria esto y nada mas, no tengo pensado hacer un magister por el tema de tiempo/plata y por quedar como sobrecalificado para ciertos trabajos. (Es posible que otro diplomado si, pero no mas que eso)

Obviamente la finalidad de esto es el tema +lucas y oportunidades, quizas optar a algun teletrabajo y porque no algun cargo alto, principalmente optando a mineria ya que no es opcion para mi trabajar en algun banco o algo mas de ciudad.

Esperar unos años mas para ver donde va mi futuro profesional sin apresurarme a estudiar algo tambien es una opcion, pero siento que mas adelante no lo hare o ya cuando pase 1 año sentire la desesperacion de no haberlo hecho y quedar atras competitivamente

Se que no sere el unico que haya pasado por esto y me gustaria leer sus experiencias, consejos y que universidad es mejor para continuar con un diplomado.

Agradeciendo su tiempo los leo",neutral
TV Chilena un mes de mayo de 1987 (de parte del diseño más confuso de una grilla programatica) ,neutral
Valpito ,neutral
Camara de Diputados define a 12 miembros de la comisión de expertos ,neutral
El Mercurio ,neutral
Hoy se cumplen 116 años desde la matanza en la Escuela Santa María de Iquique ,neutral
"Hombres que se han hecho una lipo o procedimientos esteticos Buenas amigos redditores, quisiera saber si podrian compartir sus experiencias con este procedimiento.

Hago deporte y en general me cuido harto pero hay una grasa que definitivamente no baja, siempre que hago procesos de definicion bajo mucho de peso y gano masa muscular pero la zona del pecho y abdomen bajo no baja al punto de como quiero que se vea. Asi que fui por un hack y estoy cotizando una lipo en esas mismas zonas, el doc me ofreció lipo + retraction para la zona del pecho y abdomen en la Santa Maria.  
Lo has hecho o conoces a alguien que lo haya hecho? Me compartirias tu experiencia?

1. Cuanto pagaste.
2. Recomiendas algun lugar?
3. Valio la pena?

Muchas gracias!",neutral
"Canciones oscuras/Densas/Perturbadoras de autores Chilenos? Aprovechando que fue halloween hace 2 días jjjjaa.
Me interesan estas 2 cosas: el terror/lo oscuro y la música. He estado tratando de averiguar canciones con trasfondos densos u oscuros, o también su sonido. Como ejemplo puedo dar ""Confesiones de un psicópata en La Dehesa"" de Cevlade, hablando sobre el Tila. También la cantata de La matanza de la escuela de Santa Maria de iquique (siendo más, un ""álbum""). Las canciones de ""Neblinum"" también caben, estoy acostumbrado a la música que suena fuerte y densa, pero me impactó cuando se ponía a llorar en una de sus canciones... y bueno, ahí pueden mencionar algunas!",neutral
Visita del humorista Manolo González al Presidente Electo Eduardo Frei Montalva. Revista Ercilla 1964. ,neutral
