full_content,sentiment_label
"Ingeniería de ejecución o civil informática Hola la muchachada, estoy en un dilema, actualmente estoy titulado en Analista programador y quiero seguir estudiando, la informática es algo que me gusta y me di cuenta cursando el técnico (salió carita la orientación vocacional), mi dilema es, voy por la Ingeniería de Ejecución en Software en la USM o me tomo el tiempo para estudiar para la PAES y entrar a una Ing civil en informática en cualquier U?  
  
Actualmente voy para los 24 años y me gustaría sacar la civil solamente para obtener la licenciatura en ciencias de la ingeniería, pero el tema es que igual es harto el costo, el tiempo y el esfuerzo que invertiré en sacarla pero tendría la formación para dedicarme a Machine learning o cualquier otra rama que no sea simplemente desarrollo de software.

Que opinan, creen que este bien irme por la civil o estoy puro weando y debería irme a la de ejecución?",neutral
"Vale la pena el cambio? Hola a todos, buenas tardes, estoy en 2 año de ing civil informática en la usm, y me están ofreciendo cambiarme a civil mecánica en la misma u, lo que pensado bastante ya qué en física la pase mucho mejor que en programación (python, tuve que dar 3 veces el ramo para pasarlo), tendría que pagar 3.5 años con cae y 1 con el fondo solidario. Según algunos profes me conviene el cambio ya que según ellos es un campo menos volatil. No se que tan cierto sea eso, si alguno de aquí me pudiese orientar un poco más se lo agradeceria. Tengo 22 años y algo de miedo sinceramente, estaría saliendo con 27-28. Realmente valdria la pena al largo plazo? tipo como para tener algo muy seguro y eatable ojalá. Los leo, de antemano muchas gracias.",neutral
"Ing. Informática o Ing. Civil Informática Hola, quería pedir orientación. Estuve un año en Ingeniería Civil Industrial en la UCSC (soy de región) y me di cuenta de que lo que realmente me interesa es la informática. Ahora estoy dudando entre seguir Ingeniería Civil Informática en la UCSC o cambiarme a Ingeniería Informática en la USM (sede Concepción), donde no existe la opción con civil. Me preocupa si vale la pena sacrificar el “civil”, considerando que he escuchado que en informática se valora más la experiencia, los proyectos y el portafolio. Ya estoy estudiando programación por mi cuenta y también he considerado opciones como DUOC. Agradecería cualquier orientación o experiencia.",neutral
"Es buen plan? Estoy estudiando civil informática en la usm, me ha ido más o menos, tengo 22 pero según lo que veo estaría saliendo como a los 26-27. El tema es que la u ofrece una prosecución si sacas una civil creo, te dejan comercial en como 2.5 años y civil industrial en 3.5. 

Me llama harto la atención como las finanzas se relacionan con la tecnología, mi idea es terminar informática para tener una base técnica solida y después mientras trabajo sacar una de las 2 carreras que mencioné. (Y mientras termino informática certificarme en excel, power bi, etc).

Desconozco si es un buen plan o si realmente se complementarían bien las carreras. Apunto a algún puesto bueno en un banco acá o en el extranjero.

Los leo, muchas gracias de antemano.",neutral
"Concejos para un recién egresado 🙏 Estoy en las últimas de Ingeniería Informática en el DUOC porque fue el único lugar donde la encontré en vespertino. Trabajo de ingeniero electrónico hace unos cuantos años, salí de T. Universitario en electronica en la USM y me fue bien.

Pero siento que la cagué al haber optado por el DUOC y más encima informática por como van las cosas. Me gusta la electrónica pero no la industria acá, que es puro ver plantas, motores y PLCs y siempre me gustó programar...

Algún concejo de para donde pegar los tiros? Alguna experiencia de gente que haya salido del DUOC, que este en el mundo del código o tenga dos carreras?

Estaba viendo certificaciones, o que está la ejecución electrónica en la USM de noche, hay algunos magisteres que podría tomar...pero ya no sé si seguir metiéndole plata a la educación para que después me consideren sobre calificado en todos lados xd",neutral
"Consulta Laptop Holi chicos! Este año entro a estudiar ing civil informatica en la usm y he pensado comprar una laptop entre 500 a 600 lucas pero la verdad no sé cual. Hasta el momento he usado siempre la del gobierno que te dan en 7mo básico, pero hablando con gente de la carrera que entraron así nomas dicen que no sirve mucho y se tienen que comprar otro si o si. He estado buscando cuales pero la verdad es que hay un montón.

Alguna recomendación? :{",neutral
"Ingeniería civil informática ucn Estoy viendo en qué universidad postular y me llama la atención la ucn sede en Antofagasta

Eso si quiero estudiar ingeniería civil informática 

La recomiendan?",neutral
"duda certificaciones python estudiante de primer año ing informatca(en la prestigiosa) nos pasaron py, ahora c++, me gusto py más rápido y tal, mi pregunta es, existe una certificacion oficial de python? si es asi quien la brinda :p, gracias buenas noches",neutral
"Ingeniería civil en informática o computación + especialización en ciberseguridad Tengo 17 años y llevo varios meses buscando la carrera que quiero estudiar. Mis opciones de universidades son la USACH, la PUC y la USM. Preferiblemente quiero entrar a la PUC y ahí tengo una duda. A diferencia de la USACH, donde la carrera se llama Ingeniería Civil en Informática, en la PUC se llama Ingeniería Civil en Computación. Mi pregunta es si son la misma cosa, si cambian en algo o no.

​Además, me gusta mucho el área de la ciberseguridad y quiero estudiar lo que me gusta, que es la informática, para luego especializarme en ciberseguridad. En este punto estoy medio en ""tierra de nadie"" porque no sé si estoy en lo correcto o si debería hacer otra cosa, así que necesito una orientación de alguien que haya hecho lo mismo o cache, no sé. 🫠",neutral
"Prosecución de estudios después de Ing. en Informatica DUOC Hola muchachos, esta es mi situación:
Entré a informática en duoc, mentalizándome en que solo estaría los 4 años que dura la carrera. Posterior a ellos certificados, diplomados y que sea lo que dios quiera intentando encontrar pega como junior.

El tema es que he visto mucha gente diciendo que es conveniente la salida intermedia (analista programador) y de ahí seguir en una universidad tradicional gracias a la prosecución de estudios.

Mi dilema es el siguiente: yo ya estoy en tercer año y nunca me interesó sacar el analista programador. Pero sí me interesa continuar estudios en una universidad tradicional, porque no le hago el quite a dedicarme a trabajar haciendo clases o en investigación. 

Por lo mismo, ustedes saben si puedo optar a la prosecución de estudios con el título de ingeniero en informática del duoc? o solo se podía con el de analista programador? en caso de que se puueda, solo puedo optar al magister de la PUC que tiene admisión especial (el MTIG) o igual puedo realizar la prosecución en la USACH, USM etc etc?.

Cabe mencionar igual que por mi edad no es un inconveniente quedarme un par de años más estudiando en universidad, eso no es tema para mí.

Saludos y de antemano gracias por sus respuestas!",neutral
"Ingeniería o técnico? Hola buenas, tienen algún consejo sobre si es mejor estudiar el técnico y luego sacar la ingeniería o meterme directo a la ingeniería? Estoy pensando en entrar a técnico en informática en la USM el 2026; conozco programadores buenos que han dicho que ingeniería es innecesaria si eres bueno, pero estoy dudoso aún. Me tinca el técnico porque son dos años y no pide puntaje, me estaría cambiando de carrera (derecho) así que la idea de salir antes me atrae bastante. Gracias! ",neutral
"De ingeniería mecánica a ciencia de datos: ¿continuidad de estudios o diplomado? Hola! Soy ingeniero civil mecánico (USM), 3-4 años de experiencia en proyectos, y quiero reconvertirme a ciencia de datos.  

Estoy terminando un bootcamp en DesafíoLatam, pero creo que no es suficiente para que me pesquen como analista de datos junior.  



Estoy entre:  

\- \*Continuidad de estudios\* en Ing. Civil Industrial o Ing. Informática (UNAB, online, 2,5 años, $4,5M/año).  

\- \*Diplomado\* en ciencia de datos en alguna U más top.  



¿Vale la pena gastar esa plata o mejor buscar otra forma de entrar al rubro?  

Mi meta: trabajo híbrido, ambiente relajado, vestimenta informal y ojalá mesa de taca taca 😅  



Se agradecen consejos 🙌",neutral
"portales de empleo exclusivos vs generales Soy titulado de la UTFSM y me encuentro buscando pega para cambiarme de donde estoy porque las lucas están un poco pencas, me pasa que la universidad tiene un portal exclusivo (usm.trabajando.com) pero cuando busco ofertas hay muchas que no me salen en el portal exclusivo y que si están disponibles en el general.   
A mi me parecian igual pero luego vi que habian muchas ofertas que no llegaban al portal de la USM y terminaba postulando desde otro portal 

saben si hay alguna diferencia entre postular en el portla exclusivo a postular en el generico? para los reclutadores cambia algo?",negative
"Que universidad estudiar? ciberseguridad/informatica hola quería saber (no cacho mucho del tema si) en que universidad estudiar ciberseguridad/informatica ya que son las dos carreras que me llaman la atención, e leído en otros hilos que es mejor estudiar informatica en vez de ciberseguridad porque abarca mas del tema y es mas general, pero también e visto la malla de ciberseguridad y no esta tan mal creo yo al menos. aparte no se donde estudiarla, e visto la inacap, USM y la santo tomas (la malla de ciberseguridad la e visto nada mas en la inacap), muchas gracias de ante mano",neutral
"¿Donde estudiar informatica vespertino? Hola! Estaba planeando volver a estudiar el próximo año. Estudié estadística, pero siempre me llamó la atención el área informática y eran las dos opciones de carrera entre las que estaba cuando salí del colegio. 

Dado esto, me gustaría estudiar en un vespertino para aprender a programar y dedicarme a eso, pero me gustaría saber en donde hacerlo. He visto que en este reddit recomiendan sacar un título técnico en DUOC o INACAP dado que son dos años y que tienen buen enfoque técnico, pero he visto algunas universidades que imparten también carreras vespertinas, como la USM, la USACH y la UTEM, que tienen más prestigio, lo cuál probablemente ayude más a la hora de buscar pega. Entonces quiero ser lo más estratégico posible con esta decisión y saber cuál sería la mejor opción para seguir este camino. Gracias!",neutral
"Ing en informática a los 28 Hola tal y como dice el título pienso entrar el prox año a estudiar a la usm ing en informática (dura 4 años). ¿Lo encuentran viable? O quizas sea mejor sacar un tec mas rapido y emtrar a trabajar?
Solo necesito opinionea, de ante mano gracias
(No tengo hijos que mantener)",neutral
"ingeniería civil en informática estoy en 4to medio y e estado viendo universidades, quiero estudiar ingeniería civil en informática y me gustaría ver otras opciones aparte de las clásicas universidades puc,uch y usach, que opinan de la unab, uai, udp y ucn? vivo en Santiago pero tengo la opción de ir al norte y estudiar en la ucn, pero mi principal opción es la usm, pero eso, quiero saber que opinan de esas universidades que mencione y si me pueden orientar igual se agradece totalmente.",neutral
"Como aprovecho la universidad? Hola mi gente, para darles contexto, estoy en 3r año en la usm estudiando telematica y mi rutina en la U es ir a clases, rendir pruebas y volver a la casa (Igual vivo a 2 horas). La cosa es que fui a charlas laborales y comentaron que las empresas valoran lo que uno hace más allá de los ramos, y desde ahí no he podido sacarme de la cabeza que capaz no aprovecho la U

Lo único que he hecho han sido varios amigos, como la carrera es chica nos conocemos entre todos y en los ramos conocí gente de otras carreras, pero claro no participo en ninguna actividad. 

Pensaba postular de ayudante, algún trabajo interno o participar de un club, pero me gustaría saber sus experiencias y consejos ",neutral
"Mejores universidades/ institutos para estudia ing. en informatica o ing civil en informatica?? Estoy pensando seriamente dar la Paes a fin de año y entrar a estudiar formalmente( actualmente estoy aprendiendo por cuenta propia) pero veo que fuera de los intitutos tipicos tipo inacap duoc, los armceles son parecidos pero las mallas muy distintas. Asi que necesito orientacion. Me importa ms un malla buena y actualizada que el nombre o prestigio del lugar.
Graciaas",neutral
"Duda banco Buenas, soy un estudiante de ingeniería civil informática de 4to año de la usm, nuestro profesor de finanzas del semestre pasado nos dijo que era importante empezar a generar historial crediticio, mi duda es con que banco recomiendan sacar una tarjeta de crédito, porque igual no tengo un ingreso grande fuera de las ayudantías que hago en la u, y el tema de cobro por mantenimiento¿? como que no quiero pagar por algo que realmente no me sirva y me gustaría saber cual es mi mejor opción.",negative
"Respecto a Inteligencia Artificial ¿Qué diplomado es más provechoso? Estimados,

Es mi primer post en Reddit y con toda humildad les escribo. Me encuentro en una disyuntiva respecto a que Diplomado de IA debería estudiar, si me interesa aprender sobre la Inteligencia Artificial y usarla para los rubros en los cuales me desempeño.

Actualmente, me desempeño en el rubro de la Ingeniería Civil Estructural, diseñando proyectos industriales para la Minera. Además, cuento con un pequeño emprendimiento (una cafetería) en donde veo muchas oportunidades de usar la IA para potenciar el negocio.

Es mi primera vez en Reddit, por lo que si me equivoco, les pido disculpas. Les mando un abrazo y que tengan una buena semanita. Son grandes personas. Muchas gracias.

Les adjunto los diplomados que he visto:  
[https://educacionprofesional.ing.uc.cl/?diplomado=diplomado-en-inteligencia-artificial](https://educacionprofesional.ing.uc.cl/?diplomado=diplomado-en-inteligencia-artificial)  
[https://ingenieria.uchile.cl/cursos/150620/diploma-de-postitulo-en-inteligencia-artificial](https://ingenieria.uchile.cl/cursos/150620/diploma-de-postitulo-en-inteligencia-artificial)  
[https://informatica.usm.cl/diploma-en-inteligencia-artificial/](https://informatica.usm.cl/diploma-en-inteligencia-artificial/)",neutral
"Ingeniería Civil en informática en la UBB? Recomendada? Hola, soy egresado de 4to y me tomé un año para dar nuevamente la paes y obtener mejores resultados, tengo pensado estudiar Ingeniería Civil en informática en la UBB, pero me gustaría saber que tal es, y también alguna recomendación de otras universidades en concepción de esta carrera? ",neutral
"Qué universidades recomiendan? Quiero estudiar civil informática pero por ej pra la chile no me da el puntaje, para la usm lo tengo difícil, que otras universidades son buenas opción? Por mi parte había visto la u mayor que la carrera de llama ing. Civil en computación e informática, y la u autónoma que es civil informática. 
Estas son buenas u para la carrera?? O hay alguna mejor que tenga puntaje de corte alrededor de 720?",neutral
"Rubro de ciberseguridad Estoy en último semestre de Técnico en informática en la USM y me llama la atención el rubro de la ciberseguridad, que tal es en chile? hay pega o mejor me centro en otras ramas como desarrollo web?",neutral
Cuales son las mejores universidades para ing. informática en la región de valparaíso? ayuda pls.,neutral
"Consulta para ingenieros civiles Holaa!, quería saber si realmente creen que vale la pena estudiar ingeniería civil informática en relación tiempo de estudio-salario, sus experiencias trabajando, en cual área se desempeñan y cuáles recomiendan. Gracias de antemano.",neutral
"Problemas para renovar GitHub Student Developer Pack Hola gente, hasta hace poco tenía el pack de GitHub para estudiantes, pero como hay que renovarlo cada 2 años, me tocó hacerlo hoy. El problema es que me están pidiendo un documento que pruebe que soy estudiante, y aunque mandé el de alumno regular que da la U, siempre me lo rechazan porque “no se ve una fecha que confirme la afiliación académica actual”.  
¿Alguien de la USM (o en general) que ya haya pasado por esto y tenga algún tip? Porque perder el Copilot Pro no se lo deseo a nadie :(",negative
"Dudas perfil profesional y bajo nivel Hola todo el mundo,  busco recomendaciones en base a mi perfil y búsqueda profesional, cualquier comentario es bien recibido :) Disclaimer: Me referiré a lenguajes como C y Rust como bajo nivel por la practicidad del post.

Sucede que me gusta mucho lo que es programar en low level o bajo nivel pero por cosas de la vida tengo mas experiencias en trabajos que no involucran ello. Tengo la duda de cómo es (si es que hay) ámbito laboral programando en bajo nivel en Chile. Planeo irme para afuera pero estoy ganando un poco de experiencia y formalizando mis estudios.

Se que me gusta por la práctica y teoría, amé C haciendo un http por amor al arte y ahora tengo unos proyectos en assembly x86\_64, C y mientras termino de aprender Rust trabajo en algunos aportes que se ocurrieron para RedoxOS. Bueno y armo mi distro personal de linux mas que nada por gusto y practicidad a al cambiar de equipos. Aparte, he hecho contribuciones a open source y uno que otro pequeño aporte a un par de distros linux (no especificaré para no doxearme tanto jaja).  El tema es que como decía mi experiencia laboral ha sido no solo no enfocada en ello si no que también un poco dispersa, teniendo experiencia en Soporte (ganando experiencia), Desarrollo back-end e Infraestructura (como apoyo en  algunas automatizaciones y trabajos con servidores de distinto tipo).

Actualmente soy jr y según mi actual jefe, no me queda mucho pal semi-senior. Actualmente estoy dirigiendo un poco mi perfil para DevOps o sistemas ya que me gusta y  he podido trabajar algo en ello. Añado que estoy terminando un técnico, pero por sorpresas de la vida y unos buenos simulacros PAES, daré la prueba para entrar a ejecución en informática en la USM ya que me dio de sobra, casi que por amor al arte y pensando también en enseñar en algún momento ya que creo poder contagiar el gusto que tengo :) (Siempre fui estudiante cacho y porra hasta hace no mucho que me rehabilité, estoy demasiado contenta con mi progreso y creo que puedo aportar en la educación de personas que se puedan ver como yo me vi en la universidad de mas joven).

Eso! gracias a quienes lean y disculpen el mucho texto y la posible mala redacción, jajaja :) Que vergüenza el post :$",neutral
"Espero mi título? Hola, comunidad de IT en Chile!

Soy mexicana y en mi país estoy estudiando Ingeniería en Computación, específicamente terminando el semestre 7/10, y uno de ellos lo estudié de intercambio en la Universidad Técnica Federico Santa María sede San Joaquín.

Desde que volví la universidad me ha desmotivado un montón, el nivel de exigencia que tengo se queda cortísimo comparándolo con el que tuve en la USM y por ende los conocimientos que estoy adquiriendo también. Soy la segunda generación de una nueva malla curricular y los profesores de los últimos semestres no son expertos en su ramo y se nota, además de que cancelan clases con tanta frecuencia que he asistido a la universidad la mitad del tiempo que correspondía, y cuando hay clase me hacen recordar a la secundaria porque dejan actividades en plan ""haz un resumen"", ""haz un mapa conceptual"", etc.

Tengo una relación formal con un santiaguino desde hace años, y la idea es casarnos e irme a vivir a Chile cuando termine la universidad, pero la espera me está pareciendo taaan lenta por la poca motivación que tengo, y estoy dudando que valga la pena tener esta educación tan precaria solamente por esperar un título, un papel.

Intento justificarlo que aparte de ""esperar"", aprovechando el tiempo libre que me está dando la universidad puedo seguir aprendiendo por mi cuenta, crear mis propios proyectos, prepararme para ser buena candidata a un puesto de trabajo específicamente en la industria IT en Chile.

Qué me pueden decir ustedes sobre el peso que tiene un título universitario en IT en Chile? Es simplemente un papel que muchas veces ni siquiera toman en cuenta, o de verdad aporta y hace la diferencia, ya sea para aumentar las posibilidades de conseguir un trabajo o para aspirar a mejores sueldos?

Gracias!",negative
"¿Aplicaciones/páginas para ejercitar código? Ayer mientras estaba aburrido encontré CodeChef y lo encontré una forma bastante entretenida de ejercitar cosas básicas de lenguajes de programación en tiempos muertos, lamentablemente el mismo día termine los ejercicios de prueba gratuita ya que la gran mayoría eran bastante básicos. No estoy en momento de considerar los 19 dolares diarios o el plan anual que ofrece la página, lo que me hizo preguntarme ¿Hay más páginas de este estilo? ¿Cuáles recomiendan? ¿Hay gratuitas?

Me gusta arto esa clase de ejercicios y recuerdo a un profe mencionar que la usm tenía una página con pdfs de ejercicios que les pasaban a los alumnos, no se si será real, pero cualquier cosa sirve para entretenerme aunque sea escribiendo codigo simple en vez de haciendo doomscrolling.",neutral
"Ing civil industrial en la UAI o UCH, opiniones estoy viendo donde estudiar y eso xd, (abstenerse de opiniones sesgadas e infundadas)",neutral
"Cómo complementar la carrera Hola, voy a cursar mi último año curricular de  civil informática (usm) y me gustaría saber cómo han complementado uds sus conocimientos con cursos, certificaciones, estudio, etc. Me gustaría encontrar pega este año en el área de ciencia de datos, ML o ingenieria de datos x ejemplo, en la u he usado mucho Python y las librerías principales del área, además de mucho Power bi en mis prácticas, pero al momento de encontrar pega siempre piden muchas más cosas y bien variadas, entonces quería saber cuales son las que más se buscan o lo que les ha resultado a uds. 

Gracias a todos y saludos!",positive
"Sería buena combinación? Hola buenos días a todos, actualmente soy estudiante de civil informática en la usm, y mi objetivo es convalidar ramos una vez egrese y sacar una segunda carrera, he tenido en mente civil eléctrica en la misma usm o en otra institución, todo con el objetivo de irme a trabajar afuera, idealmente canadá o usa, alguno cacha qué tal anda el campo por allá? o si será muy complicado homologar los títulos? o si por otra parte convendría más quedarse en chile",neutral
"Que tal es la UDD en Informatica? https://preview.redd.it/ygrbvch9ctbe1.png?width=5811&amp;format=png&amp;auto=webp&amp;s=13f7c83f71132615b6d05da10a01d28815fbf03c

Holaaa, la verdad que me gusta mucho la malla, ya que quiero irme por el lado de IA y la UDD es la unica que tiene tanto sobre IA en su malla, siento que saldria altiro con mejor base, ademas que me imagino q es una U donde sales con buenos contactos...

La verdad que mi meta es eventualmente trabajar de manera remota e internacional, y siento que con esta U podria ""partir con ventaja"" en cuanto a ese objetivo.

Pero me alcanza pa la chile, la puc y la USM. Serian una mejor opcion que la UDD para mis objetivos?

Que opinan?",positive
"Diplomado v/s certificación Hola! Llevo casi tres años trabajando en una empresa como desarrollador junior. Cada año, una empresa externa realiza un ethical hacking a nuestros sitios, y me ha correspondido mitigar las vulnerabilidades encontradas. Ya ha pasado harto tiempo desde que salí de la U, el tema de la ciberseguridad me interesa y estoy pensando en estudiar este año. Ante esto, he visto algunos diplomados (UC, USM) que se ven interesantes, pero son enfocados en gestión. Por otra parte, estuve viendo OSCP que, si bien es medianamente caro, está bien visto en varias fuentes. Ante esto ¿Qué recomienda la comunidad? ¿Alguien ha pasado por una situación parecida? Mi interés está en seguir desarrollando, pero con un foco claro en la ciberseguridad, y en algún futuro liderar equipos de desarrollo bajo esa perspectiva. Los leo!",neutral
"Recomendaciones para entrar en el mundo de la informática? Hola a todos, tengo 24 años y vengo de otro rubro pero estoy muy interesado en empezar en la informática. He estado leyendo sobre lo que se hace, los fundamentos básicos y todo los aspectos relacionado con este tema, a excepción de los sueldos porque no estoy interesado en ganar arriba de $2M o algo parecido. Quiero disfrutar de lo que hago y tener un trabajo estable y seguir especializándome en un área específica donde pueda escalar poco a poco.
Tengo dos opciones en mente y me gustaría que me ayudaran o aconsejarán para saber cuál es mejor.

A) Estudiar analista programador en el Inacap e intentar buscar trabajo con ese título para empezar a tener experiencia y nuevos contactos y después continuar con la ingeniería en informática en el mismo establecimiento. 

B) Estudiar de una Ingeniería informática en la PUCV o en la USM ",neutral
