full_content,sentiment_label
"¿Vale la pena un magíster en ciencia de datos o mejor certificaciones y proyectos? Saludos a todos, les pido su opinión sobre mi situación:

Me licencié recientemente en Astrofísica en la UTFSM. Lo más útil que aprendí para lo que quiero hacer hoy fue matemáticas, estadística básica y Python. No quiero seguir en la investigación, sino que quiero hacer la transición al mundo de los datos, buscando roles como analista de datos, analista BI, cientista de datos junior, trainee o practicante.

Postulé y fui aceptado en el Magíster en Ciencia de Datos de la PUC, pero el precio me parece exorbitante, y no estoy convencido de que la calidad sea superior a lo que se puede encontrar gratis o a bajo costo en plataformas como Coursera, EdX o Udemy. Como sé inglés, he estado considerando programas en otros países, algunos online (como el OMSCS de Georgia Tech o el MCSO de Texas Austin) y otros presenciales en Europa, que resultan más baratos y en universidades mejor posicionadas que la PUC.

Sin embargo, he visto en Reddit muchas opiniones que dicen que un magíster es un malgasto de dinero y que es más conveniente invertir en certificaciones específicas según las habilidades que demanda el área en la que se quiere trabajar.

Por otro lado, sé que lo básico para postular a cargos como analista de datos o analista BI es dominar Excel, SQL, Tableau o Power BI, y Python o R, además de contar con un portafolio en GitHub u otros servicios en la nube.

¿Qué opinan? ¿Vale la pena un magíster en ciencia de datos o es mejor enfocarse en certificaciones y proyectos? Y en ese caso, ¿qué tipos de proyectos podrían llamar la atención de los reclutadores en estas áreas?",neutral
"Sansanos en IT Hola, experiencias de sansanos o con sansanos trabajando en IT? Estoy estudiando civil informática y me interesa saber lo siguiente:

- Cuanto empezaré ganando

- Como les va a los sansanos buscando pega o practica

- Si debería cambiarme a ingeniería en informática nomas para hacerla mas corta xd


Se que dependerá el caso, pero es más o menos para tener una noción general.",neutral
"Ingeniería Informatica o Ingenieria Civil Telematica? Buenas, 

Mi principal consulta es como indica el titulo, ¿Qué sería mejor, estudiar Ingeniería Informática o Ingeniería Civil Telemática?

El foco de mi pregunta va dirigido principalmente al quehacer de ambas carreras, si bien las dos son similares en algunos aspectos, no me queda muy bien a que podría dedicarse el telemático. Hace poco revisé la malla de la que se imparte en la UTFSM y vi ramos de informática, electrónica y telecomunicaciones. 

Entonces si estudio telemática:

\- ¿Puedo dedicarme a gran parte de las áreas de la informática mas, algunas de telecomunicaciones?, 

\- ¿Qué haría el telemático que un ingeniero puro de las dos ingenieras anteriores no? 

\- ¿Podría aumentar las oportunidades laborales al tener conocimientos de varios ámbitos, o reducirlo por no estar especializado derechamente en algo?

\- ¿Cuál sería la mejor entonces para poder encontrar trabajo y poder desarrollarme profesionalmente con mas soltura?

Y para aquellos que están estudiando/estudiaron la carrera, especialmente si es en la UTFSM,

\- ¿Qué tan difícil fue? y ¿Cómo es el ambiente en la universidad?

Gracias de antemano para todos aquellos que se den el tiempo de responder.

",neutral
"Consulta para Data Analyst/Engineer Estimados, les quería pedir sus aportes, ideas o experiencias acerca de cómo me puedo convertir en un Data Analyst o Engineer. Ahora mismo estoy cursando la práctica, estudie el técnico de analista programador computacional, en instituto, y mi idea es, trabajar para poder pagar mis estudios. La idea era completar la ingeniería, pero me di cuenta que me interesa mucho más la ciencia de datos, pero no tengo muy claro cómo poder estudiar. 

Se que las opciones reales son estudiar en una universidad o en un instituto. La primera no sé si sea muy viable para mi, porque por lo que vi, en las universidades (mayor, uc, uc de valpo, utfsm) aparte de tener un arancel muy alto, se estudia en modalidad diurna, por lo que creo se me complicaria trabajar para poder costearla. Por otro lado el insituto es más conveniente por lo mismo, poder estudiar de manera vespertina mientras trabajo. 

¿Son realmente esas las únicas opciones ? ¿Cómo se convirtieron ustedes en Data Analyst/Engineer? ¿Qué harían ustedes en mi lugar? 

Les agradezo de ante mano cualquier consejo, experiencia, aporte. ",neutral
"Técnicas y tecnologías para estudiar y aprender mejor? Ingresé a estudiar Técnico en Informática en la UTFSM de Concepción, comienzo en Marzo. Ya he intentado estudiar Informática antes, en la UdeC, con resultados desastrosos y mucho dinero perdido. Esa vez me sucedió con 18 - 19 años (por inmadurez y por lo que a mi parecer en ese entonces era una enseñanza un poco arcaica), ahora con 26 creo que estoy más preparado en términos de madurez, lo que hace que quiera sacarle el máximo provecho a esta segunda oportunidad.

Me he estado preparando desde Diciembre del 2024, estoy estudiando Desarrollo Web porque es a lo que me gustaría apuntar en mi futuro laboral, pero entiendo que la carrera me va a brindar un espectro más amplio y sobre todo los fundamentos de la computación/programación, etc. No estoy estudiando tanto por el hecho de aprender HTML, CSS, JS u otra cosa, sino que para *Aprender a aprender*. No sólo la habilidad de programar si no de obtener un buen desempeño en mi currículo académico.

Mis conocimientos en Matemáticas no son mi fuerte, es algo que siempre me ha costado y que he tenido que reforzar constantemente, sumemos ahora que debo aprender a programar, es decir, solucionar problemas desde la abstracción y me tiembla la pera un poquito.

Recurro a uds. entonces, para consultarles:

¿Como puedo enfrentar estos próximos 2 añitos para estudiar de forma efectiva y aprender e integrar de mejor manera los conocimientos?

¿Me puedo apoyar de alguna tecnología sea software o hardware, más allá de The Odin Project, freeCodeCamp, udemy / iPad, Tablet, eReader u otro?

[Coming Soon - March 2025](https://i.redd.it/gnhzywtzh0fe1.gif)",neutral
"Opciones para estudiar informatica. Holaa, esta es la primera vez que posteo en reddit y la verdad es que este tema me tiene bastante acomplejado, pasa que entrando este año necesito estudiar si o si y me ire por la informatica, pero por temas de ptje no me da para una u top como la puc, usach, utfsm ni nada así, estuve revisando dentro de mis posibilidades y las u que mas se adaptan al perfil de egreso que busco, son la autonoma, la umayor, la udp, la uft y la ubo, ya que estas tocan mas los temas de desarrollo de software, ciberseguridad y analisis de datos en general.

¿alguien podria asesorarme sobre estas opciones, alguien que estudie o haya estudiado la carrera en una de estas instituciones o que solo sepa sobre ellas?

¿o que otras universidades recomiendan en las que se enseñen en su mayoría estos 3 temas?(desarrollo de software, ciberseguridad y analisis de datos) (y obviamente que no sea tan exigente en admisión, ya que en la mayoría de las universidades pondero entre 580-600 aprox), añado también que debe ser una u adscrita a gratuidad, ya que no puedo permitirme pagar una carrera, ni el cae.",negative
"Dudas sobre Ciberseguridad y como entras Hola, soy egresado de ICI hace unos años y me motiva el tema de la Ciberseguridad solo que mi U no tenia tanto contenido al respecto en su malla ni en cursos electivos, tome si pese a todo un curso electivo de intro a la Ciberseguridad que explicaban cosas basicas sobre encriptacion, codificacion, keys y firmas digitales y algo se hablo de maquinas Kali pero no negare que por darle prioridad a otros ramos no pude meterme tanto al tema de las maquinas Kali.

  
Dado lo anterior estoy pensando en entrar mas al mundo por que me interesa harto y por que quiero expandir mis conocimientos laborales mas alla de lo que hago ahora que es software development pero no estoy muy seguro de donde empezar, he visto un Bootcamp en CodingDojo, un diplomado de Ciberseguridad en la UC y en la UTFSM o simplemente internet y youtube apañarian?

P.D:  Fui ayudante de redes de computadores y sistemas distribuidos y he leido q esos conocimientos igual apañarian en Ciberseguridad, que tan asi es?",neutral
"Ingenieria en software o Informatica? Holaa, ando viendo que carrera estudiarr.. Realmente programación no me interesa mucho (a mi me gusta diseño XDD pero ya sabemos como va, y a mi me encantaba el ux ui entonces creo q lo mas cerca es ingenieria en software), por ende estaba intentando evitar ingenieria informatica..

Estaba buscando universidades con ingenieria en software y la q la tiene es la federico santa maria pero son cmo 3 años nmas (no se si afecte en algo) y es vespertino (cosa que no me genera problema realmente). Me dijieron q si son 3 años puede q sea un tecnico en vez d profesional tnces ns si estudiar ahí. Tmb vi q la duoc lo tiene pero mi familia tiene cmo un toc cn los institutos (los tachan de malos). Quiero meterme a alguna universidad (o instituto) destacada pero solo he visto q estas 2 tengan ingenieria en software, todo lo demas es informatica.

Entonces aqui va mi pregunta: Vale la pena tomar el camino de ingenieria en software o es mejor estudiar ingenieria informatica y ya d ahi especializarme? 

Igual, si tienen algun consejo aparte sobre lo demas mencionado (cmo el tema d los institutos o los 3 años d federico santa maria) me serviria un monton, porque eso no me molesta mucho.  Mi meta no es hacer juegos o cosas como cloud y ciberseguridad. Me quiero dedicar a las paginas web y/o aplicaciones, igual quiero tomar un curso de ux ui (y ojalá poder triunfar en eso, ya q es mi meta principal). Asiq ns si irme a informatica o software. ",neutral
"Estudio Informática en el DUOC y me da inseguridad pensar en el futuro laboral Hola! Como dice el título, estoy en un momento donde no me siento del todo bien respecto al lugar donde estudio. Estoy en tercer año de Ingeniería Informática en el DUOC. La carrera me gusta mucho, de verdad creo que tengo vocación y confío en que me irá bien, pero últimamente me he sentido un poco confundido y quería leer opiniones de otros que quizás hayan pasado por algo similar.

Por un lado, tengo conocidos y familiares que trabajan en el área los cuales han trabajado con personas que han salido del DUOC y me han dicho que les va muy bien. Pero de igual forma, me preocupa la salida laboral que pueda tener al salir del DUOC. Obviamente me gustaría ganar bien y tener estabilidad, pero no sé si eso sea tan posible saliendo de un instituto.

He hablado con algunos amigos y varios me han dicho cosas como: *“nosotros seremos la mano de obra; los que estudian la Civil Informática en universidades son los que dirigen los proyectos.”* Y aunque a mí no me importa tanto “dirigir”, sí me importa tener un futuro estable económicamente.

Además, hay personas (que no están relacionadas al área) que me han hablado sobre hacer diplomados o magíster al finalizar mis estudios, pero no sé qué tan útil sea eso en este rubro. Me gustaría escuchar opiniones de quienes sepan del tema o tengan experiencia. También soy muy consciente de que lo importante es desarrollar proyectos personales y estudiar más allá de lo que enseñan en clases, pero me pregunto: ¿De qué forma uno puede realmente destacar frente a otros para ser más tomado en cuenta en lo laboral?

A veces pienso en el día en que termine la carrera y me pregunto si me sentiré realmente orgulloso, o si quedará esa sensación de inseguridad solo por el hecho de haber estudiado en DUOC.

Sé que puede sonar tonto, pero necesitaba sacarlo. Gracias a quienes se tomen el tiempo de leer o responder.",negative
"Hoy en día, vale la pena estudiar ingeniería informática en un instituto ? Holaaa, tenía pensado en estudiar ingeniería informática en el Duoc, pero he visto muchos post desalentadores en el sentido de poder encontrar trabajo al salir

Mi pregunta es si vale la pena actualmente estudiar ingeniería en un instituto o lo mejor sería sacar el tecnico en informatica ?
Teniendo en cuenta que no puedo optar a una universidad, por temas de dinero y porque no creo que me vaya muy bien en la PAES

Gracias por leer c:",negative
"Ingeniería civil en computación e informática en la u mayor? Q tal es la u mayor en términos de ing civil en informatica? He leido en muchas partes q para la informatica poco importa de donde saliste sino q tu trayectoria y lo que hagas extra de la u, eso lo se. Pero buta tengo conocidos que quedaron en la u de chile y la santa maria e igual me da como cosa. Quiero saber sus opiniones pq igual he leido cosas malas de la mayor",negative
"Diferencias entre ingeniería civil informática con ingeniería civil en computación Hola, actualmente soy estudiante de 4to y tengo claro que quiero algo relacionado al área tecnológica. Tenía planeado ver de aquí a agosto ver qué carrera me tincaba más pero mi mamá quiere que me decida de aquí a mitades de junio, soy de la región de los ríos y las Ues no vienen mucho para acá, excepto la UACh, y en vacaciones de invierno quería viajar a Santiago a conocer las Universidades que me interesan (UC, UCh, Federico Santa Maria). Me podrían ayudar mencionando algo que las diferencien por favor? Muchas gracias de antelación! ",neutral
"Duda sueldo referencia Holaa, escribo esto por que me gustaría saber aprox cual es, en promedio, el sueldo recien egresado de un ingeniero civil informático de la Federico Santa Maria. Voy recién en segundo año de la carrera, y me han dicho q el sueldo recién egresado es bueno, pero me gustaría alguna referencia para hacerme la idea, y plantearme si quiero un futuro acá, o directamente irme a trabajar al extranjero.
Gracias",neutral
