full_content,sentiment_label
"civil informatica usm god o zzz? x el tema de la inteligencia artificial y q escuche que esta lleno de informaticos, que tan cierto es eso y que tanto afecta lo de la ia?",neutral
"Cambio de Usm -&gt; Uchile Me quiero cambiar de la usm a la uchile, mas que nada por que he escuchado que para aquellos que han hecho el cambio, han sentido de que el ambiente es mucho mejor y la infraestructura tambien, lo cual igual pesa a la hora de estudiar en la U.

Entre a la usm en vez de la uch porque mis cercanos decian de que era la mejor en mi carrera (Ingenieria civil en informatica) lo cual puede ser pero no se si la diferencia entre la usm y la uchile sea realmente notable. Ademas de que quiza no me informe lo suficiente como para haber tomado tambien en cuenta los factores que les mencione, por lo que ahora estoy evaluando seriamente hacer el cambio.

Mi unico “Tema” seria el tema de cuanto me atrasare por hacer el cambio (por el tema de las convalidaciones sobre todo por el plan comun y por el hecho de que voy en 5to semestre, o 3er año, y hasta ahora he aprobado todo), asi que me serviria mucho escuchar la experiencia de aquellos que hayan hecho el cambio, y si actualmente sienten que tomaron la desicion correcta y si lo recomiendan o no.

Agradecezo mucho cualquier opinion o experiencia respecto a esto.",neutral
"Pucv o Usm Hola, soy de viña del mar y en verdad quería preguntarle a este subreddit que universidad prefieren, en verdad he escuchado tantas versiones que ya me confunden.

Soy de la V región y en quiero estudiar Ing civil Informática, y basándome en prestigios y todo no se que universidad escoger, ya que el ambiente es algo también importante para la carrera.

En mi preferencia escogería la usm, por el prestigio pero se que son cuadrados para la wea (o eso todos dicen) y por un lado lo veo positivo por las habilidades que me puede dar en base a eso, y por el otro le veo lo negativo de que si alguna vez fallo, cague.

En verdad no se que pensar, estoy a un día de que cierren las postulaciones y no me gustaría cagarme el futuro

Pd: Soy mas o menos para estudiar, pero sali con NEM 6,3 y 800 ptos ponderados en la PAES, (923 matemáticas), por eso la duda si escoger o no la USM",neutral
"dudas ing informática usm hola, tengo 19 y es mi primer año de u/ tecnico, dependiendo de los resultados PAES. Queria saber recomendaciones y descargarme un poco ya que este año postule a la paes como ingeniero en informatica en la USM pero los resultados aun no salen, ye estoy muy cerca del corte ya que en la media no me esforce mucho y me da curiosidad si es lo mismo que entrar al tecnico y despues articular con la ingenieria, yo pensando deduje que entrar el tecnico no tendria el mismo ambiente que en la carrera, ya que no seria gente como yo que esta recien entrando a estudiar y que postulo con un puntaje minimo como en la ingenieria que se postulaba en admision centralizada, en cambio en el tecnico la variedad de gente seria mas grande con factores como la edad, gustos, enfoques, etc. si pueden aportarme con experiencias, tips, todo es bienvenido y si me pueden aclarar si egresando de tecnico en informatica cn articulacion en ingenieria seria lo mismo o equivalente a ingeniero en informatica, estudio en la usm",neutral
"USM Ingenería de ejecución en Software Buenas, soy titulado de Analista programador del Duoc y estoy trabajando. Estoy pensando en sacar la ing en la noche. Buscando por internet me topé con la ing de ejecución en Software de la USM, carrera de 3 años exclusivamente para titulados. 

Quería saber opiniones sobre la carrera en sí. Como trabajo de día me preocupa si se me hará muy cuesta arriba el estudio al ser la USM ya que, cuando estaba en el duoc, trabajaba pero era más sencillo convalidar los estudios al ser un instituto el duoc. La verdad la malla no me tinca (me gusta más la de de ing del duoc), sólo la estudiaría por el prestigio de la U más que nada. 

Por eso quiero saber si vale la pena y saber la dificultad comparada con una ing en un instituto convencional (duoc, inacap, etc)

https://preview.redd.it/7it3d6zonm6g1.png?width=1232&amp;format=png&amp;auto=webp&amp;s=2ec47f612a1fcff6e95c8a17d27eee189bb94652

",neutral
"UNAB o USM para Ing. Civil Informática  Hola, me llama muchísimo la atención estudiar Ing. Civil en Informática, pero tengo dudas sobre estas dos universidades, la USM o la UNAB. Ambas opciones me gustan, pero mi familia prefiere a que me vaya a la USM ya que para ellos, la UNAB no tiene un prestigio. 

Quiero aclarar que me puedo costear una universidad privada, aunque también tengo la gratuidad de la USM. 

Mi principal duda es que si la UNAB tiene buen reconocimiento a la hora de las entrevistas laborales, sobre todo a la hora de realizar practicas o al buscar trabajo. Mi familia me recalca que la UNAB no tiene la misma reputación que otras universidades tradicionales. (Como la UC y la U. de Chile)

He hablado con amigos que estan en la USM y me dicen que la malla de la UNAB como la Universidades son buenas a comparación de su universidad, pero sobre pienso demasiado en eso.

Igual, se que los tiempos cambiaron y de vez en cuando no importa tanto de que universidad saliste y tal (algunos trabajos si importan, pero pienso que solo el 40%).

Por otro lado, no me interesa la U. de Chile ni la UC por sus mallas.

Igual le explicado mucho a mi mamá de como funciona la UNAB y tal, pero insiste que vea la USM.

Espero que me ayuden, muchas gracias de antemano.",neutral
"Ingeniería de Ejecución en Software USM Estoy cursando la carrera técnica de Analista Programador en Inacap, y evaluando la posibilidad de continuar la Ingeniería de Ejecución en Software en la USM o Ingeniería en Ciberseguridad o Auditoría Informática en la USS. ¿Alguna recomendación, valdrá la pena terminar la Ingeniería en alguna de estas universidades?",neutral
"¿USM --&gt; PUC/UCH? Primero, muchas gracias por abrir este post.

Tal como dice el título, quiero consultarles a ustedes, la querida comunidad de informáticos ñoños y desconocidos, si es que vale la pena cambiarme de U.

Soy sansano, 2do año de Ingeniería Civil Informática (SJ), y la USM me ha hecho pico. Más encima, estoy en uno de los peores momentos de mi vida (tomando pastillas y mierdas) y simplemente siento que no me la puedo o no me la pude en la USM. Hace muy poquito que congelé y me puse a trabajar.

He escuchado muchos testimonios de ex sansanos que mencionan cosas muy parecidas: que la USM es artificialmente difícil, que es innecesariamente complicada, que la planta de profes es cuestionable, que los servicios al estudiante también son horribles (confirmo), etc. Hay prestigio y calidad en la formación, pero es todo un martirio.

Obviamente, al cambiarme a la PUC o Beauchef, estoy seguro que la dificultad no bajaría, pero muchos dicen que las oportunidades y experiencia general para estudiar mejora bastante.

Mi principal prioridad actual es regularme el tema mental, congelar el próximo semestre, juntar unas lucas y tomar una decisión.
Obviamente, estoy dispuesto a volver a intentarlo en la USM a ver cómo me va, pero tampoco quiero que sea en vano.

Por otro lado, tengo gratuidad, pero también estoy más que dispuesto a endeudarme para sacar esta carrera de mierda.

Les agradezco un montón.
Me interesa mucho leer sus experiencias, sugerencias, tirones de oreja y comentarios.",negative
Ingeniería civil industrial en la pucv o usm? ,neutral
"Informatica en la usm, que tal ha sido? Eso, hace poco me entusiasme con el mundo de la programacion y estoy explorando la idea de sacar el tecnico de informatica en la usm, pero me gustaria saber cual fue su experiencia durante la carrera y como ha sido una vez se titularon.",neutral
"Téc. en Informática USM o Analista Programador Duoc UC?? Buenas, soy Sociólogo con experiencia en gestión municipal y proyectos sociales, manejo algunos lenguajes de programación muy basicos como Python pero mas que nada centrado en en Analisis de Datos. Realmente quería tomar otro rumbo en la vida con alguna de estas dos opciones... He leído la malla actual del Duoc UC y te entrega una Certificación Full Stack al salir, mientras que la USM me queda mas factible en transporte público y tiene más prestigio en la región (desconozco si su malla será mejor) 

¿Cual sería su recomendación para alguien con muy poca experiencia en programación real y desarrollo? Lo que busco mas que nada es una estabilidad y alta empleabilidad los primeros años, más que unos sueldos millonarios desde el inicio. Muchas gracias ",neutral
"Técnico en Informática en la USM o Analista Programador en el Duoc? Actualmente estoy muy interesado en tomar una carrera técnica relacionada con la informática, ya que es un mundo que me gusta mucho. De hecho tengo ya algunos conocimientos sobre programación y sé algunos lenguajes. Sin embargo, no sé cuál de las dos opciones mencionadas en el título sería la mejor, ¿Qué creen ustedes?",neutral
"Puntqje corte usm Hola ya que ayer salieron los puntajes paes y hoy tengo q hacer las postulaciones, cren q suba mas de 30 puntos el puntaje de corte para este año considerando los años anteriores? O me alcanza para estudiar?",neutral
"vale la pena cambio de usm a uch? Buenas, como el titulo lo dice, estoy pensando en cambiarme de u, desde la usm a la uch. Estoy en segundo año de ing civil informatica con los ramos de plan comun al dia. La cosa es que la usm me tiene aburridísimo en muchos aspectos:  los espacios de estudios en epoca de pruebas son casi nulos; la gente, siento que no encajo muy bien y encuentro muy fome a la mayoria; el campus no me gusta y otra cosa es el tiempo, se que la usm se caracteriza por ser una universidad dificil y la verdad me ha ido bien pero encuentro estupido que apenas tengamos tiempo libre, ya que tambien quiero tenerlo para distraerme y salir. Quería preguntar si valdrá la pena cambiarse según estos motivos, ya que viendo la malla igual me llama la atención en la uch, y si alguien de la chile me podría ayudar lo agradecería mucho.  
Gracias por leerlo

EDIT: igual me causa mas indecisión que la malla de la usm para el otro año la actualizarán y será solo de 5 años la carrera, teniendo la opcion de tomar la nueva malla.",negative
"Opiniones sobre ingeneria de ejecucion en software USM Hola gente! quería consultar si alguien de casualidad estuvo en esta carrera que pueda darme su opinión al respecto. Además me interesa saber si con este título te permite después entrar a ingeneria civil industrial en la usm, yo estoy titulado de Analista Programador Computacional en Duoc y estoy buscando opciones de universidades para poder seguir mis estudios, de antemano muchas gracias",neutral
"Analista informático INACAP - Técnico Universitario en informática USM Hola, busco algunas opiniones y experiencias similares respecto de esta decisión

Ya tengo un título en ingeniería civil de una universidad estatal, pero lamentablemente no me ha dado los frutos que esperaba en cuanto a empleabilidad. Ahora quiero apostar por algo que me permita reinsertarme laboralmente de una manera más efectiva, y me estoy inclinando por la informática/programación, idealmente en un programa vespertino para poder trabajar al mismo tiempo.

He estado evaluando dos opciones: **INACAP** y la **USM**. 

INACAP me resulta más cómodo porque no tendría que moverme de ciudad, además de que parece tener una acreditación similar a la de la USM. Aparte, dado que en informática no necesito laboratorios súper especializados como en electricidad o electrónica, con un PC decente bastaría para la mayoría de las actividades prácticas.

He estado revisando las estadísticas en [**mifuturo.cl**](http://mifuturo.cl) y no veo una diferencia tan abismal entre ambas instituciones en cuanto a empleabilidad, pero no estoy seguro de qué tan confiables son esas cifras. Por eso, quería saber si en la realidad laboral pesa tanto el prestigio de la USM frente a INACAP cuando se trata de conseguir trabajo en este rubro.

[Estadísticas ingreso\/empleabilidad](https://preview.redd.it/ujukgjqwobie1.png?width=968&amp;format=png&amp;auto=webp&amp;s=1b1049d44aa80eb95216d05c3360b43242b832c9)

Por último, me gustaría saber qué tan prácticos y aplicados son los programas en ambas instituciones. He revisado las mallas curriculares y en ambos casos veo algunos ramos que me parecen un poco de ""paja molida"". Si alguien que se haya formado en alguna de estas dos instituciones puede comentar sobre la cantidad de teoría vs. la práctica, sería de gran ayuda.  


[Malla USM](https://preview.redd.it/i9xudkljobie1.png?width=1218&amp;format=png&amp;auto=webp&amp;s=ab395e47d4d5c880d98b0b1a832f68f5835b2ca9)

[Malla INACAP](https://preview.redd.it/kwgghz6oobie1.png?width=1410&amp;format=png&amp;auto=webp&amp;s=62bfb7be84d169c35150e3bbbe5be6195f907106)



",neutral
"DUDA CONTINUIDAD INGENIERÍA INFORMÁTICA A CIVIL INFORMATICA USM/UTFSM Buenas, tengo una duda respecto si puedo sacar la carrera de ingeniería en informática y después pasar a la civil sacando la carrera de informatica en la misma universidad, la idea es no tener que dar la PAES, ya que puedo entrar a la ingenieria en informatica directo despues de sacar el tecnico en informatica en la misma U. Todo este webeo se debe por que tengo 403 nem (escala antigua) y tengo q sacar puntajes casi perfectos en la paes para entrar regular, aun que igual lo intentare si no se puede hacer lo que comente mas arriba. (necesitaria algo como 800+ m1, 750+ m2, 750+ lenguaje y 800 en historia) ",neutral
"Entrar a civil informatica en la UDP o entrar a civil telematica y dsp cambiarme en la USM Bueno me fue meh en la paes, pero me alcanza para entrar directamente a Ingeniería Civil Informática y Telecomunicaciones en la UDP, no he escuchado opiniones sobre esta U y se que no es tan de renombre como lo serian la Uch, Uc, Usm, etc. Pero encuentro que igual tienen buena malla. Lo otro seria ir a civil telematica en la usm para despues cambiarme a informática, pero no se si valdria la pena. Estoy abierto a otras opciones que sean en santiago, por que no me dejaron ir a estudiar en valpo xdd.",neutral
"Cómo ingresar a la USM? Buenaas, el otro día pedí consejos sobre donde estudiar para continuar evolucionando en el mundillo del TI, ya que estoy en un cft y muchos me comentaron sobre la USM o universidades que siempre vi fuera de mi alcance, por eso quería preguntar, luego de que termine el técnico, si quiero entrar a la USM tengo que volver a dar la paes? o como? aparte también vi que tendría que echarme 5 años, aunque dicen que con continuidad te descuentan años, pero no sé, me falta algo de orientación al respecto, o bastante...",neutral
"Consejos Hola, me encantaria contarles de todo mi agrado de que quede en ing civil informatica usm y estoy muy contento la verdad, solo hay un problema, y es que siento que soy muy nuevo con la informatica, tengo conocimientos generales, pero no he aprendido todavia muchi sobre sistemas linux, y/o proyectos en algun lenguaje.

Que me recomiendan?",neutral
"Valdrá la pena aceptar esta pega? Soy ingeniero civil electronico recién titulado de la usm sin experiencia laboral, la verdad me gustaría irme por el área de software, ciencia de datos.
Me ofrecieron una pega de desarrollador iot (desarrollo de PCBs, instrumentación, firmware) con una paga de 800k.
La verdad no sé si me convenga aceptar este trabajo debido a que no es el área en la que me gustaría desarrollarme como ingeniero, la paga no es la mejor y podría gastar mi energía en seguir formándome en el área de ciencia de datos. Pero por otro lado, pega es pega y la cosa está difícil.
Creen que debería aceptarlo? Me serviría igual como experiencia laboral, si en un futuro quiero un trabajo más de software?",negative
"Como ven el rubro de aquí a unos años? He visto de todo la verdad, opiniones muuuy variadas respecto a este tema. Soy estudiante de ing civil informática en la usm, y tengo ambos extremos, compañeros que piensan en cambiarse de carrera al 3er año porque creen que este es un campo muerto, y por otro lado locos que juran de guata que cuando egresen entrarán a trabajar de una a google remoto ganado 10 palos (y como dato curioso: por alguna razón que desconozco los mechones que entraron este año a la carrera son ultra poco humildes, onda arrogantes, ningunean a los que nos hemos echado ramos, etc, por alguna razón las nuevas generaciones que están entrando se parecen mucho más al estereotipo de ingeco de la cato jajaja).

Considero que a futuro será imprescindible una base técnica sólida en informática y programación para casi cualquier trabajo, pero los roles que son solamente codear y aquellos que son tareas repetitivas van a morir. Aunque me caiga mal esta nueva generación que entró, siento que el informático del futuro no puede ser el típico ñoño introvertido en el subterráneo de la empresa, sino que tendrá que ser alguien más parecido a un industrial pero con conocimiento profundo en arquitectura y ofrecer soluciones más allá de codear algo.

El software avanza más rápido que el hardware, la siguiente moda serán carreras como eléctrica o electrónica, sin embargo eso no significa que informática desaparecerá, más bien sufrirá una transformación a algo más cercano a lo que hace un industrial pero enfocado a lo técnico. Quienes sepan organizar eficientemente, ordenar equipos y entiendan perfectamente lo que hacen, les irá bien, pero a todas estas cosas nuevas de ingeniería en prompts, vibe coders, etc, morirán rápido junto con el informático “clásico”.

Al menos así lo veo yo. Quiero saber qué opinan, y también si han notado que el perfil de los estudiantes ha ido cambiando, en vola porque siguen creyendo que esto es grito y plata, o porque ven un área más competitiva que antes, no lo sé. Los leo.",negative
"Consejos porfavor Contexto rápido.

Soy malo para programar, estoy estudiando civil informática en la usm y los ramos de programación los paso raspando y sufriendo, estoy considerando cambiarme a civil industrial y pagarla con cae, que opinan? tanto como profesionalmente y académicamente hablando, voy a cumplir 22 y recién voy en 2do año curricular, en civil industrial me convalidarían 1 año.",negative
"estudiar con 25 años Hola buenas, queria saber si es viable sacar tecnico en informatica en duoc con 25años( tengo una carrera ya) y luego adquirir experiencia, sacar certificaciones y por último,  estudiar civil informatica en la usm (advance) que piensan ustedes? ",neutral
"¿Vale la pena sacar el magister porque es gratis ? Hola, la pregunta del título, estudio en la USM y por ciertas circunstancias puedo sacar el magister en el mismo tiempo en que me demoraría en terminar el pregrado y encima por notas este es gratis. Mi noción respecto al mercado es que saber hacer cosas y tener un perfil de Github lleno de proyectos que mostrar, pesa mas que el magister. No obstante, el mundo está en constante cambio, cada vez se titula más gente, universidades como la UAI prácticamente están ofreciendo carreras 2x1  lo que me ha hecho reflexionar de que quizá no debería desaprovechar la oportunidad de cursarlo gratis a fin de cuentas para tener ese punto a favor a la hora competir. Aclaro que el magister es en Ciencias de la ingeniería informática, no en TI. Tampoco contemplo seguir al doctorado. ¿Que opinan ustedes? De antemano muchas gracias. ",neutral
"Ejecución en informática y ¿Donde? por Concepción Estos días me he estado calentado mucho la cabeza por si ir por la civil o la ejecución pero ya me decidí, por tratarse mas de algo practico, y por varios post de el mismo tema que leí por aquí (confirmen si me equivoco en algo de como se ve el panorama).

\-*Que el extranjero no existe la civil y por eso es mas ""escogido/visto"" al informático que se basa en lo practico* **(a año de haber empezado acá)**

\-Al ser menos años uno sale altiro a trabajar (**si tiene contactos** **o si lo vuelven a contratar de donde uno hizo la practica)**

*-Que uno es teoría y matemático* **(cosa que de verdad me esta costando en 4to)** *y el otro solo va a desarrollar*

Ahora me he dado la paja de ver las mallas en X e Y universidad pero prefiero que gente que ya conoce de esto y estudio en instituto/universidad privada o publica me diga ¿Cuál es la mas recomendable?

* UBB (pide m2 pero se vale intentar)
* Duoc (algo he escuchado de que es buena)
* incapaz (me queda mas cerca)
* santo tomas (he escuchado de esta y la anterior, de 2 personas de cada una, donde les va bien ganando mas de 1 palo y etc.)

***cualquier otra que este adscrita al Fuas también es aceptada o7***",neutral
