full_content,sentiment_label
"Sistema educacional un modelo de negocio El sistema educacional es un negocio de mierda.  
Te postulas a un puesto de trabajo, resulta que necesitas tener de 2 años de experiencia para un puesto de junior, y sino, una practica con conocimientos solidos o algún proyecto que demuestre tus capacidades, o con certificaciones(además de la universidad, porque parece que con la universidad no se aprende nada y/o no se valida tu conocimiento). Entonces para que mierda me metí a una carrera de 4-5 años y sacar un titulo? de que mierda sirve? literalmente la preparación que te dan en la universidad no sirve de nada, solo son conocimientos muy básicos y/o desactualizados con lo que la industria te pide. Mejor no hubiera estudiado y me preparaba solo, es literalmente lo mismo, y invento que estuve en una universidad, o que supuestamente estoy inscrito en una, total no lo saben. Y encima luchando para conseguir una practica que te pagan miserables (con suerte en solo algunas) 200.000 pesos por 3 o 6 meses, y OJALA quedar trabajando en la empresa, para luego pasar mas tiempo trabajando y pagando esa deuda eterna que fue entrar a estudiar a la universidad.  
Luego tienes a las personas que les fue bien, algunas se sacrificaron mas del triple para conseguir lo que uno espera que sea lo mínimo luego de gastarse casi 20 millones por una carrera que quizás en 7 años vas a recuperar lo invertido(si es que sirve de algo realmente), y no solo en términos monetarios, nadie les va a devolver el tiempo invertido para estudiar, para los trabajos/tareas, trasnocharse para sacarse una buena o una nota que te haga pasar el ramo, nadie les va a devolver esas invitaciones que rechazaste por priorizar tus estudios, los cuales te dijeron que te iban a salvar tu futuro supuestamente, nadie te va a devolver nada, el sacrificio invertido no es equitativo ni en lo mas mínimo. Y luego tienes otras personas que lograron entrar a trabajar por pituto, ya sea por amigos o hasta los mismos profesores que les dan oportunidades a caras bonitas o a los que mas extrovertidos son en el área y solo muestran ser una cara bonita o que se esforzaron mucho -supuestamente-. Profesores(contados con los dedos) que pueden ayudar con suerte a 3-4 estudiantes por año y/o semestre quizás. Luego tienes a profesores que realmente no tienen vocación, les da igual si su materia la están enseñando bien, les da igual si estas progresando, para que mierda les pagan tremendos sueldos, solo hacer clases, leer ppts, realmente están generando un impacto en sus estudiantes? hay muchos profesores que te quitan las pocas ganas que tienes para seguir estudiando la carrera, y para seguir pagando encima(Sé que soy responsable yo mismo de mis estudios, pero porfavor, de verdad que hay profesores que son unas lacras). Luego tienes profesores que te ilusionan con posibles puesto de trabajos o becas, que al final terminan siendo puro cuento, o que quizás tienen que hacer un tremendo esfuerzo con la universidad para conseguir que le den mas cupo (300.000 mil pesos) para que un estudiante ingrese como becario a un área de la universidad, 300.000 pesos, no se vayan a ir a la banca rota conchetumares, tremendos sueldos que se roban en la administración para proyectos culiaos con financiamiento también entre amiguismo. Al final te das cuenta que no sirve de nada rendir bien en la universidad, no sirve de nada ser alguien limpio, alguien que juega limpio, honesto, o que intenta hacer el bien, el sistema de alguna forma te corrompe con situaciones que se te presentan, y te envenenan. Luego tienes al gobierno lanzando becas de ""estudios"" para seguir creciendo como profesional y optar a mejores puestos de trabajo(a lo cual volviendo a lo anterior seguramente tampoco sirva de mucho), como va a ser posible que un amigo que gane un poco mas del sueldo mínimo luego de su técnico y varios años, tenga que encontrarse como desempleado(perder su trabajo actual y pasarlo peor de lo que lo esta pasando, ya que no tiene la suerte de tener apoyo familiar) para recién poder postular a la beca que da el SENCE, QUE SENTIDO TIENE ESTO POR LA CONCHETUMARE EN QUE CABEZA ENTRA QUE ESTE SISTEMA REALMENTE ESTA SIENDO UN APOYO A LA SOCIEDAD, Y SEGURAMENTE QUIENES DIRIGEN ESTE PROYECTO SE ESTAN GANANDO UN SUELDAZO Y UN GRAN FINANCIAMIENTO Y AMIGUISMO PARA QUE VENGAN SUPUESTOS PROFESORES A ENSEÑAR A ESE SENCE.

Opino desde mi privilegio de haber estudiado, que gracias a mi familia que se ha sacado la cresta trabajando para darme esta oportunidad(que ellos creían que era lo mejor, porque el sistema les vendió eso y a mi también, pero no es su culpa). Y no quiero negar que todas las familias se sacan la cresta, todas lo hacen y aun asi no todas tuvieron la suerte del sistema para poder darle una mejor educación a sus hijos/hijas. Hay situaciones y preocupaciones mucho mayores realmente. Y hablando de eso... Ahora tienes a este gobierno y una de sus tantas propuestas/medidas para la sociedad, dejan mucho que desear, en que burbuja viven, como es posible que cuando se dio el alza al combustible haya salido el presidente Kast a pedirle a las familias que se ajusten en tiempos difíciles.... HAY FAMILIAS QUE DESDE TODA SU VIDA HAN ESTADO EN TIEMPOS DIFICILES Y CON SUERTE LLEGAN A FINDE MES, COMO MIERDA VAS A VENIR A COMPARAR TU SITUACION DICIENDO ""Nos reunimos como familia, y decimos, okey, estas vacaciones no vamos a poder viajar al extranjero, o uno no va a poder irse a estudiar afuera(no recuerdo mas)"", Y QUE ASI COMO TU FAMILIA LO HACE TAMBIEN LO HAGA EL PROMEDIO DE FAMILIAS EN CHILE, EN QUE MUNDO VIVES. Y para que vamos a hablar de las recomendaciones de hacienda... Y para que vamos a hablar del gasto de transporte al año que tienen los senadores... y así se puede investigar y evidenciar que acá en chile el que no corre, vuela.

A causa de todo, uno se contamina, y cuando tiene la oportunidad de aprovecharse de los demás, la toma, porque durante toda su vida, todo a su alrededor se manejaba de esa forma, y uno que se mantuvo honesto, no sirve de nada, afirmo que el sistema educacional en chile, es un modelo de negocio. YO no soy mejor ni peor persona que alguien sin titulo/estudios, ABORREZCO a las personas que menos precian a los demás por solo tener ese ""titulo"", se enaltecen a las personas con estudios porque el sistema los engaño, los engaño diciendo que ellos si tienen la verdad, ellos si son un aporte a la sociedad, cuando realmente todos podemos y lo somos, no es necesario tener un titulo para hacer grandes cosas, no es necesario tener un titulo para avanzar en la vida. Entiendo también a las personas que quizás tienen un poco de ego por tener su titulo universitario, ya que fueron muchas horas de esfuerzo, muchas horas de trasnocharse, muchas horas de sacrificio, muchas cosas sacrificadas para sacar un ""titulo""(que realmente no vale nada, eso nos hicieron creer, y ahora tenemos que hacerlo creer, para justificar lo que hicimos y el tiempo perdido), pero déjenme decirles, que no somos los únicos que pasaron por ese proceso, fuera de los estudios también hay sacrificios enormes en las familias, jovenes, niños, etc, solo que vivimos en una burbuja que no nos deja ver mas alla de nuestras narices, avanzamos sin mirar al otro, ¿y por que? porque eso fue lo que nos enseño el sistema.

En fin, solo soy uno mas, un numero mas, un pensamiento mas en este sistema, ya mañana hay que volver a la rutina.

No los culpo si en algún momento tuvieron que hacer una ""trampa"", para avanzar en la vida, el sistema te obliga a tener que pasar en algún momento por esos actos, y para el que no.... felicidades, no hay mas que les pueda decir.

Usen este post para desahogarse y opinar desde nuestras burbujas.",negative
de que U/IP/CFT saliste? cuanto fue tu primer sueldo? cuantos años llevas ejerciendo? cuanto es tu sueldo ahora? quiero hacerme mas o menos una expectativa de cuanto puedo esperar una vez saque la carrera,neutral
"¿Mejores universidades para ingeniería en informática? He hecho mi investigación sobre las mallas, perfil de egreso etc de varias universidades de acá de Santiago y tengo una idea general de cuáles me gustan más, pero aparte de eso me gustaría saber, en términos de prestigio, cuáles son las mejores carreras para estudiar ingeniería en informática o ciencias de la computación?? En cuáles se encuentra pega más rápido? En cuáles sales con mejor sueldo? Son requerimientos que personalmente no los encuentro los más importantes pero también me interesan y quiero tenerlos en cuenta

Edit: Agradezco a todos por sus respuestas, quedé un poco más orientada que antes xD ",neutral
"Mejor universidad para postular # Hola buenas noches gente, dado que estoy en 4to medio y me llama la atencion el mundo de la ing informatica me vino el dilema de a que universidad postular

# 

Quitando las emblematicas **(PUC, UCH, USM, USACH)**

A que otra universidad quiza un poco mas **""nicho""** vendria bien en este ambito, y obvio de una buena base para salir al mundo laboral y sacar contactos en la u.",neutral
Diseño e implementación de circuitos digitales basados en fpga En marzo se comienza a vender por la editorial de la usm ,neutral
"No sé cual será mi sueldo de egresado. Hola a todos, soy un estudiante que está en sus últimos semestres de Ingeniería Civil Telemática en la USM. Durante mi paso por la universidad he intentado mejorar mi cv con ayudantías, voluntariados y como ayudante de investigación. Todo esto con el fin de facilitarme encontrar mi primer trabajo y mejorar mi primer sueldo.

Quiero agregar que mis notas no son malas, son buenas, pero no excelentes como para tener un premio de excelencia académica. 

Resulta que ahora me entró la duda dd cuanto podría ser un buen sueldo para un recién egresado de mi carrera. 

¿De verdad ayudará todo lo que he hecho además de estudiar para mejorar mi sueldo y busqueda de empleo?",neutral
"Que U postular en ingeniería informática con puntaje bajo? Con la entrega de los puntajes de la paes cache que en realidad me fue mal para la u que queria que era la usm para ingenieria informatica o civil informatica saque en ponderado 700 puntos asi que ando buscando opiniones de que otras universidades podria postular, tengo en claro que para ingenieria informatica la universidad no afecta tanto pero igual me gustaria entrar en alguna universidad donde pueda aprender lo mayor posible.",neutral
"Ingenieria Informatica, ¿DUOC o universidad? Muy buenas, tengo 23 años, estudiaba en la USM licenciatura en fisica y por diferentes motivos he decidido dejar mi carrera en la USM para probar suerte en otras universidades. Originalmente pensaba en terminar la carrera en otra institución, pero con la intención de sacar certificaciones para trabajar como freelancer mientras evaluaba mis opciones, pero en base a ese objetivo que se acomoda a mi, he querido cambiarme de rubro.

Congele la universidad, y estoy evaluando mis opciones. Pensaba en meterme al DUOC a estudiar ingeniería informática ahí junto a una especialización como ciencias de datos, y a la par de eso hacer certificaciones varias como crearme un portafolio de todo lo que vaya armando, incluso haciendo cosas de física para armar un perfil híbrido, y lo mas importante por lo que tengo entendido, el buscar uno  o dos nichos para trabajar. Aun así, me entra la duda si es buena idea ir al DUOC o evaluar mas las opciones de irme a una universidad, pero eso me da otro problema.

Actualmente tengo la deuda con la USM y el CAE, y si estudio en una universidad deberé mucha mas plata que la que debería pagar en el DUOC, y esto no me favorece en nada. Estoy postulando a la gratuidad vía FUAS, ya que mis condiciones materiales y económicas han cambiado mucho, y es mas probable que la consiga, pero no puedo dar eso por hecho. ¿Que opinan?¿es un plan solido o debería considerar algo mas?¿vale la pena ir al DUOC o debería probar suerte con otra universidad ?

PD: Este post lo envie tambien al sub chileno sobre educacion, pero me gustaria la opinion de gente que trabaje en el rubro. Se programar en Python, he jugado en ocasiones con C++, uso Linux desde hace un par de año, y ya tengo una base matematica y fisica solidas, termine la mitad de la malla de fisica en la USM. ",neutral
"Otra duda de cuanto cobrar, ayuda pls Holaa, lamento aburrir con otra duda de cuanto cobrar pero siempre viene bien conocer experiencias reales y de gente en el mundillo, soy estudiante de ingenieria informatica en la USM en mi ultimo año, en mi practica construi un software para la empresa que quieren que perfeccione y dejarlo al 100% y ahora me contactaron para continuar el desarrollo, pero como externo, tipo ""prestador de servicios"" formalmente y todo.

Me mandaron un documento con todas las observaciones y solicitudes a hacerle al sistema, me pidieron que estime en horas cuanto demoraria y mande una cotizacion, hice la estimacion en horas, pero ni idea cuanto cobrar por hora, en paginas como indeed aparece que desarrolladores junior ganan en promedio $14.000 hora pero me parece muy alto y no creo que sea la realidad nacional por lo que he leido aqui ajajaj.

Ademas en la empresa esta como referencia lo que me pagaron en mi practica, que no es muy alto (menos del minimo), por lo que tampoco me parece saltar tanto en lo que cobrar, pero tampoco quiero cobrar lo mismo ya que la relacion ahora es distinta.

Agradezco cualquier opinion y consejo, es mi primera vez trabajando en un proyecto ""serio"" para una empresa

  
**TL;DR:** Terminé mi práctica en una empresa, les gustó mi software y ahora me contratan como externo para ajustarlo y terminarlo. Cuanto cobrar por hora?",neutral
"Me puedo quejar un rato?  Tengo un poco menos de 2 años de experiencia, salí de Inacap, y bueno soy front end pero ahora me estoy tirando un poco más para el back. 

No me quiero autodoxear así que no daré muchos detalles, pero me costó mucho encontrar pega. Después de mucho tiempo sin pega, y hasta pensando en volver al retail, pille un lugar donde me aceptaron sin experiencia, pedí 550.000 Lucas, ya que en otras pegas me rechazaron por pedir 600 (muy caro, me dijeron). 

Han pasado ya casi 2 años, y bueno, aún no nos igualan el sueldo al team (me subieron a 650, pero todos hacemos casi lo mismo y tenemos sueldos diferentes) a un compañero que es front también y salió de un bootcamp, gana un poco más que yo, y a principio de mes echaron al más antiguo, mi jefe nos dijo que la empresa está mal, y que no pudiéramos aumento ni nada, que la empres ano puede pagarlo. 

Llevo ya casi 6 meses buscando pega, y nada. Quizás mi stack es malo, a fin de cuentas solo soy un front end, pero estoy sacando cursos de SQL y también trabajo un poco de c# y pithon, pero ni siquiera me llaman, tuve que tomar una pega part time de los domingos para poder juntar algo de plata a fin de mes. 

No se lo que busco con este post, se que tengo que tener paciencia, seguir intentando, se que estoy recién empezando, pero la verdad, no tengo mucha esperanza. 

Gracias por leer ",negative
"Entre a ing civil informatica, vale la pena? Entre a la usm y la u esta dificil, sin embargo se que si persevero la sacare adelante. Mi miedo es que todo ese esfuerzo sea por nada de aqui a unos años mas, siempre que leo cosas respecto a la carrera dicen que no vale la pena, que esta saturada, que nos reemplazara la ia, etc. Veo a los gringos por ejemplo y computer science tiene la empleabilidad cada vez mas mal. En fin, no estoy muy metido en el mundo laboral ya que sigo y seguire por unos 4-5 años mas en la u. Los que ya esten metidos, como la ven ?. Los leo.",negative
"Ingeniería Civil (UCH) o Licenciatura Ciencia de la Computación (UC)? Pros/Contras [Malla Ingeniería Civil en Computación U Chile](https://preview.redd.it/8z7vhyg2d6ag1.jpg?width=3300&amp;format=pjpg&amp;auto=webp&amp;s=a60acb4eb58c3d312d9e26752d0d2e3f10477fe9)

[Malla Licenciatura en Ingeniería en Ciencia de la Computación PUC](https://preview.redd.it/n7zrxyg2d6ag1.jpg?width=2550&amp;format=pjpg&amp;auto=webp&amp;s=7441831129e8f0a06f3af1b7bd55eb1a16b0cfa3)

Hola, buenas :D

Queda una semana (casi) exacta para las postulaciones a las Us y me gustaría pedirles ayuda con su opinión experta en lo que trabajar/estudiar en el área se refiere.

He reducido mis opciones a estas dos carreras, mis puntajes me dan para ambas y actualmente estoy inclinado a la ""Licenciatura en Ingeniería en Ciencia de la Computación"" (LICC) de la católica, pero igual me preocupa un poco el tema del título. Debido a esto, me encargué de buscar muchos testimonios y opiniones en RRSS (incluyendo este sub) para recopilar ""pros y contras"" de cada una. Sin embargo, la incertidumbre se mantiene, por lo que me sería de mucha utilidad si pudieran **afirmar, refutar o, incluso, aportar con otra perspectiva** que haya dejado fuera de mi anáisis.

Desde ya muchas gracias.



**Ingeniería Civil en Computación - UCH**

**Pros**

* Título
   * ""En general, dentro de la industria nacional, el título es un filtro frecuente para conseguir el primer trabajo""
   * Si bien he leído que el trabajo en IT es mejor valorado en el extranjero, también es cierto que la experiencia a la hora de postular es importante. Por lo que si obtengo el título, podría armar un CV antes de apuntar a mejores pegas afuera.
* ""Apoyo académico"" / U top
   * Del top (UCH, USM, UC) me alcanza para ingeniería en las primeras dos, pero he leído que, si bien la dificultad entre UCH-USM es similar, en la UCH se preocupan mucho más de sus estudiantes. Así, ofrecen varias ""herramientas"" para sobrevivir los ramos (\*desconozco los detalles eso sí) y mantener en cierto grado la salud mental.
* Diversidad de contenidos
   * La duración del plan común es un plazo útil para revalidar la pasión por la computación o, en caso contrario, descubrir otro camino que me gustaría elegir.

**Contras**

* Malla curricular de plan común
   * He leído que las matemáticas, por muy difícil que sean, les han ayudado a cambiar la perspectiva en los problemas que se les presenta. Por lo que no voy a despreciar esos ramos de plan común.
   * Al contrario, los ramos de Ciencias Naturales (8 ramos) no son aplicables al mundo IT en general, a no ser que tu área sea científica/investigativa.
* Tiempo
   * Podría aprovechar esos \~2 años en ponerme al día en las tecnologías actuales, buscar pega por la experiencia, armar un portafolio, etc.
* Enfoque
   * No me interesa el ámbito investigativo / teórico, me gustaría trabajar en alguna empresa.



**Licenciatura en Ingeniería en Ciencia de la Computación - UC**

**Pros**

* Malla curricular
   * Desde el primer día, los ramos son relativamente los mismos que toman los que están sacando la ing en computación en la uc.
   * Es lo mismo que estudian los IT del extranjero, un *Bachelor in Computer Science.*
   * Te ahorras los ramos de Ciencias Naturales (en su mayoría).
* Tiempo
   * Son \~2 años menos
   * En el peor de los casos, donde sea difícil encontrar pega justo después de egresar, es un buen plazo para realizar certificaciones o aprender de las últimas tecnologías de ese tiempo.
* Antecedentes
   * La razón de la creación de la LICC fue porque los estudiantes de ing encontraban trabajo antes de titularse. Por lo que hay (o había?) pega, ya sea por contactos dentro de la UC o por demanda externa.
* Posibilidad de articulación a ingeniería
   * A esta fecha se está orquestando la posibilidad de articular a ingeniería una vez licenciado. 
   * \[Son 2 cupos por gen eso sí, pero la opción está 💀\]

**Contras**

* Solo sales con un grado académico → No podría optar a salarios altos en Chile
   * He leído que algunas empresas nacionales no tienen problema en contratar gente sin el título. No obstante, los puestos mejor pagados (gerenciales al parecer), en general son reservados para aquellos con el título de Civil.
* La articulación es poco probable

  


PD: me interesan las áreas de frontend, machine learning y ciberseguridad.",neutral
"Cómo puedo enfocar mi carrera? Soy estudiante de ing civil informática, si tengo que codear lo hago, pero no es algo que disfrute (a diferencia de hartos de mis compañeros), sin embargo me gusta mucho el tema de las finanzas, hablar con clientes, ofrecer soluciones y vender productos. (Por si se lo preguntan, si, pensé en ser ingeco).

En vola a futuro informática general por sí sola no sea una carera tan “”fuerte”” pero si será un piso súper sólido y valorado si uno busca especializarse a profundidad en x área. Si o si para cualquier carrera en unos años se requerirá una base técnica sólida.

Ya yendo al punto, les comento sobre mi perfil:

\-Me gustan las finanzas, emprendimiento, ventas, administración/gestión.

\-Me considero alguien extrovertido, en el día a día me es fácil congeniar con la gente y hacer amigos.

\-No disfruto de codear, pero tampoco es que me sea muy difícil aprender tecnologías.

\-Me llama la atención el rol del Quant Developer pero tengo entendido que en chile casi no hay campo.

\-Tengo familia en canadá pero soy más pobre que la chucha y no me puedo ir, en un futuro me gustaría hacer carrera afuera.

Que enfoque me recomiendan darle a mi carrera? para en un futuro poder diferenciarme de la masa y aprovecharla al máximo. Y que cosas me recomiendan hacer antes de egresar?. Los leo, de antemano muchas gracias.

(pd: usm casa central, por si alguien viene de ahí también) ",neutral
"Como es la cuestión? Me siento en un caos, todos dicen que en todo el mundo informática está valiendo callampa laboralmente, muuchos otros ya titulado están intentando entrar al este mercado, otro dicen que informática es el futuro y que todos ganan 3 millones. A quien le creo por dios? me saqué la chucha pa entrar a civil informática en la usm y siento que estoy perdiendo el tiempo la verdad, no quiero creer que el mercado está tan mal como dicen al punto de que por ej en eeuu nadie encuentra pega en computer science, dicen que medicina te asegura buenas lucas pero para ejercer fuera del país es básicamente sacar la carrera de nuevo. A los entendidos de aquí y/o gente que conozca bien el mercado, que hago? me salgo de la carrera, me especializo en un área específica de esta?, mi meta de vida es sacar a mi familia de chile e irnos a un país como canadá para poder vivir de una forma más cómoda, pero es un sueño que veo cada vez más lejano viendo como van las cosas. Que pasara en 5-10 años más? estaremos todos cesantes?. No entiendo realmente ni sé a quién creerle respecto al panorama IT. Soy todo oídos, gracias por leer.",negative
"Ustedes qué escogerían? Tengo título técnico de Analista Programador y ya con trabajo estable. No sé si continuar estudiando el próximo año o sacar algún diplomado/ cursos y esperar uno o dos años a ver.

Las opciones que tengo consideradas y en las que estoy aceptado son (todas tendría que pagarlas yo, con un poco de ayuda quizás):

1) Ingeniería de Ejecución en Computación e Informática (USACH): sale 5 M el arancel, dura 4 años, vespertino, saldría además con Licenciatura en Ingeniería Aplicada. Tendría que ir presencial a Estación Central xD

2) Ingeniería de Ejecución en Software (USM): sale 3 M y medio approx el arancel, dura 3 años, vespertino y sin licenciatura. Me queda cerca el campus en San Joaquín.

3) Solo dedicarme a trabajar y sacar cursos de educación continua, que me imagino son con otro ritmo a diferencia de pregrado, y enfocados en áreas más específicas/profesionales.

Realmente no sé qué hacer... algunos me dicen que el título ya poco peso tendrá en un par de años, en especial con la IA, y que me conviene más capacitarme con certificaciones y cursos. Otros opinan que sin título profesional siempre voy a estar limitado. ",neutral
"¿Redes o Ciberseguridad? El gran dilema. Este año salgo de T.U. Telecomunicaciones y Redes en la USM, pero tengo demasiadas dudas respecto a mi futuro, desconozco que me depara.

de acá a fin de año tengo que encontrar practica, pero, no se en que enfocarme.

no sé por donde orientarme, sé bien que hay que realizar las certificaciones pertinentes en cada área pero a la vez, desconozco si me conviene elegir la ruta de redes o ciberseguridad, aunque tengo entendido que se complementan.

  
Espero no ser el único que se enfrenta a la incertidumbre laboral y la dificultad para elegir un buen camino, sobre todo porque quiero buscar practica y a la vez, quedarme en esa empresa.

  
espero que haya gente de redes que pueda orientarme y/o gente del área IT, saludos!!",negative
"Diferencias para encontrar pega Llevo tiempo interesado en la informática y ya llegó el momento de decidir dónde estudiar la carrera.

Estoy entre entrar al DUOC UC o a la USM, pero me gustaría saber qué conviene más pensando en el mundo laboral, si hay mucha diferencia en las oportunidades o el tipo de trabajo que uno puede conseguir después de titularse?
Alguien que haya pasado por esto podría darme su consejo?",neutral
Ingeniería civil industrial o civil informática?? Duda simple este año doy la paes y quiero entra a la usm y no se cual de las 2 universidades entrar.tengo un buen nem de 6.9 y he estudiado arto para la m1,neutral
"Ing. Informática DUOC o INACAP? Hola a todos, este año me metriculo y necesito escuchar sus testimonios. Tengo 25 años, soy de stgo y estoy pensando en estudiar ing. informática, pero aun no sé si matricularme en el DUOC o INACAP, cual recomiendan? Y recomiendan diurno o vespertino? 


edit: de verdad muchas gracias por todas sus oponiones y su tiempo, evaluando todos los comentarios me inclinaré más por el DUOC, nuevamente gracias ",neutral
