full_content,sentiment_label
"Ingeniería Informatica o Ingenieria Civil Telematica? Buenas, 

Mi principal consulta es como indica el titulo, ¿Qué sería mejor, estudiar Ingeniería Informática o Ingeniería Civil Telemática?

El foco de mi pregunta va dirigido principalmente al quehacer de ambas carreras, si bien las dos son similares en algunos aspectos, no me queda muy bien a que podría dedicarse el telemático. Hace poco revisé la malla de la que se imparte en la UTFSM y vi ramos de informática, electrónica y telecomunicaciones. 

Entonces si estudio telemática:

\- ¿Puedo dedicarme a gran parte de las áreas de la informática mas, algunas de telecomunicaciones?, 

\- ¿Qué haría el telemático que un ingeniero puro de las dos ingenieras anteriores no? 

\- ¿Podría aumentar las oportunidades laborales al tener conocimientos de varios ámbitos, o reducirlo por no estar especializado derechamente en algo?

\- ¿Cuál sería la mejor entonces para poder encontrar trabajo y poder desarrollarme profesionalmente con mas soltura?

Y para aquellos que están estudiando/estudiaron la carrera, especialmente si es en la UTFSM,

\- ¿Qué tan difícil fue? y ¿Cómo es el ambiente en la universidad?

Gracias de antemano para todos aquellos que se den el tiempo de responder.

",neutral
"Consulta para Data Analyst/Engineer Estimados, les quería pedir sus aportes, ideas o experiencias acerca de cómo me puedo convertir en un Data Analyst o Engineer. Ahora mismo estoy cursando la práctica, estudie el técnico de analista programador computacional, en instituto, y mi idea es, trabajar para poder pagar mis estudios. La idea era completar la ingeniería, pero me di cuenta que me interesa mucho más la ciencia de datos, pero no tengo muy claro cómo poder estudiar. 

Se que las opciones reales son estudiar en una universidad o en un instituto. La primera no sé si sea muy viable para mi, porque por lo que vi, en las universidades (mayor, uc, uc de valpo, utfsm) aparte de tener un arancel muy alto, se estudia en modalidad diurna, por lo que creo se me complicaria trabajar para poder costearla. Por otro lado el insituto es más conveniente por lo mismo, poder estudiar de manera vespertina mientras trabajo. 

¿Son realmente esas las únicas opciones ? ¿Cómo se convirtieron ustedes en Data Analyst/Engineer? ¿Qué harían ustedes en mi lugar? 

Les agradezo de ante mano cualquier consejo, experiencia, aporte. ",neutral
"Técnicas y tecnologías para estudiar y aprender mejor? Ingresé a estudiar Técnico en Informática en la UTFSM de Concepción, comienzo en Marzo. Ya he intentado estudiar Informática antes, en la UdeC, con resultados desastrosos y mucho dinero perdido. Esa vez me sucedió con 18 - 19 años (por inmadurez y por lo que a mi parecer en ese entonces era una enseñanza un poco arcaica), ahora con 26 creo que estoy más preparado en términos de madurez, lo que hace que quiera sacarle el máximo provecho a esta segunda oportunidad.

Me he estado preparando desde Diciembre del 2024, estoy estudiando Desarrollo Web porque es a lo que me gustaría apuntar en mi futuro laboral, pero entiendo que la carrera me va a brindar un espectro más amplio y sobre todo los fundamentos de la computación/programación, etc. No estoy estudiando tanto por el hecho de aprender HTML, CSS, JS u otra cosa, sino que para *Aprender a aprender*. No sólo la habilidad de programar si no de obtener un buen desempeño en mi currículo académico.

Mis conocimientos en Matemáticas no son mi fuerte, es algo que siempre me ha costado y que he tenido que reforzar constantemente, sumemos ahora que debo aprender a programar, es decir, solucionar problemas desde la abstracción y me tiembla la pera un poquito.

Recurro a uds. entonces, para consultarles:

¿Como puedo enfrentar estos próximos 2 añitos para estudiar de forma efectiva y aprender e integrar de mejor manera los conocimientos?

¿Me puedo apoyar de alguna tecnología sea software o hardware, más allá de The Odin Project, freeCodeCamp, udemy / iPad, Tablet, eReader u otro?

[Coming Soon - March 2025](https://i.redd.it/gnhzywtzh0fe1.gif)",neutral
"Opciones para estudiar informatica. Holaa, esta es la primera vez que posteo en reddit y la verdad es que este tema me tiene bastante acomplejado, pasa que entrando este año necesito estudiar si o si y me ire por la informatica, pero por temas de ptje no me da para una u top como la puc, usach, utfsm ni nada así, estuve revisando dentro de mis posibilidades y las u que mas se adaptan al perfil de egreso que busco, son la autonoma, la umayor, la udp, la uft y la ubo, ya que estas tocan mas los temas de desarrollo de software, ciberseguridad y analisis de datos en general.

¿alguien podria asesorarme sobre estas opciones, alguien que estudie o haya estudiado la carrera en una de estas instituciones o que solo sepa sobre ellas?

¿o que otras universidades recomiendan en las que se enseñen en su mayoría estos 3 temas?(desarrollo de software, ciberseguridad y analisis de datos) (y obviamente que no sea tan exigente en admisión, ya que en la mayoría de las universidades pondero entre 580-600 aprox), añado también que debe ser una u adscrita a gratuidad, ya que no puedo permitirme pagar una carrera, ni el cae.",negative
"Dudas sobre Ciberseguridad y como entras Hola, soy egresado de ICI hace unos años y me motiva el tema de la Ciberseguridad solo que mi U no tenia tanto contenido al respecto en su malla ni en cursos electivos, tome si pese a todo un curso electivo de intro a la Ciberseguridad que explicaban cosas basicas sobre encriptacion, codificacion, keys y firmas digitales y algo se hablo de maquinas Kali pero no negare que por darle prioridad a otros ramos no pude meterme tanto al tema de las maquinas Kali.

  
Dado lo anterior estoy pensando en entrar mas al mundo por que me interesa harto y por que quiero expandir mis conocimientos laborales mas alla de lo que hago ahora que es software development pero no estoy muy seguro de donde empezar, he visto un Bootcamp en CodingDojo, un diplomado de Ciberseguridad en la UC y en la UTFSM o simplemente internet y youtube apañarian?

P.D:  Fui ayudante de redes de computadores y sistemas distribuidos y he leido q esos conocimientos igual apañarian en Ciberseguridad, que tan asi es?",neutral
Editoral de El Mercurio un día antes de la matanza en la Escuela Santa Maria de Iquique ,neutral
In 1907 in the city of Iquique potentially thousands of striking workers and their families were killed during the Santa Maria School Massacre ,neutral
"Películas dobladas en sector poniente Cómo es posible que prácticamente todas las funciones del sector poniente de Santiago sean dobladas y en el sector oriente sea todas subtituladas?! Los del Cinépolis creerán que somos tontitos? Existirá algún registro indicando que realmente no podemos leer subtítulos? 

Que rabia que siempre sea así!",negative
Mejores colegios PAES proceso de admisión 2025 ,neutral
ahhh que bonito el sur de chile (foto tomada en santa maria de pua) ,positive
"(pal-paraiso) metro de santiago a 2039 En 2021, Santiago perdió gran parte de su poder político al perder su estatus de capital, aunque su repentino aumento de población compensó parcialmente esta pérdida.

Para 2039, la ciudad de Santiago del Nuevo Extremo será la ciudad más grande del Reino de Chile con más de 13 millones de habitantes. También tendrá el sistema de metro más grande del país, con 995 km de vías y 849 estaciones, lo que lo convertirá en el segundo sistema de metro más grande del Reino y del mundo, solo superado por el de Buenos Aires.

Es el componente central del sistema de transporte de la ciudad, junto con el tren de cercanías y el sistema de autobuses de tránsito rápido Transantiago.

Y es motivo de orgullo para los habitantes de Santiago.

El metro conecta con todos los medios de transporte de la ciudad.

Entre ellos se incluyen los trenes de cercanías, los trenes de larga distancia, los trenes de alta velocidad, los tranvías, los monorraíles, los funiculares, los teleféricos y el Aeropuerto Internacional de Santiago.",neutral
El mundo fantástico de los shaper locos! ,positive
"¿Qué diplomado elegir para avanzar en ingeniería civil industrial? Buenas gente,

Como dice el titulo simplemente nose que wea elegir, tengo 24 años (H) y saque Ingeniería Civil Industrial en la UA (Universidad de Antofagasta).

Como contexto trabaje como Analista de datos durante 1 año (me desenvolví bien pero termine renunciando por temas de lucas/responsabilidades) y actualmente llevo 4 meses como Analista de Confiablidad para una empresa que presta servicios a minería (gano el doble que mi pega anterior, ya titulado), la pega es buena y ya tengo indefinido por ciertos proyectos que presente y dieron muy buenos resultados.

La duda realmente es que aqui donde estoy la mayoría tiene el diplomado de ""Gestión de Activos"" de la federico santa maria y tal vez todo apunta a que tomare ese, pero realmente con mis conocimientos y mis gustos me atraería mas tomar uno de inteligencia artificial o algo por el estilo, mas que uno que se enfoque en mantenimiento o equipos, algo mas ""avanzado"" por asi decirlo, ya que el conocimiento técnico lo puedo adquirir con practica/terreno que esta misma empresa me ofrece (tambien tengo mi tecnico medio electromecanico que me ayuda harto con esto igual)

De igual forma siento que el diplomado que tome ya seria suficiente para mi con lo relacionado a estudios, así que igual es importante para mi, ya que seria esto y nada mas, no tengo pensado hacer un magister por el tema de tiempo/plata y por quedar como sobrecalificado para ciertos trabajos. (Es posible que otro diplomado si, pero no mas que eso)

Obviamente la finalidad de esto es el tema +lucas y oportunidades, quizas optar a algun teletrabajo y porque no algun cargo alto, principalmente optando a mineria ya que no es opcion para mi trabajar en algun banco o algo mas de ciudad.

Esperar unos años mas para ver donde va mi futuro profesional sin apresurarme a estudiar algo tambien es una opcion, pero siento que mas adelante no lo hare o ya cuando pase 1 año sentire la desesperacion de no haberlo hecho y quedar atras competitivamente

Se que no sere el unico que haya pasado por esto y me gustaria leer sus experiencias, consejos y que universidad es mejor para continuar con un diplomado.

Agradeciendo su tiempo los leo",neutral
TV Chilena un mes de mayo de 1987 (de parte del diseño más confuso de una grilla programatica) ,neutral
Valpito ,neutral
Camara de Diputados define a 12 miembros de la comisión de expertos ,neutral
El Mercurio ,neutral
Hoy se cumplen 116 años desde la matanza en la Escuela Santa María de Iquique ,neutral
"Hombres que se han hecho una lipo o procedimientos esteticos Buenas amigos redditores, quisiera saber si podrian compartir sus experiencias con este procedimiento.

Hago deporte y en general me cuido harto pero hay una grasa que definitivamente no baja, siempre que hago procesos de definicion bajo mucho de peso y gano masa muscular pero la zona del pecho y abdomen bajo no baja al punto de como quiero que se vea. Asi que fui por un hack y estoy cotizando una lipo en esas mismas zonas, el doc me ofreció lipo + retraction para la zona del pecho y abdomen en la Santa Maria.  
Lo has hecho o conoces a alguien que lo haya hecho? Me compartirias tu experiencia?

1. Cuanto pagaste.
2. Recomiendas algun lugar?
3. Valio la pena?

Muchas gracias!",neutral
"Canciones oscuras/Densas/Perturbadoras de autores Chilenos? Aprovechando que fue halloween hace 2 días jjjjaa.
Me interesan estas 2 cosas: el terror/lo oscuro y la música. He estado tratando de averiguar canciones con trasfondos densos u oscuros, o también su sonido. Como ejemplo puedo dar ""Confesiones de un psicópata en La Dehesa"" de Cevlade, hablando sobre el Tila. También la cantata de La matanza de la escuela de Santa Maria de iquique (siendo más, un ""álbum""). Las canciones de ""Neblinum"" también caben, estoy acostumbrado a la música que suena fuerte y densa, pero me impactó cuando se ponía a llorar en una de sus canciones... y bueno, ahí pueden mencionar algunas!",neutral
Visita del humorista Manolo González al Presidente Electo Eduardo Frei Montalva. Revista Ercilla 1964. ,neutral
