full_content,sentiment_label
"Desahogo con respecto a mi presente profesional en IT (texto largo) Hola gente

Este post es mas bien un desahogo con respecto a mi presente profesional y personal. Considérenlo como una continuación de [este post](https://www.reddit.com/r/chileIT/comments/1ayc8fb/adaptarse_al_mercado_o_enfocarse_en_tecnologias/) y les pido tanto a los mods como al admin que no bajen la publicación ya que necesito la opinión de quienes puedan comentar y así tener mas claridad de lo que puedo hacer

Yo llevo 10 años como profesional primero haciendo sitios Wordpress y luego en trabajos mas grandes como Fullstack en PHP y JS, aunque en estos últimos años me he estado especializando en Backend y Devops. No es que odie PHP pero siento que ya no me aporta nada a mi CV y necesito enriquecer mi status profesional, mientras que con JS casi siempre he tenido trabajos en Frontend y para mi es un área del cual no me siento cómodo de trabajar. Por eso me enfoco en Backend y Devops siendo Go mi caballo de batalla del cual quiero destacar en mi CV pero siempre me rechazan debido a la falta de experiencia, al contrario me llueven ofertas de Fullstack en PHP o Frontend en JS del cual dudo en aceptar salvo que sea por necesidad como en mi anterior trabajo.

Con lo anterior me sigue dando vueltas la pregunta del [otro post](https://www.reddit.com/r/chileIT/comments/1ayc8fb/adaptarse_al_mercado_o_enfocarse_en_tecnologias/): ¿Adaptarse a las tecnologías que se usan en el mundo laboral? ¿O enfocarse en una tecnología o área del cual uno está a gusto de trabajar? Para mi es algo muy difícil de responder ya que he tenido experiencias pasadas muy pencas que me dejaron con traumas y hasta normalizo sus practicas hoy en día. Por ejemplo cuando hacia de front me pedían maquetar el sitio desde colores, formas, tamaños, transiciones que, junto con ReactJS son cosas que a mi no se me da. Menos mal que aprendí VueJS y en un trabajo teníamos un diseñador del cual yo implementaba todo lo que el hacia pero al final yo era el responsable de todo y era una carga que no estaba a gusto de asumir. Por eso mismo no busco y hasta rechazo ofertas que incluyan algo de Frontend ya que si bien no es mi fuerte aun tengo miedo de volver a trabajar en eso, no sentirme cómodo y hacer un mal trabajo. Al ser de región la oferta laboral es menor con menos sueldo y tecnologías antiguas, para un proyecto financiada por una universidad ganaba 500 mil ya que unos años de experiencia y a los meses me reemplazaron por un practicante de la USM (que dio la cacha al final), una vez trabajé en Santiago como Fullstack en PHP pero viajaba todos los días y mi sueldo era rozando el millón liquido, y para una agencia de diseño me pagaban 250 mil por sitio Wordpress entregado y en caso de no haber clientes no pagaban, me amenazaban intentando retenerme y fue gracias un amigo que logré salir de ahí.

En el otro post alguien mencionó de que los lenguajes son una herramienta mas. Me gustaría creer eso ya que tuve una oportunidad de trabajar en NodeJS lado servidor sin mucha experiencia y me pude adaptar de lo mas bien, pero aun así mi stack actual ya no me da valor y busco algo mas actual y vanguardista. Por eso de los muchos lenguajes de moda hoy en día me gusta Go por su sintaxis, similitud con C y potencial uso en Devops y microservicios pero aun así no tengo oportunidades ya que siempre me piden experiencia previa sumado a que salí de un instituto no tengo una buena base sobre arquitectura, SOLID, patrones y otras cosas salvo el desarrollo. De hecho en una charla en el 2023 uno de los expositores mencionó estar feliz trabajando en Rust que ya no quiere volver a tocar código Java, C# o PHP, mientras yo me pregunto ""¿Como el llegó a trabajar con dicho lenguaje? ¿Trabaja para el extranjero? ¿Encontró una empresa chilena que lo use? ¿Y de verdad está tan confiado en que no volverá a tocar código de lenguajes que suelen ser odiados?"" Yo personalmente desearía estar en sus zapatos y aceptar trabajos que de verdad me gustan en vez de aceptar trabajos con tecnologías que no son de mi agrado pero a veces me doy cuenta de mi realidad y se me pasa, luego me hago bolita y me pongo a llorar.

Si tuviera el tiempo aprendería Rust, Ruby, Python o incluso C junto con Message Brokers como Apache Kafka o RabbitMQ, bases de datos NO SQL aparte de MongoDB y profundizar DevOps, pero ahora mi prioridad es sobrevivir la cesantía mientras busco la forma de crecer como profesional al aprender (y ojalá aplicar profesionalmente) Go. Se que lo mejor es trabajar para el extranjero pero si tengo problemas aquí los tendré en cualquier lado así que necesito superarlos y saber como enfrentar la realidad al menos aquí en Chile. Podría freelancear mientras aunque debido a como soy prefiero hacerlo bien piola vía Fiverr en vez de tener una cartera de clientes y hacer marketing con mis servicios (ya que no falta el cliente que necesite un sitio en Wordpress) así que mientras estoy viendo cursos de barista para subsistir (ya que no falta el café o salón de té que necesite uno).

Así que eso, me gustaría saber como puedo conllevar todos estos temas y como surgir como profesional. No soy de muchos amigos y mi actitud introvertida me ha impedido ir a mas charlas, formar una red de contactos o amistades con colegas para al menos ir por unas cervezas o armar su tarreo geek. Si hay alguien de la V región le interesa contactarse conmigo o si saben de una charla en la que pueda ir y no tome todo el día (asumiendo que es en Santiago) pues me sumo con tal de saber otras experiencias y tirar mi CV hasta que caiga un trabajo ideal para mi.

Un abrazo

PD: Estoy muy a gusto de compartir mi CV o Linkedin, a pesar de mis bajos ánimos sigo estudiando Go y ahora estoy viendo como hacer un SDK de integración con Mercado Pago. A pesar de aun no mandar mi CV a Mercado Libre ya lo haré",neutral
"Campo laboral de cloud Hola a todos, soy ingeniero civil informático titulado de la usm, he estado unos meses buscando mi primer trabajo como desarrollador full stack, pero sin éxito todavía, por otra parte, estaba interesado en empezar a estudiar cloud, para trabajar como cloud engineer o architecht. Quería ver si me pudiesen recomendar que rumbo tomar, saber si con certificarse en algún servicio cloud me es suficiente para poder buscar un trabajo de junior, o seguir buscando trabajo de desarrollador.

Cualquier información que me puedan otorgar se agradece.",neutral
"Ing en Informática vs Ing Civil  Alguien que haya estudiado Ing en informática ya aea en la USM (sede viña) o cualquier otra equivalente, que pueda iluminarme xon au exp por favor ;(",neutral
"Consejo para universitario inexperto Buenas comunidad, soy estudiante de quinto de ing civ electrónica en la usm (cc). Mi mención es computadoras y me interesa caleta todo lo relacionado con software, sin embargo, siento que la carrera me ha enseñado de muchas cosas, pero en ninguna me he ""especializado"" entonces siento que si bien he aprendido sobre el área no estoy especializado en nada, y cuando he tratado de buscar práctica siempre se busca a gente que ya haya metido harta mano al área y yo estoy  recién empezando. Mi petición es que si alguien entendido me pueda recomendar que puedo hacer en mi caso para encontrar práctica, o para prepararme individualmente para lo mismo (este semestre me toca full ramos de mención, pero ni cagando salgo como experto). Gracias de antemano.",neutral
"Giro de carrera o consejo  [Alerta de mucho texto]
Hola a todos que tal como van, esperando que todo bien les quería preguntar o pedirles un consejo, les cuento soy Ingeniero civil electrónico de la USM, llevo ya un tiempo trabajando en una empresa dedicada a temas de automatización( cumplo 3 años este mes), estoy mas dedicado a la venta, estilo el cliente tiene un problema y debemos desarrollar una arquitectura para abordar ese problema obviamente dedicado a temas de automatización industrial, Scadas, adquisición de data, etc.
Hace ya año, comencé a introducirme en temas mas IT, obviamente manejo algunos temas de redes pero nada del otro mundo. Comencé a aprender AWS me pareció interesante y comencé a darle mas profundidad ( le dedico unas 4 horitas diarias 2 antes de ponerme a trabajar y dos después) de eso ya ha pasado 1 año y medio, hago algunos proyectos propios básicos, onda levantar wordpress con balanceadores de carga, migración con DMS, algunas con IOT que es mi área entre otras cosas.
La cosa es que mi picó el bichito de entrar a algún entry job dedidado a Cloud orientado a venta( que es lo que tengo mas experiencia) principalmente por que hay cosas que no manejo dentro del
Desarrollo web, en este tiempo de aprendizaje saqué las certificaciones de Associate( me falta 1 ) y bueno nosé si el mundo de IT existen estos roles tecnicos y ventas, que me aconsejan? Igual es mi pega actual estoy bien, pero ya estoy un poco quemado y me gustaria moverme para seguir aprendido.
Eso cuidense y cualquier
Comentario es bien recibido 

Saludos !!",neutral
"Pucv o Usn? wena los cabros, que tengan todos un hermoso dia.

mi problema es el siguiente, actualmente estoy en 4to medio y obviamente estoy en ese momento en el que debo decidir que cresta hacer en la u, yo desde siempre he tenido una afinidad por la programacion por lo que ahora mismo estoy planeando estudiar ing. en programacion o informatica y mis opciones son la Pucv, Ucn (principalemente pq he escuchado que son piolas y tengo familiares cercanos a ambas U, no cuento a la Usm pq he escuchado unas weas satanicas de esa u y valoro mi vida personal).

entonce, les pido porfavor a los estudiantes o egresados de esas dos u que me cuenten cual fue su experiencia, para asi tener un poco mas de nocion sobre a q me voy a meter.

hasta ahora mis preocupaciones son:

-profes desgraciadamente desgraciados

-carga o estres por los ramos

-relevancia de las materias para la actualidad

-influencia del titulo de cada universidad a la hora de buscar pega

-ofertas laborales durante el transcurso de la carrera

ejo noma cabro

muchas gracias!

",neutral
"Hilo Semanal de Consultas IT - Asesoría Técnica, Desarrollo Profesional y Aprendizaje Hola, soy David (*admin*), ¡bienvenidos a nuestro espacio semanal de consultas! Aquí, puedes pedir o dar asesoría sobre los siguientes temas del sector IT:

1. **Soporte Técnico:** Problemas con dispositivos, programas, errores de código, uso de herramientas y tecnologías específicas, y tutoría en conceptos IT.
2. **Desarrollo Profesional:** Orientación sobre elección de carreras, preparación de CV, técnicas de entrevistas, y información sobre empresas y expectativas salariales.
3. **Recursos de Aprendizaje:** Recomendaciones de libros, cursos, tutoriales y plataformas de aprendizaje para mejorar tus habilidades técnicas.

Recordemos que la participación de todos es esencial para hacer de este hilo un recurso invaluable. Si bien me comprometo a responder a todas las consultas pendientes, tu experiencia y conocimientos son vitales para enriquecer nuestras discusiones. ¡Espero ver tus preguntas y respuestas!",neutral
¿Humano egresad@ de tec. Química utfsm? Os leo.🦦,neutral
"Investigación del CEP revela que colegios particulares ""inflan"" notas, manteniendo sesgos económicos ",negative
"Trabajo en el observatorio ALMA, AmA Ayer se hizo el anuncio de la primera imagen del agujero negro que se encuentra en el centro de nuestra galaxia hecho a través del proyecto EHT y el observatorio ALMA ubicado cerca de San Pedro de Atacama fue una parte relevante de este proceso.

Actualmente trabajo como ingeniero electrónico en el observatorio y si tienen consultas que hacer sobre la operación y mantenimiento de este instrumento, bienvenidos sean.",positive
"En que carreras se destaca la universidad Andres Bello? Hola buenas, para dar un poco de contexto tengo 19 años, sali con buen puntaje PAES (aunque planeo darla denuevo) y me tome el año para trabajar mientras veo bien que estudio.

Con todo eso dicho, estaba viendo que opciones de universidades tengo y una de las mas accesibles (por no decir una de las pocas) a las que podria entrar *seguramente* es la Andres Bello, Ahora, no he investigado mucho de esa U en particular pero por lo que vi tiene una carrera en el area de la tecnologia de la informacion que me interesa (ing. informatica). Lo unico malo es que no he escuchado a mucha gente hablar de esta U, ya que siempre se habla o la de Chile o la Catolica.

Alguno me podria ayudar para saber si vale la pena estudiar ahi?",neutral
"UAI - Ingeniería Civil en Minería Alguien estudiando está carrera en la UAI o con algún conocido que me pueda compartir sus impresiones? Se que se ingresa en plan comun de Ingeniería Civil y en el 3er año se escoje por donde continuar. De momento me  la Ingeniería Civil en Minería. 

Se que no es la Cato, ni la Chile o la UTFSM pero el enfoque de la carrera tecnico-gerencial como lo presentan me parece interesante. ",neutral
"Ingeniería civil informática Quiero estudiar ingeniería civil informática, pero nose en que universidad, he visto la usach, la ucn y la de conce

Nose si tienen otra universidad que recomienden para esta carrera o algún consejo o algo sobre estas tres universidades ",negative
"Magíster en energía ¿sí o no? Hola redittores, soy 34M, trabajo en mtto de equipos de termoeléctricas. Quiero especilizarme en reconversión de este tipo de plantas, y fortalecerme en el rubro.

Soy ici, y quiero especializarme, no sé si tomar el magíster de ing de la energía de la UC (el MIE) o el Magister en economía energètica de la UTFSM.

Qué programa recomiendan tomar? Aconsejan otro?

Gracias!",neutral
"¿Que tan normalizado está el copiar en las universidades chilenas? Vi recién un post preguntando acaso la gente del sub ha copiado alguna vez en la U y mirando las respuestas me parece que se está abriendo el melón de lo normalizado que está copiar en las universidades chilenas. 

Yo estudié hace ya unas dos décadas atrás en una universidad de región y debo decir que la copia estaba bastante normalizada. No sólo que muchos de  estudiantes trataban de copiar, sino que en algunos casos era obvio que los profesores se hacían los lesos, incluso  en algunas ocasiones hasta salían de la sala dejando a toda la clase sola por diez minutos o más, en los que pasaba de todo. 

Entonces la pregunta que me nace es, ¿Que tan normalizado está la copia en las universidades en Chile? Porque en ese entonces yo pensaba que era algo de mi facultad solamente, pero leyendo el otro post me quedó la sensación de que es algo mucho más generalizado y de lo que se habla muy poco.",negative
"Diferencia entre ingenieria (a secas) e ingerieria civil? Eso, no tengo claro cual es la diferencia en términos de estudio y laborales",neutral
"¿Sueldo de Ingeniero Civil Industrial sin experiencia? (Tips para encontrar trabajo se agradecen igual) Hola, feliz martes.  


El año pasado me titulé de Ingeniero Civil Industrial de la UTFSM, Casa Central. Después de darme un descanso estos meses, estoy comenzando a postular a trabajos, pero respecto a la pregunta de ""pretensiones de renta"" me queda la duda de cuánto es un monto razonable a pedir (líquido).  


Según MiFuturo, el suelo bruto de ICI de primer año para el 2023 fue de de 1.719.151 CLP mensuales ([MiFuturo](https://www.mifuturo.cl/buscador-de-estadisticas-por-carrera/)). Considerando impuesto a la renta, AFP, Fonasa y descuentos menores, entiendo esto debiera derivar en torno a un sueldo líquido de 1.4M.  


He escuchado sueldos líquidos en torno a 1.3M y 1.5M, pero quería consultarles igualmente.

Quería saber si alguien me podría ayudar con esto; si ustedes saben o conocen de alguien que haya encontrado trabajo el año pasado o este, en qué y su sueldo líquido aproximado.

Igualmente, agradecería cualquier tip que tengan para encontrar buen empleo.

Muchas gracias.",neutral
"Mejor universidad de chile? Cual es mejor, la universidad Católica o la U de Chile y porque?",neutral
"Me arriesgo a meterme a una U para estudiar ingeniería en informática o me meto al duoc y filo? Sé que ya hay muchos post de esto pero como mañana se entregan los resultados de las postulaciones y luego empieza el proceso de matrículas estiy desesperada y todavía no sé por qué chucha decidirme, y la verdad me ayudaría muchosi alguien de ustedes pudiera aconsejarme :(

Me interesa ess carrera y postulé a la unab, la usach, la udd y la utfsm. Hasta lo que ví quedo en todas, pero el tema es que no sé si dar el siguiente paso y matricularme en alguna pq me da demasiado miedo que me hagan mierda a puras matemáticas y no poder aguantar. He estado revisando las mallas curriculares y hasta ahora la que se ve más """"""piola"""""" es la de la utfsm, pero otra cosa es con guitarra ya una vez dentro de la u misma.

Estos últimos meses me he dado cuenta de que las matemáticas me gustan y que si le meto color las puedo entender (Contexto: en el colegio no les di mucha bola y me iba más o menos pero ahora que me tuve que poner a estudiar para la paes le puse color y hasta me fue bien en la M1 pq me di el tiempo de estudiar y entender materia a la que antes me la pasaba por el ñackson). Pero aún así sé que en la universidad ya es distinto. Pienso que, si me meto a alguna de esas universidades, voy a tratar de repasar lo que más pueda la materia de la malla o lo que me sirva para nivelarme, pq he visto que está lleno de clases de eso en youtube y hasta hay clases de las universidades subidas ahí mismo (No las había revisado antes por temas de tiempo y pq tampoco alcancé a estudiar todo pa la m1 y m2, so igual me siento media desnivelada).

También he leído mucho por aquí que en informática el lugar de donde saliste importa poco, sobre todo pa irse a trabajar  otros países (Que es una de mis metas), e incluso lo he visto a través de miembros de mi familia que estudiaron en institutos pencas y ahora tienen buen sueldo y viven de lo más bien (Porfa no me digan que les pregunte a ellos pq con esas personas actualmente tengo 0 contacto y/o simpatía). Por eso también creo que tal vez sea innecesario meterme a una U a quemarme las neuronas si puedo meterme a un instituto y, aunque tal vez me cueste un poco más al principio, lograr lo mismo que lograría habiendo salido de una U.

Mi opción de instituto es el duoc, del que he visto buenas opiniones y me llama la atención el hecho de que después podría sacar diplomados en la católica (no sé si sirvan tanto pero igual me llama la atención) o tal vez hacer lo mismo en otras universidades. También me atrae el hecho de que en dos años podría sacar el título de analista porgramadora y empezar a trabajar mientras estudio para sacar la ingeniería, y así podría ir ganando experiencia laboral y también ir juntando money.

Siento que debería arriesgarme con una U y poder probarme que soy capaz, pero también dudo de ser capaz de poder sacar los estudios en una universidad.

Qué opinan ustedes? Algún consejo que puedan darme? Qué saben de las universidades que nombré y/o del duoc? Cualquier ayuda me serviría y se las agradecería muchísimo:), las/los leo.",negative
"Magister en énergia Hola a todos! (yo de nuevo xd)

Tal cimo reza el tîtulo: Estoy recolectando experiencias sobre magisteres en el àmbito electricidad/énergie. Acudo a sus experiencias y sapiencia: ¿Vale la pena?

He visto la UC , UTFSM y UAI. Creo que ese es el orden de interés. 

Mi duda grande también es si es mejor el magister en ciencias de la ing o seguir alguno de estos programas , cuyo caràcter es profesionalizante.

De verdad, toda ayuda me sirve.

Gracias a todos!

",neutral
"ABRO Ama DE DUDAS DE BECAS CAMBIO DE CARRERA y DE U; ELIMINACIONES DE CARRERA, CONVALIDACIONES, estudios de ING CIVIL... Eso, redditores,  estuve primero en un IP con el nombre del libro de Ercilla (conta) de ahí trabajé, pasé a la UTFSM en el 2019,  mal año , a civil industrial y me cambié a la USACH sobreviviendo de una fea (carta de eliminación injustificada).... bueno he visto, he ayudado, fui ayudante de la u, estuve apoyando en inclusión, la VRA y a las asistentes sociales. Pregunten lo que quieran y con gusto ayudo. La idea es que no se dupliquen las dudas.

Ams, además pueden preguntarme por becas y gratuidad, FSCU y CAE.

Los leo.

  
edit: es AmA y me di cuenta del mal tipeo después.",neutral
"Qué logos de universidades/ip o cft les gusta más?  Me gusta el de la universidad de chile, el de la universidad de playa ancha, la católica de Valparaíso y la católica de chile",neutral
"PUC o UCH para Ingeniería Verán, voy en 4to Medio preparándome para la PDT (ex PSU), siempre le he puesto weno a los estudios, áreas como la Matemática y la Física me encantan, en los ensayos del preu me está yendo bastante bien como para entrar a cualquiera de las 2, quiero estudiar Ingeniería Civil para probablemente después irme a Informática o Matemática, la cosa es que de toda mi vida había querido ir a la PUC ya que había ido reiteradas ocasiones allá (talleres, competencias, etc.) y San Joaquín es sencillamente hermoso, pero últimamente como he hablado con harta gente me han dicho que la UCH igual era super buena, y que de hecho su enfoque es mucho mas matemático que el de la PUC, y que en esta a la gente se le enseña a fabricar dinero y que aparte si no traes puesta una chaqueta North Face te miran en menos y cosas así, por favor si hay gente que ha ido a estas universidades que me cuente su experiencia plis :c, creo que preferiría a ser un ingeniero/informático capo a ser una maquina de dinero (que es como me han descrito la PUC) gracias de antemano

EDIT: En temas de distancia San Joaquin me queda a 1 hora y Boxef a 15-20 minutos",positive
"Mejores universidades para estudiar informatica?  Lo del titulo básicamente. Quiero estudiar ing. civil informática/computación, pero no se cuales son las mejores de chile para estudiar eso. Hasta ahora la PUCV y la UDP son como mis principales candidatas, pero también he visto la usach, uchile, puc, utfsm y la udec. 

  Cuáles crean que sean las mejores? Tipo, por lo que han escuchado o demás. Por ahora, dependiendo de si me dan becas o no, yo creo que estoy tirándome más por la UDP porque Santiago es Chile y puedo conseguirme una beca parcial, pero igual quiero ver qué opina mi sub querido.",neutral
"usach o la pucv para estudiar ingeco? En unos pocos días más se sabrán los resultados de la PAES y veo poco posible que el puntaje me dé para estudiar en la chile o la puc, y dicen que la UAI es bien cara. Las 2 que mencioné en el título son las otras que tenía como alternativa, pero también tienen sus mañas, la cuestión es que buscaba estudiar en una u que tuviera la mención en economía, cosa que la pucv no tiene y la usach si, pero esta última por lo que leí tiene la fama de irse a paro a cada rato, lo cual me complica porque soy de región:(. 
¿O debería darme el año mejor? 
Agradecería mucho también si me pudieran nombrar otras u que tengan la mención.",negative
"Alguien sabe como terminan los egresados de una carrera científica en Chile? Tenía planeado licenciarme en física, porque en el colegio me iba siempre bien sietes piola y me gusta,  di la PTU me fue bien y en general pondero entre 740, pero con la llegada de la pandemia/clases online me decidí tomarme el año para ayudar el negocio familiar. El punto es que dudo de estudiar la carrera, pq el sesgo general es que te dediques a estudiar una ingeniería si eres bueno para la matemática, pero nunca me tinco mucho la idea en comparación de ser científico afín. Aún así, ver que la investigación es bastante competitivo y el financiamiento es escaso, aún hablando en el contexto al salir al extranjero, desmotiva. A la vez, tampoco se si al terminar hayan muchas oportunidades dentro de Chile. Entonces quería saber si vale la pena estudiar carreras en el área de la ciencia o que alguien que este estudiando y que quiera compartir su experiencia.

P.D : En cuestión a la hora elegir u, cuál creen que es mejor en general, ambiente y en facultades?  (PUC, UDEC, UCH, UTFSM)",neutral
"Consulta Técnico Informática Hola. Tengo una duda sobre la carrera que quiero estudiar, si me pueden ayudar se los agradecería.
Me gusta el área de la informática. Mi idea es estudiar una técnica primero, durante ella aprender por mi cuenta todo lo que pueda y especializarme con cursos en un área especifica. Cuál será mi mejor opción?

- Técnico en Informática en la UTFSM
- Analista Programador DUOC
- Analista Programados INACAP

He recibido buenos y malos comentarios de las 3.
Si hay alguien que esté estudiando o se haya titulado de alguna de estas carreras, para saber también su empleabilidad.
Muchas gracias!

PD: También he considerado estudiar Ingeniería en Informática",neutral
