full_content,sentiment_label
"El gran mito de la USM https://preview.redd.it/qz5t0ycx840h1.png?width=920&amp;format=png&amp;auto=webp&amp;s=84385abb8e4e4b6026eee06b72a70da0bdaa0c8d

Cada año que pasa me intriga más el mito que rodea a los egresados de Universidad Técnica Federico Santa María (USM). Si hablas con cualquiera de ellos o con sus profesores, te van a jurar de guata que son ""la mejor universidad de ingeniería del país"" y que su nivel de exigencia los hace una especie de raza superior de ingenieros. Pero cuando vas a los datos reales y duros, la realidad es súper distinta. Tampoco es que sean los ingenieros más cotizados o demandados del mercado actual en comparación a los de la PUC, que suelen quedarse con los puestos directivos y de alta gestión (en gran parte por redes de contactos y habilidades blandas, algo en lo que la USM históricamente cojea). Y en exigencia la BEAUCHEF es muy superior. Y tampoco tienen el máximo nivel de acreditación que son 7 como las mencionadas y por agregar a algunas como la USACH. Entonces: ¿De dónde sale este ego o mito gigante? Es un lavado de cerebro que les hacen los profesores desde primer año para compensar que los hacen sufrir ? ¿Es un ramo de primer año que se llama ""Ego Sansano I""? ¿O simplemente es orgullo de haber sobrevivido a una universidad que confunde la verdadera ""excelencia académica"" con maltrato psicológico y nula vida universitaria?",neutral
Estudiante ataca a profesor en USM de Valparaí­so: docente fue trasladado a un centro asistencial ,negative
Amenaza de tiroteo en campus de la usm ,neutral
"Me eché 4 ramos en la USM y quedé eliminado. ¿Qué hago? Estoy estudiando un Técnico Universitario en Electrónica en la USM, y siendo mi segundo año, me eché 4 ramos este semestre.

Uno de ellos siendo Mate 2, que ya habia reprobado por primera vez el segundo semestre del 2023.

Este semestre fue horrible para mi en general, con la mayoria de marzo habiendo tenido problemas de ratones en el departamento que estoy arrendando y el resto de meses teniendo problemas personales (amigos, novia, familia, etc.).

Mi desempeño en el año académico fue, cuanto menos, callampa. No sentia la motivacion ni las ganas de levantarme siquiera a bañarme o alimentarme, mucho menos asistir a clases.

Esto causó que tuviera una asistencia a clases deplorable y muy poco entendimiento de la materia, lo cual derivó a que tuviera un rendimiento horrible en las pruebas, echandome asi los 4 ramos que ya dije.

He visto a varios compañeros que llevan más de 3 años en la carrera (carrera que solo dura 4 semestres curricularmente), pero creo que nunca habian estado en una situación como la mia, lo cual me hace dudar aún más de lo que me puede esperar.

El primer semestre fui un alumno a destacar segun los profesores, teniendo notas bastante buenas. El segundo semestre estas notas cayeron un poco, pero todas (menos Mate 2) eran suficientes para aprobar y un poco más.

He contado con la ayuda de varios profesores, pero el miedo a verme como un aprovechado de su bondad me impidió poder acercarme a hablar con ellos los ultimos dias de clases, ahora teniendo que solo contar con la ayuda de formularios oficiales y solicitudes formales.

¿Alguien tiene alguna idea de como poder salir de este aprieto?


EDIT:

Después de todos los comentarios y mensajes que he recibido en este post, he decidido que el mejor camino a tomar es Enviar solicitud de excepción al reglamento y tomar los ramos que pueda el próximo semestre, con la debida ayuda psicologica y no sobrecargandome o exigiendome.

El tomar los ramos que puedo este semestre aliviaría la carga para el próximo año, lo cual permitiría mayor tiempo para estudiar en materias más enfocado, y solicitar reducciones de arancel por baja carga académica.

Agradezco cada uno de sus comentarios, los de amor duro y los de consejos por igual, Muchas gracias y les deseo un muy buen año.",negative
"Experiencias y opiniones de la USM? Contexto: estoy en 4to medio

Quiero estudiar ingenieria civil (electrica o mecanica preferiblemente) y varios me han dicho que si quiero ingenieria busque en la Federico

Hace rato la tengo como una opcion, el tema es que todos dicen el tipico ""no es que es muy cabezona"" ""no vai a tener vida"" ""puro estudiar"", pero todos siempre hablan de afuera sin saber mucho 

Asi que pregunto aca, los que estudian, estudiaron o tienen algun conocido que estudia, y los que no tambien. Que saben sobre estudiar en la USM?",neutral
USM lanza rediseño de ingenierías civiles en diez semestres ,neutral
Finalmente: Criptoquesitos afuera de la USM Sede Viña del Mar ,neutral
Que opinan de la nueva carrera de ciencia de datos enla usm ? Aún no se que estudiar estoy entre esa o informática en el duoc . Está muy difícil que entre al técnico en la usm también por la lista de espera ,neutral
"Ingeniería civil informática USM vs PUCV Hola cabros/as, quiero estudiar ingeniería civil informática el próximo año entre la utfsm y la pucv. Soy de viña y no estoy seguro en cual sea la más adecuada :( 

Según experiencias que me han contado sobre la usm, las mallas son súper rígidas y es un ambiente individualista y competitivo ¿Qué tan cierto es eso? También me han dicho que la matemática y las ciencias son mucho más densas que en la pucv.",negative
"Ingeniería comercial USM/PUCV o Ingeniería en información y control de gestión UV. Bueno me estoy decidiendo por carrera y soy de la región de Valparaíso, quisiera saber qué pasa con la empleabilidad, cual es mejor, porque en foros que tu carrera.cl o mifuturo no sé no sé me hacen confiables, he leído que hay supuestos datos del SII pero no entiendo ni dónde se ven.",negative
USM presenta: Ingeniería en ingeniería ,neutral
"Recomiendan la carrera ing. Civil metalúrgica en la usm Estoy recién saliendo de 4•medio y tengo muchas dudas respecto a que carrera escoger, por una parte me gustaría estudiar metalurgia pero también he considerado ing. Civil Industrial.
Sinceramente creo que sería más interesante metalúrgica pero industrial tiene un campo laboral más amplio.
Personas que hayan estudiado en la usm o que estén estudiando estas carreras, las recomiendan, son muy difíciles, es muy difícil el primer año?",neutral
Porcentaje de hombres y mujeres por carrera en la USM - Casa Central [OC] ,neutral
"NECESITO PEGA Necesito un trabajo, llevo 2 años titulado de ingeniero civil químico en la usm y solo he tenido 7 entrevistas en este lapsus de tiempo y rechazos para todos los programas trainees. Ya no se que hacer, he modificado el cv un montón de veces y ninguna novedad. He pensado en hacer un diplomado mientras sigo en mi trabajo informal que solo paga con propina. 

Cualquier ayuda se agradece para este pobre cesante",negative
"Cambio de universidad (USM a otra) &amp;#x200B;

Buenas chic@s, les cuento: Soy mechón en Ingeniería civil informática en la USM, y claro, nunca esperé que la universidad fuera fácil, es obvio que tendría que cambiar mis hábitos de estudio y adaptarme a algo mucho mas difícil.

El problema comienza aquí, tengo amigos en diversas universidades y no veo absolutamente a ninguno con tanta carga académica, los veo jugando hasta altas horas de la noche, findes y demás, y no es que no sienta que no me la pueda, pero ¿realmente lo vale?

Ojala poder contactar a gente que se haya cambiado desde esta Universidad a otra, y que me cuenten un poquito su experiencia, estaría muuuuuuy agradecido 📷

Info: Soy de la región metropolitana, y en especial me interesa algo mas la UC y la UAI, pero como estoy estudiando con gratuidad creo que me queda 1 sola opción jaja.

Atte: Un mechón que no sabe que hacer",neutral
"Ingeniería civil electrónica en la usm o en la pucv? Hola cabros, apenas soy nuevo en Reddit y más que nada quería ver si me podían ayudar un poco.

Ahora mismo estoy en 4to medio y por ahora tengo planeado estudiar ingeniería civil electrónica. El problema es que no se en cual universidad estudiar, si en la usm, o en la pucv.

(Elegí estas dos ya que en ambas esta la carrera y también porque, según lo que tengo entendido, son consideradas como las mejores universidades para estudiar ingeniería en Chile)

He escuchado que en la usm el ambiente y los alumnos son muy competitivos entre si y que la u te hace cagar la salud mental pero que obtienes mejores oportunidades laborales al egresar, mientras que el pucv es más tranquilo y relajado. Pero la verdad no estoy seguro de que tan cierto será esto.

¿Qué me recomiendan?

Volví a escribir este post porque me di cuenta que en el anterior puse ing. civil informática y en realidad era ing. civil electrónica XD",neutral
"Diferencia de ing en construcciones civiles vs ingeniero civil (also como sobrevivir en la usm) Lo del titulo, no tengo muy clara la diferencia entre ambas y me serviria iluminacion ando en mi primer año aca.",neutral
"Cuál es mejor Beauchef o la Usm?? wena cabros quiero entrar a la u y necesito ayuda, a rasgos  generales, ¿Cuál es mejor?",neutral
"¿Cual a sido el suceso más grave que a pasado en tu escuela/universidad/lugar de estudio? En un colegio donde estudiaba mi hermano unos como 5 weones de 1 de media encerraron a una compañera y cometieron crímenes de carácter sexual contra ella 


Quedó la re caga en ese colegio",negative
"¿Ingenieria civil industrial en la USM, PUCV o UAI? Buenas nochess, soy nuevo en esto de reddit siendo este mi primer post, asi que antes que nada me disculpo si etiqueto o me doy a expresar mal jajaja.

Mi pregunta no va mas allá que la del título, y ojala me puedan responder sobretodo quienes tengan experiencia en cualquiera de estas universidades, ya sea en la carrera precisamente o en alguna ingeniería afin. Soy viñamarino, por lo que estudiaría en las sedes de aca nomas, aunque en todo caso cualquier opinión es bienvenida :D",neutral
Ing civil electrica en usm vs u de chile/uc? Creo que quiero estudiar ing civil eléctrica pero no estoy muy seguro donde... Alguien tiene alguna noción de donde es mejor esta carrera? Y si es verdad que es más difícil que la chucha y dura en promedio 10 años?,negative
"Qué cosas que hicieron ""por si acaso"" los terminó salvando? Una vez estaba de viaje con mi familia y entramos a un estacionamiento privado para poder salir a pasear un rato. El espacio que queríamos usar (era el único con sombra en un día pa la cagá de caluroso) tenía una plataforma colgando arriba donde había gente trabajando. Entre todos decidimos casi al segundo que mejor íbamos a otro espacio porque no se veía muy seguro.

Volvimos al estacionamiento unos 45 minutos después y nos tomamos nuestro tiempo en el auto para decidir dónde ir después, total no había diferencia de precio entre los 45 min y una hora. La cosa es que de repente escuchamos un ruido muy cerca de nosotros, un trabajador habia caído de la plataforma y terminó en el auto que se estacionó en el espacio que nosotros no quisimos usar. El trabajador resultó con heridas no graves pero el parabrisas quedó completamente destruido y seguramente los que estábamos en los asientos delanteros habríamos sacado la peor parte.",neutral
"ingeniería informática en la USM hola soy de conce y estoy pensando en estudiar ingeniería informática en la santa maria de concepción hay alguien que haya salido de ahí? si es asi me podria decir que tal es y si es verdad que la única intención que tienen los profesores es que te eches el ramo

p.d: al parecer la carrera es nueva en conce, pero la malla es igual a las otras :) gracias",neutral
"Ayuda Cambio USM a PUC Hola a todos, me he estado planteando cambiarme desde la USM a la PUC, la PUC era mi primera opcion y la USM mi tercera opcion al momento de dar la la psu el año pasado pero por razones personales no rendi lo suficiente y me faltaron puntos por lo que quiero volver a dar la PSU  este año o Prueba de transicion, sin embargo quiero convalidar este año donde estare en la USM donde  estudio Ingeneria Civil Quimica, entiendo que en la PUC se comienza con un plan comun y luego se especializa. En mi caso,¿como se irian a convalidar los ramos en el sistema de la PUC, cuantos podre convalidar y como me afectaria en la cantidad de semestres en la PUC?",neutral
"Ingeniería Civil electrónica USM VS Ingeniería Major Robótica Minor Inteligencia computacional UC vs otros ¿Cuál recomiendan? Estoy viendo carreras, me interesan carreras en areas de tecnología y esas dos me llaman la atención, aunque no rechazo carreras afines. 

Alguien que se dedique a esas áreas o estudió en esas casas de estudio me podría hablar desde su experiencia, de como fue internamente su experiencia, a qué se dedican actualmente, qué herramientas les dio la U, los profesores y compañeros como son, como es la percepción lo que hacen frente a otros profesionales y mitos del perfil que no debo tomar en cuenta. También me sirve la experiencia de aquellos que se fueron a estudiar fuera de su region, para así tomar una decisión más completa. 

Datos a considerar:  
1. Soy de quinta región y la USM me queda a una micro de llegar al frontis, aunque no significa que no pueda ir a Santiago de ser necesario (Asumir que el área monetaria no es limitante, mas bien emocional de no tener la familia cerca).  
2. Si bien sus mallas se parecen harto, me gusta más que sea más abierta a cambios la UC (Dígase que al final tengo una percepción errónea y realmente me quiero ir por otra rama), dígase de paso que las menciones de Electrónica en la USM no me atraen tanto ¿Es posible algo así como solo hacer licenciatura de una carrera y hacer magister en otra (Me gusta mucho el area de IA y la UC, o la UAI si es que me quedo en la quinta región, tiene ese magister pero la USM no)?  
3. La USM se ubica en electronica entre las mejores (A nivel Latinoamérica), al menos eso me han contado ¿Cómo es posible verificarlo? ¿Implica los conocimiento que son capaces de generar dentro de la universidad o más bien la calidad de egresados?   
4. No soy fanático de irme a paro (Conocidos sansanos me dicen que debo estar mentalizado para estar en paros largos)  
5. Es más probable me den beneficios la USM que la UC por notas y también que me va bien en los ensayos de mate como para un año no tener que pagar  
6. He conocido ambos campus, no son determinantes, aunque me gusta el concepto de UC San Joaquin como una ciudadela.",neutral
"Es complicado ser mujer en ingeniería? Básicamente toda mi vida se me han dado bien las matemáticas y la física, no me veo estudiando otra carrera que no sea ingeniería, el tema es que mi tío (ingeniero en minas de la USM), me dijo que si quería estudiar esa carrera (que era mi opción 1), la iba a tener muy complicada, es una carrera llena de hombres y muy machista. es verdad? es incómodo?

mi mamá igual me ha dicho eso, y la verdad si tengo un poco de miedo de ser la única mujer en mi generacion 😔

mis otras opciones eran ingeniería eléctrica en la puc e ingeniería metalúrgica en la usm

consejos?",negative
"[Serio] ¿Han tocado fondo en sus vidas como para darse cuenta de algo y hacer un cambio en sus vidas? Ya sea tocar fondo de forma moral, económica, ética, etc. 

En mi caso, siendo joven con buen sueldo y sin gastos, caí en hacer cagar la tarjeta de crédito sacando todo a 3 cuotas, comprando ropa, perfumes, zapatillas, compras x por amazon y aliexpress que esas caen de golpe. y así, hasta que ya no he podido pagar las cuotas como corresponden, y estoy esperando un bono que me llegará , que será el suficiente para poder liquidar todo. ese bono va a desaparecer, pero ya estaré en 0 y en paz nuevamente.

mi tocada de fondo fue que para éste verano mis viejos me invitaron a ir al sur a vacacionar 1 semana, y ya fui con saldo negativo de la tarjeta, estuve con el culo a 2 manos toda la semana gastando lo menos posible.   
y ya la semana siguiente ellos se fueron de viaje fuera del país, y quedé solo en casa, y quería ir a comprar una coca cola al almacén, pagando con débito, y salia error de transacción por saldo insuficiente. 

Ahora esperando ése bono, ya no he usado la TC, y para moverme en uber y una que otra compra por ubereats, traspaso saldo a mercadopago y queda como ""presupuestado"" para no alocarme en viajes y compras. 

Tambien ya no me he comprado ropa ni perfumes ni zapatillas, principalmente porque ya no me queda espacio ni necesito más. (igual mi pieza es pequeña) 

Sé que voy a salir de ésto, es cosa de no gastar nomás, por suerte no tengo hijos ni responsabilidades mayores. 

Pero quería escuchar sus anécdotas si les ha pasado algo similar,o a alguien que conozcan, o no sólo en lo económico, por si están batallando contra alguna adicción o mal hábito. ",negative
"Alguien ha tenido la experiencia de estudiar Ingeniería de Ejecución en Software en la USM Wena cabros, me gustaria saber si alguno de ustedes a tenido la oportunidad de pasar por la carrera anteriormente mencionada, la verdad es que estoy un poco perdido y necesito de un poco de claridad y vista objetiva sobre el tema. 

Actualmete estoy estudiando Ingenieria en Informatica en el Duoc, pase a mi 4to semestre, pasa que al 5to semestre tengo la posibilidad de salir de la carrera con el titulo técnico de analista programador pero no estoy seguro si continuar la ingenieria en el Duoc o pasarme a la carrera mencionada en el titulo.

Actualmente ya me encuentro trabajando en el área (me contrataron estando en 3er semestre xD), me gusta bastante la programación y me considero suficientemente estudioso como para pasarme a una U mas tradicional (he escuchado que la USM no es fácil) , pero también no se que tanto me compensará estudiar esta carrera versus terminar Ingeniería Informática en Duoc, ademas de que esta el factor tiempo ya que me tomaría unos 3 semestres mas salir de la USM, aunque el tiempo no es un tema muy relevante ni ando apurado pero tampoco quiero salir chato, mucho menos si al final no me termina compensando tanto, en fin gracias por su atención y escucho atentamente. 

&amp;#x200B;

PD: quería publicar esto en CHW pero al parecer esta caído así que perdón si es que es algo fome mi pregunta.",neutral
"FNE publica Informe Preliminar de Estudio de Mercado sobre la Educación Superior. 35% de las carreras tienen retorno económico negativo y que el porcentaje de personas que ingresa a este segmento de carreras ha tendido a aumentar, alcanzando cerca de 40% en 2023 ",neutral
"quiero estudiar tecnico electrico en la usm, y tengo muchas dudas, ayudenme please voy a encaminarme a estudiar, y estoy pensado seriamente en estudiar un tecnico universitario en electricidad en la USM, soy de valparaíso. 

tengo muchas dudas sobre la carrera, pero principalmente por cuestiones laborales, quiero saber las siguientes cosas:

1) ¿como es el campo laboral de la carrera?
2) ¿como están los sueldos ahora mismo?¿cual es su proyección a futuro? ojala esto respecto de mi región que es la V, porque no me gustaría mudarme.
3) ¿en que sub actividad se concentra mayoritariamente el ejercicio de la profesión?
4) ¿hay oportunidades de emprendimiento con la carrera?
5) ¿ como son los tecnicos en la USM?

ojalá alguien de aquí me pueda responder al menos una de esas preguntas, en su caso creanme que les estaré eternamente agradecidos, quizá hasta les mande palta para sus respectivas casas &lt;3 ",neutral
what Mercator projection does to a mf ,negative
"CIVIL INDUSTRIAL U. de Chile o USM Hola tenía dudas entre estas dos universidades y quería saber si me podían dar sus opiniones. 
PD: Hasta el momento me estoy inclinando por la chile. ",neutral
"Eliminaron a mi hermana de la u, que podemos hacer? Mi hermana esta estudiando la carrera de sus sueños,  pero la u ha sido muy bastarda (usm). 

El primer semestre se echo varios ramos. El segundo semestre tuvo problemas de salud y, a pesar de que no le dieron pruebas recuperativas para nada (incluso con justificativo médico), aprobó todos menos uno.

En la madrugada de hoy (31 de diciembre), le llega un correo que fue eliminada de la carrera sin explicar motivos. Había tenido que mandar un carta, por motivo del ramo que se echo nuevamente, como hace 1 mes, pero nunca tuvo respuesta. 

Lamentablemente la facultad en la que está no tiene un reglamento en línea, pero no cumple condiciones para ser eliminada según las otras facultades.

Fuera de lo penca que es mandar un correo así en víspera de año nuevo, quería saber si alguno de ustedes pasó por algo así? Como fue? Que hicieron? Que pasa con la gratuidad? En una de esas es un proceso automatico y en todo caso vamos a hablar el martes con la u. Mi hermana ya había informado su intención de cambiarse de u por la pésima gestión durante su enfermedad, así que era algo que ya estábamos mirando, aunque hubiera sido luego de dar la paes de invierno(o como se llame ahora).

Edit: Estuvo con ayuda del asistente y de mentor y mejoro bastante. Hasta la semana pasada la plataforma (siga) no señalaba nada de eliminación o algo similar. No recuerdo el nombre de la carta que mandó, pero era para volver a dar ese ramo denuevo. Voy a suponer que como todo en esa facultad no revisaron la carta a tiempo, ya que nos pasó un rollo así con los justificativos y la asistencia ",negative
"Alguien me explica las distintas miradas de Civil Industrial, se que la USM tiene una distinta a la U de Chile o a la UAI, que está más enfocada en procesos, pero nose a que se refiere y también desconozco las miradas de las universidades que mencione. #Help ",negative
"Puntajes nacionales de Reddit, ¿Cómo les va en sus vidas? Para los que fueron ahora o hace tiempo puntaje nacional, ¿Qué tal les ha ido? ¿Influyó en su futuro? ¿Cómo se ven de aquí a 10 años? , los que fueron invitados a desayunar con el presidente, ¿Alguna anécdota? Los leo. 

Yo ahora saqué nacional en M1, estoy feliz pero tengo que ver como me pago mi U jsdfjfsd pero hay esperanza, nada es imposible weon niuna wea",neutral
Está barato ,neutral
"Datos sobre infraestructura universitaria: ¿Las universidades masivas privadas están sobrevendiendo cupos? UNAB, USS y UDLA vs su infraestructura real https://preview.redd.it/kugxjk4fbiig1.png?width=1080&amp;format=png&amp;auto=webp&amp;s=204d170e016464f338d1abc7fc7044122e3946f1

Estaba revisando esta tabla publicada hoy con datos oficiales de infraestructura de universidades chilenas (matrícula, m² construidos, bibliotecas, laboratorios, etc.) y me llamó demasiado la atención la desproporción de algunas instituciones.

Si uno mira universidades tradicionales (publicas o privadas) los números tienen cierta coherencia:

\- U. de Chile: 37.610 estudiantes /17 m² por estudiante

\- PUC: 33.765 estudiantes / 11 m² por estudiante

\- USM: 21.303 estudiantes / 10 m² por estudiante

\- U. de Concepción: 25.370 estudiantes / 10 m² por estudiante

\- U. de Santiago de Chile (USACH): 22.724 estudiantes / 10 m² por estudiante

\- Universidad Tecnológica Metropolitana (UTEM): 8.161 estudiantes / 9 m² por estudiante

Es decir, universidades grandes o medianas, pero con una infraestructura relativamente proporcional a su matrícula.

Ahora veamos el caso de las privadas masivas:

\- Universidad Andrés Bello (UNAB):

59.286 matriculados (la más grande del país)

Solo 7 m² construidos por estudiante

7 volúmenes de biblioteca por estudiante

998 laboratorios para casi 60 mil alumnos

\- Universidad San Sebastián (USS):

47.555 estudiantes

Apenas 6 m² por estudiante

Solo 3 volúmenes de biblioteca por alumno

\- Universidad de Las Américas (UDLA):

33.106 estudiantes

5 m² por estudiante (de los peores del sistema)

9 volúmenes de biblioteca por alumno

Para ponerlo en perspectiva:

La U. de Chile tiene más del triple de m² por alumno que la UDLA.

La USACH y la UTEM, siendo universidades públicas con presupuestos mucho más acotados, tienen mejor relación infraestructura/alumno que la UNAB, USS y UDLA.

Universidades regionales como la U. Austral, U. de Talca, U. de La Frontera, etc., muestran indicadores bastante más razonables que estas megauniversidades privadas no tradicionales.

Entonces la pregunta es inevitable:

¿Tiene sentido que instituciones con 40, 50 o casi 60 mil estudiantes tengan niveles de infraestructura tan bajos por persona?

Da la impresión de que el modelo de estas universidades es básicamente:

\- maximizar matrícula a toda costa

\- abrir cupos sin relación con la capacidad instalada real

\- operar al límite de salas, bibliotecas y laboratorios

\- priorizar cantidad por sobre calidad

Lo que termina generando:

\- clases sobrepobladas

\- pocos recursos por alumno

\- servicios saturados

\- experiencia universitaria mucho más precaria

**- saturación de carreras por exceso de oferta**

Y de ahí surge la crítica que muchos hacen, que más que universidades como tal, funcionan como fábricas de títulos, donde lo central es vender matrículas y no asegurar una formación equivalente a la de instituciones con estándares más altos

Obviamente esto no significa que todos sus egresados sean malos profesionales, pero sí que el modelo educativo parece diseñado para masividad extrema más que para calidad académica.

¿Cómo lo ven ustedes?",negative
