full_content,sentiment_label
"Entrar a la UNAB para cambio a USM? Hola, les quería hacer una consulta, este año postulé a la USM (1ra opción) y a la USACH porque quería entrar a Telemática, pero me fue peor de lo que esperaba en la M2 y quedé en lista de espera en las dos universidades :( pero me di cuenta que puedo entrar por repostulación a otras universidades, y vi que la UNAB tiene cupos para Ing. Civil Informática, la verdad es que la UNAB no me gusta como universidad, y estaría entrando durante primer año solamente para hacerme el cambio interno hacia la USM.   
  
Mi otra opción es dar la PAES en invierno y verano, y con esos puntajes + los que di en diciembre estaría entrando, pero llevo varios años atrasado entonces si esto me permitiera adelantar ramos y ya entrar a la u creo que sería mejor.   
  
Viendo los requisitos de la USM para hacer cambio interno (no reprobar más del 20% de los ramos y sacar promedio sobre 5) creo que es super alcanzable, pero me imagino que es posible que aunque cumpla todos los requisitos no me acepten por esa vía. Alguien que se haya cambiado de la UNAB a la USM, o que tenga algún conocimiento que me pueda servir lo agradecería mucho :) Gracias!",negative
"PUCV o USM para ingeniería Contexto: no se si elegir a la PUCV o USM para estudiar ingeniería civil química, en las dos e buscado y mi puntaje ponderado con los ensayos superan el puntaje corte de ambas, y con mis sensaciones de la paes siento que me da , tengo entendido que las dos son muy buenas universidades y que las dos son top 10 de chile y que la USM es mejor universidad si se quiere estudiar ingeniería   pero tengo entendido que a los de USM se le exige demasiado en tema de notas y capacidades matemáticas a lo cual aunque me considero algo listo nunca e sido el mejor ni tampoco el más disciplinado (promedio 6,5 solamente estudiando las noches anterior) y por eso tengo de prioridad la PUCV que es también muy buen universidad.  Me gustaría escuchar sus opiniones y recomendacione. Gracias por leer",neutral
"Astrofísica en USM o USACH? Holapp! He estado viendo un montón de personas que comentan la comparativa entre ambas universidades hablando sobre cómo la USM te forma mejor pero es más exigente mientras que la USACH es más tranquila pero tiene problemas relacionados con los paros.   
  
Ignorando el tema empleabilidad, me gustaría saber si quienes hayan cursado en alguna de las dos pueda darme más motivos a favor de una o de otra.",neutral
Ing. Civil Mecánica en la UBB o USM? Actualmente estoi estudiando Técnico en mantenimiento industrial en el Duoc pero siempre quise estudiar civil Mecánica y tengo la duda en que U puede ser mejor para estudiar la carrera?,neutral
"Ing. Civil Mecánica en la UBB o USM? 
Actualmente estoi estudiando Técnico en mantenimiento industrial en el Duoc pero siempre quise estudiar civil Mecánica y tengo la duda en que U puede ser mejor para estudiar la carrera?",neutral
"Ingeniería civil informática y telecomunicaciones en la udp o ingeniería civil telematica en la usm? No sé cuál de las 2 estudiar, nose con cual voy a tener mejor empleo? con cual ganaría más dinero? Cuáles son sus diferencias ? etc.",neutral
"Usach, Uch o Usm Hola a todosss, quería que me ayudarán a qué universidad elegir según mi carrera (ingeniería civil electrica) tengo esa tres opciones donde el único problema es que en una paes cago (806 ponderado) y por ende no puedo entrar directo a la uch y tendría que hacerlo en vía bachillerato y eso sería un año más, quiero que me ayuden con la empleabilidad y en cual se aprende ""mejor o de mejor calidad""

Serían los años de estudio:
Uch: 6,5 años tomando el primer año de bachi
Usach: 5,5 años formal
Usm: 6 años formal",neutral
"ingeniería civil telemática en la USM hola , quisiera que me den su real opinión sobre esta carrera y en la sede de Santiago, es muy difícil?, de tantos comentarios satanizando a la USM me estoy arrepintiendo de haber buscando mil maneras de querer entrar e incluso por admisión especial y primera preferencia 
lo de la vida social no me afecta tanto , igual no la tengo pero la calidad de enseñanza es buena? 
los materiales que brinda la u? . algo, cualquier información sobre esto me sirve, en verdad me interesa mucho su opinión, gracias. ",neutral
"Usm y Udp, una gran diferencia? Hola gente, ya estamos a poco más de un mes para la paes de invierno, y bueno , he estado viendo ing Civil industrial como carrera para estudiar y sinceramente creo que eso es lo que más me llama la atención hasta ahora (llevo desde marzo) así que probablemente esa sea mi elección.

Sin embargo la universidad es algo que sigo evaluando, la Uch y la Puc no son opción.

Estuve en el debate de Udp Usm y Usach, pero sinceramente me gusta más la Udp que la Usach, por lo que quedaría el orden así ;

Usm / Udp
Usach

Bien es verdad que la Usm ES EXCELENTE en ingeniería y la Udp bueno...no es de los fuertes de la universidad, sin embargo para tomar una decisión estuve viendo que este año sale la acreditación de ingeniería, no se si tenga alguna importancia real, pero estaba viendo si esperar a ese resultado para seguir tomando la decisión.

He escuchado que la Usm es brígida y la salud mental y que los compañeros no eran lo mejor, y de la Udp lo contrario, solamente que ingeniería no es uno de los fuertes de la U.

Por gusto personal me iría por la Udp , pero se que es mejor por mucho la Usm , entonces no se que podría elegir realmente. (La Usach no está al 100% descartada si)

Quiero saber sus opiniones.",neutral
"Más difícil la Usm o la Uch en Ing Hola mi gente, el otro día estaba hablando con un amigo que entró este año a Ing en la Chile, he visto y me ha contado que ha estado bien sumergido en los estudios y que no tiene tiempo para nada, bien dice que igual es porque debe aprender a organizarse con temas de estudio y todo , pero x. 

Cómo dice el título, estuve hablando con ese amigo mío y le dije que la chile debe ser la universidad más difícil en ingeniería al menos (por lo que debía ponerle weno) y me dijo que el creía que la Federico era peor ,  le dije que no tenía idea la verdad, que supuestamente está un poco exagerada la dificultad de la Usm y así .

Por lo que quiero saber sus opiniones de sí la chile es más difícil que la Federico o al revés, obviamente en ing.",negative
"Ingeniería Matemática en USACH o USM? Hola! Quiero estudiar Ingeniería Matemática (o Civil Matemática) pero aún no decido la universidad. Igual cacho sobre las cosas que se ven en esa carrera, me gustan las mates muy avanzadas y complejas, entender en profundidad los temas y entender también las cosas teóricas y lo asociado a las mates puras( sé que eso es muy duro) pero siempre con la finalidad de quedar muy capacitado para mas adelante resolver cosas que sean aplicadas, me gustaría trabajar en algo donde pueda resolver problemas complejos asociados a la vida real, ojalá usando harta modelación matemática, eso siempre me ha interesado, también me gusta lo que tiene que ver con optimización, con modelos estocásticos y cosas de ese tipo, pero aún no tengo clara mi área de preferencia.

Entre la Usach y la Usm, cuál me recomiendan para ésta carrera? Considerando el cómo sería toda la experiencia universitaria, y por sobre todo la calidad de las clases y de los profes. Agradecería mucho cualquier consejo, información, experiencia. Muchas gracias!!",neutral
"Es posible entrar a la casa central USM luego de un retiro definitivo? Estuve buscando información y dicen que sí, pero me gustaría saber las opciones que hay o si realmente es posible. Si alguien curso 2 años de ingeniería, congela y se retira definitivamente... hay forma de poder ingresar a la universidad nuevamente? Cabe recalcar que no hubo ramo que se echo al estudiar. Me gustaría saber las opciones posibles y como postular a ellas, la verdad necesito estas respuestas. Gracias por leer.",neutral
"USM Que tal es la Santa María en comparación a otras universidades, como la Pucv, en ingeniería civil química? (Campo laboral, laboratorios, malla, etc)(opiniones) gracias ",neutral
"La USM es una buena opcion? Miren les cuento, soy egresado de 4to medio y me tome un año sabático por que no sabia ni estaba seguro de que quería estudiar.
Lo he pensado harto y mi primera opciones  la Usm para estudiar Ing. Civil Eléctrica o en Minas, por su alta tasa de empleabilidad, buenos sueldos y todo eso, pero he leído y escuchado muchas cosas que dicen que el ambiente en la universidad es cm la mierda, que hay puros wnes TEA, sin habilidades sociales y gente como la callampa, ademas de q no hay minas dicen 🥲
En la parte académica, dicen que es demasiado difícil la matemática y física que me van a hacer cagar y que los profes son unos ctm, que no tendre tiempo para nada y nse q wea ma.
¿Son verdad estas cosas que se dicen? Y si soy una persona promedio con bases normales en matematica (se que la paes no define eso pero saque 910 puntos en la m1 el año pasado y en los ensayos de m2 promedio entre 700-800 ahora) ¿se me haría muy dificil la carrera?
¿Me van a dar ganas de suicidarme?
Tengo demasiadas preguntas y cada que leo tengo una peor vision de esa Universidad 
Gracias a los que respondan que tengan buena semana los kabro ;) ",negative
"Eliminado de la usm. Hola, hoy me llegó el correo de solicitud para poder mantenerme en la usm hasta enero y y así poder mantener la postulación a la pucv pero me lo rechazaron así que no se que hacer .A los que han estado en esta situación, es posible hacer el cambio de carrera o de sede al estar en esta situación dentro de la usm?",negative
"se buscan Mechones USM!!! holaa quede en ingeniería civil química en la federico santa maría, primero me gustaría buscar compañeros y saber si ya se hizo un grupo de WhatsApp o algo y segundo, tips para la carrera plis de lo que sea onda como son los profes, que calculadora comprar lo que sea estoy ultra ansiosa 😭😭😭☠️",neutral
"Nervioso por el CAE USM Estoy muy angustiado por el tema del cae ya que es un tema que no entiendo mucho porque en las mismas páginas de ingresa o a mi universidad SIREB no se aclara mucho que tengo que hacer como para obtener o activar el cae y así mismo no entiendo cómo funciona, el cómo llevarlo a cabo, como que no lo puedo entender y necesito como una ayuda un guía para explicarme cómo solicitar monto y saber que tengo cae. Se que se opta hasta el 12 de marzo y me tiene nervioso porque no tengo idea de cómo se hace ni nada. ",negative
"Ingeniería civil industrial UAI o USM Hola me sería de mucha ayuda sus recomendaciones ya que no sé qué hacer con las postulaciones, si es verdad que la usm es mejor sabida mente en ingeniería pero si te vas a mi futuro cl los sueldos y empleabilidad son más o menos los mismos en el futuro. Sumándole a eso que la carga académica teóricamente es mucho más chill en la Adolfo. Qué harían ustedes? Me da por mucho sobre el puntaje de corte en ambas U y cualquier sede ",neutral
"Cambio de carrera usm Hola, quería saber qué tan complejo era cambiarse de carrera en la Santa María. Me gustaría estar a civil metalurgia pero quizás el puntaje no me dé, por ende me quedaría entrar a civil telemática y de ahí pasando el primer año quizás cambiarme a metalurgia. Obvio tengo claro que no me podría echar ramos y tengo q tener buenas notas. Pero fuera de eso, es tan complicado como dicen??",neutral
"Ing civil en minas usm o la uc? Hola! Honestamente, no sé si matricularme a civil en minas en la usm o me doy el año para postular a plan común en la uc? Quedé en la usm como novena seleccionada pero no sé si sea lo mejor :( Además ponderé 914 para derecho en la uc y siento que igual pude haber entrado, estoy mega bajoneada y no sé si tomarme el año ",negative
"Respuestas admisión especial usm (federico santa maria) Hace unos meses postule por admisión especial a una ingeniera civil en la usm, y siempre decian que la respuesta de si habias quedado o no llegaba durante diciembre, pero las postulaciones siguen abiertas y he leido que siempre se demoran en dar respuesta. Si alguien tiene algo de información sobre eso, gracias. ",neutral
"Ingeniería Civil en Biotecnología USM o Ingeniería Civil Biomédica UV? Hola, tengo dudas en qué carrera poder postular, sé que me alcanza pero dudo entre cual
cual
Seré sincero, yo moría y mataba por medicina y no me dio, pero me sigue gustando el campo y siempre me vi alejado de tomarme un año o dar la de invierno, mi ideal es entrar este año. Me gusta la salud y cosas más prácticas.
Consejos porfa",neutral
Comercial UCH o Civil industrial en la USM? Toi indeciso kauros,neutral
"Ingeniería Comercial en la UCH o la USM? Hola, este año me salí de comercial en la UC debido a que no me sentía bien ahí, nunca encajé socialmente y nunca hice un grupo de amigos o algo por el estilo lo que hizo que odiara la universidad y no tuviera ningún tipo de motivación por la universidad. Daré la PAES para entrar el 2026 pero no sé si elegir la UCH o la USM, no quiero algo muy enfocado en economía pero si una malla que me entregue herramientas que pueda usar para el mercado laboral futuro, me da miedo la dificultad de la USM (he hablado con personas que dicen que las mates son rajonas pero ramos de carrera son llevaderos) también me da miedo la dificultad de la UCH (segun yo es más dificil en todas las areas) y también me da miedo no encajar de nuevo. Cuál debería elegir? (Soy mujer)",negative
10 pts sobre corte civil plan común usm Creen que suba? Campus casa central ,neutral
"Ingeniería comercial usm bien, al final quedé en icom en la usm casa central, me gustaría saber opiniones de los que estudian esta carrera en esa u. Me gustaría estar preparado, saber con lo que me encontraré y cosas así. sugerencias, consejos, consideraciones que debo tener, etc. No necesariamente puede ser de la carrera, de la u igual.",neutral
"La USM o la UC para Lic en física? Estoy en 4to medio y haciendo los cálculos podría entrar a cualquiera de las 2 para estudiar licenciatura en física. Mi objetivo es después de hacer la licenciatura seguir con un post grado. Igual siento que ambas mallas curriculares tienen varias diferencias pero no sé cuál me ayuda más con mi objetivo de hacer un Magíster después, si es posible en otro país. Entonces me gustaría ver en cual me conviene más, tanto por notas como por oportunidades que me entrega la misma U. ",neutral
"mantenimiento aeronáutico usm? Hace hartos meses que estoy con la duda de donde poder estudiar ya q me interesa mucho la aeronáutica, la u de conce imparte la ingeniería aeroespacial pero me queda muy lejos y no puedo estudiar en otra ciudad, pensaba en la fach tmb pero apesar de q me gustan harto las “especialidades” que dan ahí realmente no me gusta todo eso de lo militar etc etc, la dgac también la pensé pero vuelvo a lo mismo de no poder estudiar en otra ciudad :( me quedan pocas opciones y la q mas me interesa es el técnico en la usm pero no se q tal será, me hubiese gustado sacar la ingeniería como tal y no un técnico pero es lo q hay, alguien que haya estudiado ahí me podría decir q tal es? o si realmente me tendría que rendir nomas jsajaj",negative
"Ingeniería en C. San Joaquín vs Casa Central USM hay alguna diferencia académica entre el campus de San Joaquín y el campus de Valpo en cuanto a ingeniería?

si se pudiera ser específico mejor aún, siento que quizá la cague por haber entrado al C San Joaquín y me pude haber ido a la USACH xd

gracias",neutral
"ingenieria civil telematica o informatica usm Hola, gente hermosa de Reddit:

Como todos saben, hoy mostraron los resultados de las postulaciones de las universidades, y para mi caso no me fue tan bien en el resultado, pero por si acaso mandé la postulación con 5 carreras, 3 de ellas carreras en el área de informática (ingeniería civil en informática), un plan común en la Chile y, por último, la ingeniería civil telemática en la USM. Esta última es la que tiene más posibilidades porque quedé en el 4.° lugar de la lista de espera para la admisión BEA y en las otras cuatro, quedé en lista de espera y ahora mismo estoy en una duda existencial. Lo que pasa es que originalmente tenía planeado hace mucho rato entrar a Ingeniería Civil en Informática, especialmente en la USM, porque me fascina programar y me gustaría descubrir cómo funciona el mundo de la informática, pero encontré esta carrera que me llamó la atención y me gustó, porque mezcla muchas áreas, no solo la programación, sino también las telecomunicaciones, cloud computing, ciberseguridad, etc., cosas que me gustaría aprender, pero no sé por cuál decidirme.

Por eso vine aquí para pedirles su honesta opinión. ¿Cuál debería elegir, Telemática o Informática?",neutral
"NEM para ingresar a ing civil informática en la USM Postulé a Ingeniería Civil Informática en la USM con nem de 6.775 durante el primer período, pero se demoran caleta en dar resultados, pensé que los darían antes de la PAES como vi que hicieron en otras U pero nada. 

Me tiene ansiosa la verdad y no sé si haya alguien que cache o que estudie en la USM que sepa más o menos el corte para la Admisión especial con NEM en esa carrera?? 

Estuve viendo igual posts de acá pero no encontré mucha información al respecto como para guiarme al menos :(",negative
"Ing civil metalúrgica, ¿USM o PUCV? Hola, quiero saber qué universidad sale más rentable para ing civil metalúrgica. La usm y la pucv son mis principales opciones, aunque también me gustaría escuchar otras opciones, la distancia no es un inconveniente en sugerencias. Otra cosa que quería conocer es el tema de becas en ambas universidades.",neutral
"matricula usm, ayuda gente de la usm... qué documentos piden para la matricula??? para dejar todo listo para la prox semana",neutral
"Ing. Comercial en la Usm Hola Hola Hola!!

Cómo sale en el título, voy a Ing. Comercial en la usm, específicamente en la casa central :)
Quería ver si hay algunas personas por aquí que me puedan dar algunos consejos de la carrera, como: cuáles son las materias más difíciles, si es recomendable llevar alguna laptop/tablet u otra cosa, entre otros consejos que puedan ofrecerme.

¡¡¡Muchas gracias de antemano!!!",neutral
"Tecnico en energias renovables INACAP o tecnico en control medio ambiente USM Estoy entre esas dos carreras, ambas me llaman la atención, lo que me genera dudas es energias renovables, entiendo que un electrico con un curso de energias renovables, fácil puede hacer la misma pega..

Orientación porfa!!",neutral
Bachillerato UCH o Plan comun en la USM y eso ando entre esas ambas carreras para elegir mientras igual buscara el mejorar mi puntaje de ciencias y ver si podria lograr entrar al college de la catolica (y de paso diganse si es realista lo de la idea de poder mejorar ciencias y tener porfin 1000 en m1 para el college),neutral
"Cambiarme de la usm a la pucv Hola, este año tome la decisión de irme de la CC de la usm porque ya no doy más para seguir en la u, me encanta estructuralmente hablando la u, es hermosa y la comida muy rica jjsjs pero mate 2 me destrozó. Tengo pensando cambiarme a la pucv y quisiera saber cómo es el tema con la gratuidad y los datos necesarios. Se que necesito ciertos certificados, soy de la generación 2024 pero no sé si mi nem del 2023 sea útil para la postulación por via cambio de universidad. A parte de los certificados como es el proceso para quedar en la pucv?, estoy algo confundido y con miedo sobre eso asi que por eso hago este post",neutral
Ingenieria civil mecanica Udec o Usm Tengo la oportunidad de entrar a ambas y me gustaría saber cual me conviene mas en cuanto empleabilidad y preparación.,neutral
"Ing Civil Informatica en la ULS, USM o UCH Ya empeze cuarto medio, y ya tengo decidido que quiero estudiar ing civil en informatica, pero la pregunta es, deberia quedarme a estudiar en mi ciudad en la ULS? O trato de irme de foraneo a alguna u del top3? ",neutral
"Téc construcción en USM / ingeniería o construcción civil en Instituto INACAP/ DUOC / AIEP. Tengo posibilidad de entrar a estudiar a la USM, soy de viña y he sentido profundo interés por la construcción, tengo posibilidad de el próximo año entrar a estudiar el técnico en la USM y también estudiar la ingeniería en un IP, son mis ambas opciones pero quisiera saber qué recomendación podrían darme según sus experiencias en estas áreas, sin más decir gracias por su atención.",neutral
"ingeniería civil industrial usm # quiero estudiar ingeniería civil industrial en la uc o en la uch, pero no me dió el puntaje para ninguna de las dos y quedé en la usm. qué es mejor, volver a dar la prueba o matricularme? me da miedo la dificultad de la usm y no me gustan las clases de educación física. además, el enfoque que tiene no es lo que busco. ",negative
"UdeC vs USM, soy de Mejillones Voy pa ing. plan común, cuál me recomiendan, me alcanza pa las 2 ",neutral
"Ayuda con la USM 😭😭😭 Tengo una duda respecto a la USM, esta dice que es técnica, eso significa que las carreras son solo técnicas o como?, no entiendo eso, porque siempre dices técnica, ayuda por favor ✋😔",negative
"Ingeniería civil plan común USM Realmente vale la pena entrar al Plan Común De la USM?
Estoy por 9 puntos sobre el corte y la USM me llama mucho la atención como universidad y la que más me gusta. Quiero ingeniería civil industrial, pero obvio, no me alcanza el corte directo. Igual tengo mucha incertidumbre porque ya es proceso de postulación. Porque estoy entre ing. civil industrial UDP directo o USM Plan Común. 
Mi otra preocupación, es lo que suba el corte comparado con lo del año pasado. Porque admisión 2025 estaba el corte en 792 y ahora subió a 815, entonces subió mucho. Aunque la M2 estuvo muy compleja, no creo que regularice mucho los puntajes. No sé que opinan ustedes. ",neutral
"experiencias sobre cambios de usm a ingenieria uchile? Busco gente que haya hecho el **cambio desde otra universidad a Ingeniería en la Uchile**, idealmente desde una carrera como comercial (aunque no es estricto, solo busco experiencias similares). Mi principal razón es el ambiente en la usm no me he sentido cómodo socialmente, la veo muy cerrada, con grupos muy formados y poca diversidad. Académicamente, la usm es muy exigente, sobre todo en Matemática, pero me siento con la base suficiente para aguantar el ritmo de la UChile si lograra entrar, qué tan difícil es conseguir un cupo y que te acepten? Necesito info sobre ese proceso, cualquier experiencia sirve :)",negative
"lista de espera usm vitacura con mis puntajes quería a 1,8 del corte, qué posibilidades de entrar creen que tenga, es en ingeniería comercial 😔😔",neutral
"Residencia para la USM? Soy de Temuco y quiero ir a estudiar a la USM pero necesito encontrar pensión, alguien ha ido desde región ha estudiar allá? Saben de alguna pensión cerca de la u? Cuánto cuesta aprox?",neutral
"Ingeniería UC vs UCH vs USM Buenas,quería preguntar a gente que sepa del tema,cuáles son realmente las diferencias entre las 3 u?Por qué siempre me dicen que en ing son las tres mejores pero no sé cuál se adapta más a mi",neutral
"Tips para astrofísica USM? Quiero entrar a astrofísica en la USM ahora el 2026 y quería preguntar si alguien tiene recomendaciones para lecturas de verano o algo por el estilo para empezar un poco. El 2025 entre a Beauchef (planeando en especializarme en astronomía igualmente) y sufrí mucho al principio del primer semestre por estar mal preparada. 

Acepto cualquier tip!",neutral
"ingenieria civil informatica en la usm es recomendable estudiarla?
como es el campo para quienes salieron?",neutral
consejos sobre ing en minas en la usm help,neutral
comercial uc o industrial usm aaaa ayuda!! no se que carrera elegir; tengo esas dos opciones hasta el momento 🫠 sugerencias?? ,neutral
"Ingieneria en construcción USM Hola , para los que han hecho continuidad de estudios en la USM, que tan difícil fue hacer esa continuidad de estudios trabajando??? Y cuántas horas les dedicaban al estudio diarios estudiando ingieneria en construccion???cuenten sus experiencias please ",neutral
"Cambio de malla USM, ¿Qué conlleva? Hola buenas, este año estoy por meterme a la USM en ICE, pero ahors me surgio una duda: el cambio de malla. Alguien podria decirme lo que conlleva?",neutral
"Hola busco trabajo part time Hola soy un estudiante universitario de la usm, que busca un trabajo part time , alguna recomendacion ",neutral
"La Universidad Diego Portales (udp) es buena para ingeniería civil industrial en 2024? Hola gente, este año son los resultados y periodos de matriculas, pasa que yo quería quedar estudiando ing civil ind. en la Usm o Usach, ya que la Puc o la U de Chile las veía muy lejos, bueno al final me quede muy cerca de la Usm y de la Usach, pero igualmente quede en la Diego Portales, ya me matricule, pero no estoy muy seguro si me arrepentiré de no haber esperado otro año y entrar en una U mejor, ustedes que opinan?",neutral
